id,article_title,article_language,journal_title,jounral_abbreviation,journal_issn,article_jvolumn,article_jissue,article_jcreated_at,article_pagination,author_list
539034,Cognitive impairᩍment and risk of cardiovascular events and mortality.,gne,nan,.J traeH .ruE,1522-9645,33,14,1/12/07,1777-86,{Salim YusufMartin O'DonnellCraig AndersonIrene MarzonaPeter SleightJeff ProbstfieldAntonio DansPeggy GaoJackie BoschKoon Teo}
13601,Cookqrison ly thnkvl iuwinkons lh wivdka-hkndoe xnrtgior zcudldte uhyamvic gxcknwgrubtuoms osing rpkputer navnearyon.,xig,Knee surgery sports traumatology arthroscopy : official journal of the ESSKA,csorhtrA lotamuarT stropS gruS eenK,1433-73Ǎ47,18,0,nan,9-2821,{Travis G MaakThomas L WickiewiczVolker MusahlJames E VoosAndrew D Pearle}
556624,Fludarabine vs cladribine plus busulfan and low-dose TBI as reduced intensity conditioning for allogeneic hematopoietic stem cell transplantation: a prospective randomized trial,nan,nan,nan,nan,39,4,1/7ħ/01,193-9,{D. J. WeisdorfD. DouekY. TanL. J. BurnsJ. S. MillerB. R. BlazarM. AroraT. DeForM. L. MacMillanM. MarkovaJ. E. WagnerJ. N. BarkerT. Repka}
36253,[Limited experience in adrenocortical function tests in infants].,jpňn,nan,Horumon To Rinsho,?,16,nan,Alabama,ÿ273-6,{Y HiroseS KurataY Abe}
nan,Does this patient have obstructive sleep apnea?: The Rational Clinical Examination systematic review.,gne,-1,nan,nan,310,7,1/13/08,731-741,?
720372,APPLICATION OF AGING MANAGEMENT STRATEGIES FOR REACTOR VESSEL INTERNALS AND CORE SUPPORT STRUCTURES,nan,Proceedings of the Asme Pressure Vessels and Piping Conference 2010 Vol 7,nan,nan,0,nan,1/10/01,277-286,{H. Q. XuM. SnyderS. FyfitchA. ChetaG. BezdikianV. N. ShahT. R. LiszkaiH. CharkasN. GuptaY. ShojiC. S. BajwaC. MayM. SanwarwalaM. BrumovskyI. Ezekoye}
863342,Molecular detection of hepatitis B virus: Recent developments,nan,nan,nan,nan,nan,1,1/5/01,33-43,{B. WeberA. Berger}
260745,The ex vivo antimicrobial activity and colonization rate of two antimicrobial-bonded central venous catheters,nan,nan,nan,nan,28,0,1/11/01,141,{F. ColettaS. D'ArienzoP. SansoneC. AurilioM. C. PaceG. ZagariaR. Stumbo}
515149,Is prolonged use of computer games a risk factor for deep venous thrombosis in children?,nan,Clinical medicine (London England),nan,14ǔ73-4893,nan,2,nan,58-69,{Rigyavd J. W. Mugcin}
641972,[Pelvic floor training for women with urinary incontinence].,dan,nan,nan,1603-6824,16 9,4,12/7/02,593-5,{Sren BrostrmGunnar Lose}
699523,Regulating free speech,English,nan,nan,nan,23,2,1/1/91,813-982,{David Dyzenhaus}
946112,Older Women in the Homeless Shelter: Personal Perspectives and Practice Ideas,nan,-1,nan,0895-2841,32,4,1/8/01,360-374,{Jennifer Davis-Berman}
nan,Ethically justified system-level decisions in health care: Toward a decision support workbook for healthcare leaders,nan,gnireenignE dna secneicS ehT :B noitceS :lanoitanretnI stcartsbA noitatressiD,nan,-94325,70,1,1/9/01,238,{Bashir Jiwani}
850418,Takayasu's arteritis with multiple intracranial aneurysms,nan,HDKAYWSIACHE WRTZGILUIS MIE JBORPILFI INURANRANIZLLXN XIEURNFJTK,nan,0428-8246,23,1,nan,Some college,{Matsumoto K.Yamada F.Fukuda S.}
125302,Intravenous cyclophosphamide in patients with chronic systemic inflammatory diseases: morbidity and mortality.,Some college,nan,Some college,0960-8923,37,22,1/8/Ī03,Some college,{E A M JanssenC BrodinP OgreidK KjellevoldL G GranssonL VattenP R RomundstadR OmdalK Wildhagen}
168889,Trends in domestic violence service and leadership: implications for an integrated shelter model,nan,nan,Adm Policy Ment Health,0894-587X,27,5,1/1/00,25-933,{M. B. PhilipR. A. Hayward}
6397Đ7,nan,ŋpol,-1,Gear Shonatkl,Gpg-53,20,6,1/1/67,nan,{H Zakrzewska-Jastrzebska}
782211,nan,English,nan,nan,nan,82,99,1/13/01,875-81,{V. JcvaenF. G. LatoaX. da Cfuz QceP. X. DpkvqngaJ. J. OopxsH. R. Orurga}
473599,Trends in domestic violence service and leadership: implications for an integrated shelter model,nan,ygolorhpeN dna ygolorU lanoitanretnI,nan,nan,45,5,Ŕ1/13/01,Some college,{Yh HsuMs YaoCs WongCh BaiMy WuYf LinCy HsiangKw TamYw LiᭉHf Hsiang}
915463,[Commentary on] Gait changes in children with cerebral palsy following a neuro-developmental treatment course. Ada㺞ms M Chandler L Shuhmann K PEDIATRIC PHYSICAL THERAPY 2000;12:114-120,nan,Pediatric physical thਯerapy,nan,nan,14,1,1/2/01,55-5Ǆ6 2p,{J. Slusarski}
476199,Cognitive Outcomᇆe of Pediatric Moyamoya Disease.,Some college,Jourjwl og Kkfqai Heurosidgicap Sowjerf,J Korean Neurosurg Soc,?,57,6,nan,440-4,{Ju-Seong KimDong-Seok KimEun-Kyung ParkKyu-Won Shim}
405141,nan,nan,Bmj-British Medical Journal,nan,nan,347,?,1/13/01,fĬ5001,{Rmn K van AsmRrdvk N FhIrqk KkeaknKosnn W MdgsmnFikmani IjcjurcQj VynWxkrxr C Ciolebv}
213794,A biomechanical study of replacement of the posterior cruciate ligament with a graft. Part II: Forces in the graft compared with forces in the intact ligament,nan,nan,nan,nan,nan,nan,1/1/97,381-386,{K.L. ArmstrongG.A.M. FinermanK.L. MarkolfM.S. ShapiroJ.R. Slauterbeck}
408902,The safety and immunogenicity of rotavirus vaccination in infants with intestinal failure,nan,J. Pediatric Infect. Dis. Soc.,nan,-1440Ħ0,3,11,nan,57-65,{McNeal M.M.Sanchez S.E.Jacob S.Javid P.J.Englund J.A.Horslen S.P.}
89897,A growing lesion on the cheek.,eng,-1,nan,2168-619X,140,?,1/14/04,383-4,{Travis G MaakThomas L WickiewiczVolker MusahlJames E VoosAndrew D Pearle}
18ļ7552,Mapping Curriculum to Ed Tech and Industry Standards,nan,Molecular Biology Reports,nan,0301-485ǃ1,38,nan,1/11/01,4ǌ327-4335,{Y. WuZ. Y. XiaH. M. LiuS. Q. LeiL. ZhangJ. J. XuB. ZhaoJ. Dou}
144339,nan,eng,Journal of aerosol medicine and pulmonary drug delivery,J Aerosol Med Pulm Drug Deliv,1941-2703,26,4,1/13/08,223-7,?
6565Ŀ18,.sisylana-atem dna weiver citametsys a :stnemecnuonna ecivres-cilbup gurd-ticilli-itna fo ssenevitceffe ehT,Some college,Jotruwm lf episdkiology sif cjnlunity mealgh.,nan,nan,65,10,1/11/10,834-40,{Julio S G MontanerKora DebeckEvan WoodThomas KerrEdward J MillsDan Werb}
925315,[Use of statins prior to or following invasive therapy for coronary artery disease].,eng,CHUNG-HUA I HSUEH TSA CHIH [CHINESE MEDICAL JOURNAL],Chung Hua I Hsueh Tsa Chih,0376-2491,85,?,10/26/05,15-Jul,{David B HoytSandro B RizoliAndrew J BakerEileen M BulgerWolfgang G JungerJoseph CuschieriShawn G RhindPang N Shek}
13030į8,Malignant lymphomas of the oral region.,engfre,Sanednat Fogvva Denhal Ferbists auatvxrpy,Cqn Hisvef Vzkr Farg Q,0584-5400,nan,nan,Alabama,7-Jan,?
237077,Women's experiences of acupuncture during labour,nan,British Journal oકf Midwifery,nan,096ǒ9-4900,21,4,Alabama,nan,{Irena Anna FreiKatharina FierzAngela PoatMartina Gisin}
600827,Nutritional supplementation for hip fracture aftercare in the elderly.,eng,Cochrane Database Syst. Rev.,nan,nan,-1,4,1/1/00,CD001880,{Q SewbelkH H Hqnfkll}
851773,Quality of life factors and survival after total or extended maxillectomy for sinonasal malignancies.,Some college,Mjtrual Jf Ixap Shq Kcbilluvacial Akxywdh: Ufviciaj Jougjak Od The Wmetixan Xwrocizdulj Of Urap And Mqsyunmfacixl Sidgeind,nan,1531-5053,0,?,1/6/01,nan,{James MurphyAmal IsaiahJoshua E LubekJeffrey S Wolf}
67292,Epithelial Splicing Regulatory Proteins 1 (ESRP1) and 2 (ESRP2) Suppress Cancer Cell Motility via Different Mechanisms.,nan,The Journal of biological chemistry,Some college,1083-351X,289,40,3/14/10,27386-99,{Mitsuyoshi MotizukiKeiji MiyazawaTetsuo KondoKeisuke MasuyamaMasao SaitohHiroki IshiiRyohei KatohKei SakamotoShota Tanaka}
129698,Combined and sequential treatment of oral and maxillofacial malignancies: an evolving concept and clinical protocol.,gne,Chinese medical journal,Eur J Prev Cardiol,03ǝ66-6999,121,nan,5/8/10,Some college,{Vhp-yuck ZfqnfEei-lio ZkuLha-wei Zkemy}
254327,Evalmaemih of w eirkvfll oi exhdtnxz-vaszc jeqirlkv vor soruaj ukxoganww 'hysuvkwns.,eng,-1,nan,0962-7480,nan,2,1/8/03,6-May,{Jos H Verbee₰kRob KokJan L HovingFrederieke G SchaafsmaFrank J H van DijkPaul B A Smits}
55Ļ6803,Neurocognitive assessment in 13 patients affected by muchopolysaccharidosis IVA (MPS IVA),nan,nan,nan,nan,37,1,nan,Some college,}iniraP .RillagereM .PairbalaC .MonimicnoB .AillehciN .FocineM leD .M .BinirepsaG .SidlogiR .M{
73792,Semi-automated scoring of pulmonary emphysema from X-ray CT: trainee reproducibility and accuracy.,Some college,Egdirlnkaigzj tjfmsolljf snd phesnacolkgy,.locamrahP .locixoT .norivnE,1872-7077,37,1,9/1/00,9-Mar,{Marlon BargEmilio L StreckLara M GomesVanessa M AndradeDaniela D LeffaFelipe Dal-PizzolFabricia PetronilhoFrancieli VuoloMilena Carvalho-SilvaFernanda BalbinotGislaine T Rezin}
484Ł593,New anticoagulants for atrial fibrillation.,eng,Journal of clinical anesthesia,nan,1558-2027,nan,6,1/9/06,nan,{Raffaele De CaterinaGiulia RendaSteen Dalby Kristensen}
254327,Ptr Hddmtv Countr -- Uioawklnd Heamhh anc Sodmal Sms[wtltjdv znpug Brbab Anmrigiban Psuiue ln Pgcario.,English,Dissertation Abstracts International A: The Humanities and Social Sciences,nan,nan,15,0,nan,nan,{Michelle Firestone}
105981,[Indirect anastomoses ზfor moyamoya disease].,nan,Science (New York N.Y.),nan,?,316,nan,11/7/05,1237-48,?
408198,nan,eng,-1,nan,nan,254,6,12/19/13,1455-1462,{H H_gerW SieghartT KlausbergerI MilenkovicM VasiljevicD Maurer}
þ30272,Glial cells in amyotrophic lateral sclerosis.,nan,nan,nan,1090-2430,^-1,-1,5/22/14,nan,?
623367,Diagnosing acute cardiac ischemia in the emergency department: a systematic review of the accuracy and clinical effect of current technologies㕇.,xnn,Annals of Emergency Medicine American College of Emergency Physician'Ỷs Research Forum,nan,0196-0644,37,nan,1/1/05,453-60,{S. A. FrenchM. StoryP. J. Hannan}
13408,Eczema - quiz.,eng,Paediatrics & child health,[aediwtr Chlld Kezltg,nan,nan,2,nan,nan,nan
449003,Stroke in children with posterior fossa brain malformations hemangiomas arterial anomalies coarctation of the aorta and cardiac defects and eye abnormalities (PHACE) syndrome: A systematic review of the literature.,nan,nan,nan,nan,52,0,nan,nan,{NULL}
299297,Employing a youth-led adult-guided framework: why drive high? social marketing campaign.,nan,Family & Community Health,nan,0160-6379,Some college,4,nan,319Š-330,nan
nan,Review of Handbook for Working with Children and Youth: Pathways to Resilience across Cultures and Contexts,English,nan,nan,nan,47,3,1/6/01,230-232,nan
592663,selaW htroN ni noitalupop lanoiger a morf stneitap citpepsyd tluda ni sepytoneg dna snrettap ecnatsiser citoibitna irolyp retcabocileH,eng,nan,nan,nan,54,2,1/4/01,435-40,{I. DelgadoJ. Vega}
520843,nan,qig,AJR. American Journal Of Roentgenology,nan,0361-803X,184,5,1/5/05,1652-6,nan
460786,Splinting osseointegrated implants and natural teeth in partially edentulous patients: a systematic review of the literature. [Review],nan,nan,nan,nan,44,0,nan,nan,nan
866131,Long-term subcutaneous recombinant interleukin-2 as maintenance therapy: Biological effects and clinical implications,nan,Cabcsv Bioghztapi,nan,1062-8401,10,?,Alabama,Some college,{V. LorussoM. De LenaM. GuidaM. CorrealeI. AbbateA. LatorreA. CasamassimaM. D. Musci}
20010101,School soft drink intervention study,nan,Cardiology in the young,nan,1468-5833 (Electronic),329,7462,1/4/01,E315-6,{S. A. FrenchM. StoryP. J. Hannan}
Ľ436781,Factors Predicting Success and Failure for Cervical Facet Radiofrequency Denervation: A Multi-Center Analysis,nan,nan,nan,nan,0,0,nan,nan,?
7969Ŀ00,Chronke vjooarnmenv stkqruke sn im'irvakg gause lf xmek-rxmsdvd hpker jyon qurordfe,nan,Rheumatology (Oxford),Rheumatology (Oxford England),1462-0324,44,11,1/5/01,1442-6,{P. D. FabricantM. P. BostromC. J. DyD. M. Dare}
491837,ainmosni tlucco rof ecnedivE :sresu eniacoc cinorhc ni ecnaligiv dna gninrael larudecorp tnedneped-peels peelS,Shglyfj,nan,nan,nan,nan,?,1/6/01,Some college,{R. T. MalisonE. F. Pace-SchottV. CoricP. T. MorganR. StickgoldZ. H. Sahul}
nan,A dctseiitg meghkdpjmgn wur fdjrssplrsyky vidwo QjW eyamnaunok,nan,nan,nan,nan,00,0,1/14/0ŕ1,nan,{E. Anejekbh U. Smn K. Ivzavhor}
525874,Potential for inter-observer and intra-observer variability in x-ray review to establish stone-free rates after lithotripsy.,eng,nan,nan,0022-5347,Some college,3,nan,559-62,?
26475,Situating universal design architecture: designing with whom?,ETG,Disability and rehabilitation,nan,1464-5165,25,-1,Alabama,6-Kwm,{Pabn Lonss}
nan,nan,ENG,Journal of stroke and cerebrovascular ╢diseases : the official journal of National Stroke Association,Some college,1532-8511,10,?,7/24/15,nan,{Yibin FangPengfei YangJianmin LiuYi XuQinghai HuangWenyuan ZhaoDongwei DaiYan Chen}
719389,Subjective states: A more robust model,nan,nan,nan,?,6m7,22,1/9/01,408-427,nan
467318,The fundamental role of bone morphogenetic protein 15 in ovarian function and its      involvement in female fertility disorders.,nan,nan,nan,nan,0,?,nan,nan,nan
821382,Giant-cell tumour of the knee: the condition of the cartilage after treatment by curettage and cementing,nan,J Bone Joint Surg Br,Some college,0301-620X (Pcijt) 0301-620b,89,3,1/7/01,361-5,{NULL}
664795,Diagnostic accuracy of endoscopic ultrasound-guided f⻹ine-needle aspiration for solid pancreatic lesion: a systematic review.,eng,nan,Some college,1ǃ432-1335,138,9,Alabama,1433-41,{Ramccffny ZginWanbqi GehdJijng CheiFunnien DowHin Lu}
102180,Health literacy and child health promotion: Implications for research clinical care and public policy,nan,International journal of obesit඿y (2005),nan,1476-5497,36,66,Alabama,843-54,{R CarraroM F RasmussenL NiskanenA HarperN FinerS R_ssnerM KunesovaL Van GaalM E J LeanA AstrupA RissanenM J Savolainen[Collective Name] NN8022-1807 Investigators}
258486,20010101,eng,nan,nan,nan,110,11,1/10/01,265-9,{Kathy W HosigSharon M Nickols-RichardsonKavita H PoddarSusan E DuncanEileen S Anderson}
961081,Three Abstracts on Chinese Research,nan,American Acupuncturist,nan,1520-7714,63,0,1/13/01,25-26,{NULL}
52681,Retrograde nailing of humeral shaft fractures,nan,nan,nan,nan,0,350,1/1/98,2ā6-39,{M. RunkelJ. BlumP. M. Rommens}
828156,Behavioral and cognitive measurements predict scores on the MAST: a 3-year prospective study.,eng,Alcohol Clin Exp Res,Endmvolisj dlpniedl avs cx'dtjmsntaj etazxrch,014ǅ5-6008,20,77,10/1/96,1173-8,{V HesselbrockA W Deckel}
812757,Development of a SNP genotyping panel and a medical decision support algorithm to predict drug response in schizophrenia,nan,Klinik Psikofarmakoloji Bulteni,Klin.Psikofarmakol.Bul.,1017-7833,21,0,1/7/10,S156-S157,{Y. A. SonG. UstunkarM. A. DokeH. A. DomY. Y. Tuncel}
713518,ELDERLY AND PHYSICAL ACTIVITY: BENEFITS AND CHALLENGES IN SEARCH FOR LIFE QUALITY.,nan,-1,nan,1981-8963,6,7,1/12/11,2761-2769ʞ 9p,nan
180977,nan,nan,nan,nan,nan,33,0,1/4/01,nan,{K. N. GjrteulJ. VldeB. L. BoarkQ. RwtelonerQ. E. D. Fjmx}
828214,Transference-focused psychotherapy v. treatment by community psychotherapists for borderline personality disorder: randomised controlled trial.,eng,The British journal of psychiatry : the journal of mental science,Br J Psychiatry,1472-1465,nan,5,1/10/05,389-95,{Philipp MartiusAnna BuchheimPeter BuchheimSusanne H_rzMichael RentropCord BeneckePeter SchusterMelitta Fischer-KernStephan Doering}
176160,The changing residential environments of older people,nan,nan,nan,nan,33,?,Alabama,022-702,?
677752,W rjstdmwblc vexief mf hhq sbsticap nwsanjqit kn lqrce incisiomwn ixgnlw.,eng,GaneTefitws(T),nan,4029-8421,91,1,1/15/02,89-101,{L TimmermansJ C SliekerJ F LangeE B DeerenbergJ JeekelD P HogerzeilP H C Eilers}
20010101,Fast-food habits weight gain and insulin resistance (the CARDIA study): 15-year prospective analysis.,eng,-1,Lancet,nan,341,9453,1/ĥ5/01,ü36-42,{David R JacobsDavid S LudwigCara B EbbelingAlex I KartashovMartha L SlatteryLinda Van HornMark A Pereira}
14128Ĳ2,Early prenatal survival in relation to the parental environment in sheep: A review,nan,Small ࢴRuminant Research,nan,0921-4488,29,2,Alabama,143š-156,?
nan,20010101,nan,nan,nan,nan,Some college,nan,1/10/01,163-176,?
621640,20010101,Some college,International psychogeriatrics / IPA,Int Psychگogeriatr,1041-6102,12,2,6/1/00,231-47,{J McCuskerF PrimeauM ColeL HanF Bellavance}
647583,Pulmonary rehabilitation programs for patients with COPD.,nan,Jornal brasileiro de pneumologia : publicacao oficial da Sociedade Brasileira de Pneumologia e Tisilogia,nan,1806-3756,37,nan,1/11/07,544-55,{Xnw Kaejq Bspnistx OvnveefDcnid Apzjsndwp YmizlazSkaine Cewvjxo MebefoPsexu Gogl FsllwuLafiw ge Wtijw LajaMdcmo KnirsnRdnmxp Xardakfo DulitfJeobant Mcrt_nev-MexaCivagfu Ulcs NozlFertwndo Crzd QekrmvistgrKjx Robrweo Ncwdim}
361080,Pathophysiology of paradoxical embolism: evaluation of the role of interatrial septum anatomy based on the intracardiac echocardiography assessment of patients with right-t䞎o-left shunting.,nan,JOGNN: Journal of Obstetric Gynecologic & Neonatal Nursing,nan,nan,41,0,1/12/01,2-131S,{Corinn Taylor}
283168,[Pharmaco᤻therapy for conduct disorder in children and adolescents],Some college,Harefuah,nan,nan,Some college,7,nan,434 534 6-124,{T. LevyY. Bloch}
52633,nan,nan,nan,nan,nan,62,0,1/13/01,1261-9 ST  - Multicenter randomized placebo-controlled trial of amitriptyline in children with functional gastrointestinal disorders-,{W. De GrooteD. StoffelenK. GovaertsP. ReyndersP. L. BroosJ. Rondia}
20010101,[vogqstcrone gdcspjor ORONJNS and +331G/Z pjpvkot'iiaks vonvet fusxepdubipith no kvcrian gakcqg: c oeha-skdjnslf nesxc mu 17 vfudnes.,nan,Tgluut volkogy : dhe nlurnal of tfe Uktwrgaeiojal Sjenefg flt Oicjdcytlppkenban Tiklotu akd Mecicyuf,TumouѠr Biol.,1423-0380,35,nan,1/14/03,2427-36,nan
373015,Gene analysis of steroid 5 alpha-reductase 1 in hyperandrogenic women,nan,Croatian Medical Journal,J Anesth,0353-9504,Some college,4,nan,664-669,{B. HeljicR. KomelI. EminovicF. GavrankapetanovicJ. PrezeljJ. Karamehic}
529562,Intravenous insulin treatment in acute stroke: a systematic review and meta-analysis of randomized controlled trials.,Some college,Infegnwtuonaj jokrmwo pv stdpnf : mhwpsuao tpucnxn kx yhe Iggzrtdtiphsl Vttoke Socirty,Int B Atrplc,1747-4949,9,4,1/12/01,nan,{P MichelV PapavasileiouG NtaiosA BargiotaK Makaritsis}
ĸ574242,yduts     evitcepsorp a :setarimE barA detinU iabuD ni noitcarf noitceje     decuder .sv devreserp htiw stneitap eruliaf traeh dezilatipsoH,English,Xhropzqn luorgen kf hferh fajkurf,.liaF traeH .J .ruE,nan,16,nan,1/1ŕ4/01,454-460,{Al Sayed Hussain ASaheb Sharif-Askari NSulaiman SAAl-Mulla AATabatabai SSaheb Sharif-Askari F}
966388,nan,English,-1,Yonsei Medѓ.J.,1976-2437,49,4,10/8/1,Some college,{H. ChoiE. S. KangS. K. LimS. Y. JeongH. C. LeeH. J. KimS. KimY. RheeY. H. LeeJ. H. MoonK. R. KimC. W. AhnB. S. ChaE. J. Lee}
24381,[Anesthetic gases exposure: findings from a 13 year environmental and biological monitoring in a hospital company].,ita,Patologie asbesto correlate in congiunti di lavoratori del settore cemento-amianto.,nan,0387-2951,29,9,nan,411-3,{R WebsterE SpeziS MukherjeeR AdamsS GwynneJ StaffurthB Coles}
nan,20010101,eng,Canadian family physician Medecin de famille canadien,Psychooncology,1715-5258,nan,6,1/10/06,e213-8,{Karen K LamSteven C BrooksLaurie J Morrison}
55809,Diffusion tensor imaging of deep gray matter in children treated for brain malignancies.,Some college,Child's nervous system : ChNS : official journal of the International Society for Pediatric Neurosurgery,Some college,1433-0350,30,4,1/14/04,631-8,{Anna NideckerSiamak ArdekaniE Mark MahoneFirouzeh TannaziJarunee IntrapiromkulMoody WharamLarry J BrantAlena Horsk}
368651,A randomized controlled trial of paracetamol versus morphine for the treatment of acute painful crisis of sickle cell disease,nan,nan,nan,nan,35,5,1/13/01,S149,{R. Rehmani}
423691,Puberty suppression in adolescents with gender identity disorder: a prospective follow-up study,nan,Journal of Sexual Medicine,nan,nan,8,88,1/11/01,925-31,}amsneetS .D .TseirV ed .L .AsinetteK-nehoC .T .PsrejieleroD .A .T{
435904,A meta-analysis of clinical trials comparing mirtazapine with selective serotonin reuptake inhibitors for the treatment of major depressive disorder.,nan,nan,nan,nan,0,0,nan,nan,{Carmelo GraffagninoDaiWai M Olson}
407245,Group physiotherapy provides similar outcomes for participants after joint replacement surgery as 1-to-1 physiotherapy: a sequential cohort study.,wnb,Archives Of Physical Medicine And Rehabilitation,Arch Phys Med Rehabil,1051-1970 1051-1970,90,10,1/12/05,1727-33,{Corinne L CoulterJennie M ScarvellJeanie M Weber}
918698,Sevoflurane postconditioning converts persistent ventricular fibrillation into regular rhythm.,ĺeng,nan,nan,1365-2346,26,9,1/9/09,nan,{Fcnejiann VrzmhTwig ShenNli FcnCukdzivh Chtb}
209138,Frontal and sagittal plane analyses of the stair climbing task in healthy adults aged over 40 years: what are the challenges compared to level walking?,nan,-1,nan,nan,21,10,21/3/1,nan,{S NadeauF MalouinB.J McFadyen}
448268,V'YG UFA14+1G>X aud 2846A>T cxnitypikg xur vje [gscibhiuk og sxteet fnnlfopggikpdmnv-tqlatfe tjribity: D ozfs-djwlydiw,nan,Pharmacogenomics,nan,1462-2416,Some college,4,1/13/01,Some college,{E. IdrizovicA. OdobasicL. DedicA. PasicM. DervisefendicE. Iljazovic-LatifagicA. OdobasicL. Arnautalic}
875733,nan,jpn,Rinsho Byori,Rinsho byori. The Japanese journal of clinical pathology,0428-8246,43,10,1/1/95,Some college,{K. IijimaA. TanimotoY. KitagakiM. HiuraH. FujiwaraS. Ikawa}
386785,Support for nutrition from the older Americans act programs: a clarification on its 40th anniversary,eng,J Nutr Gerontol Geriatr,Journal of nutrition in gerontology and geriatrics,nan,23,nan,1/13/01,Mar-81,{J. L. Lloyd}
927711,Multiple dural arteriovenous fistulas presenting as rapidly progressive dementia.,nan,Cancer,nan,0340-2592,Some college,7,1/14/01,597-605,{Demetrios J. KutsogiannisNeil K. SinglaFrances ChungStephen R. LaneJeremey LevinJoseph V.J. PergolizziBrendan JohnsonLinda BlackburnSonia K. Singla}
nan,The Effects of Cognitive Coaching and Nonverbal Classroom Management on Teacher Efficacy and Perceptions of School Culture.,Evgmixh,nan,nan,nan,0,0,nan,53,{Jennifer L. EdwardsCherie A. LyonsMarcia E. SwordsMary S. RogersKathy E. Grᶸeen}
161847,Changes in glucose tolerance over time in women with polycystic ovary syndrome: a controlled study,Some college,nan,nan,nan,i90,00,1/5/01,-yduts dellortnoc a :emordnys yravo citsycylop htiw nemow ni emit revo ecnarelot esoculg ni segnahC -  TS 24-6323,{A. DA  - Jun DO  - jc.2004-1843 [pii] 10.1210/jc.2004-1843 [doi] DP  - Nlm ET  - 2005/03/31 DunaifA. R. KunselmanR. S. LegroC. L. Gnatuk}
292345,Effects of Test Administrator Characteristics on Achievement Test Scores,nan,-1,nan,978-957-41-6666-4,Some college,0,1/13/11,nan,{Maria PapapolydorouTaslima RahmanWilliam D. SchaferLori Parker}
248064,hcaorppa ralov a morf noitaxif lanretni dna noitcuder nepo retfa tnemerusaem tnemecalpsid ralucitraartni cipocsorhtra erutcarf suidar latsiD,eng,J Orthop Sci,Some college,0949-2658 (Pgknf) 0949-2658,15,nan,1/10/01,502-ü8,{T. KatayamaK. FurutaM. AkahaneH. OnoR. Fujitani}
887041,Age-related driving disorders: screening in hospitals and outpatients settings.,eng,Geriatr Gerontol Int,nan,1447-0594,10,?,1/10/10,288-94,?
471093,[Effect of a dialysis solution with icodextrin on ultrafiltration and selected metabolic parameters in patients treated with peritoneal dialysis],nan,nan,nan,nan,141,9,1/2/01,281-5,{S. OpatrnaP. StehlikJ. RacekJr. Opatrny K.V. SenftF. SefrnaO. Topolcan}
709094,Evidence based practice and advanced competencies in a MHS-CLS program,nan,nan,nan,nan,f24,4,1/14/01,4-47-53,?
369578,Effect of QVA149 on lung volumes and exercise tolerance in COPDἧ patients: the BRIGHT study,nan,Respiraࠂtory medicine,nan,nan,108,nan,1/14/01,584-92,{Blttd BwiqrLfbwr D'DuervaNjcmqplv KrkkxyXtrphenoe KpwnIcy-Mibhczl YzrkGojcnd VdbsrjiDwkal Jsdsywl}
793206,nan,eng,Veterinary clinical pathology / American Society for Veterinary Clinical Pathology,Vet Clin Pathol,1939-165X,44,?,nan,437-41,}renioJ eylleKnosrehpotsirhC W etePillirortsaM aizniCegdirdlooW A ennAraseC adnanreF{
361682,nan,English,Cardiovascular therapeutics,nan,nan,32,5,10/41/1,202-208,nan
732256,A comprehensive assessment of maternal deaths in Argentina: translating multicentre collaborative research into action.,nan,-1,Bull.WHO,0042-9686,85,nan,1/1/01,545-9,{Romero NMdggec RXamlx SKewukjnxik A}
20010101,Human african trypanosomias⩪is diagnosis in first-line health services of endemic countries a systematic review.,nan,Plos Neglected Tropical Diseases,nan,?,54,nan,1/12/01,e1919,{Victor KandeEpco HaskerVee⥞rle LejonJean-Jacques MuyembePatrick MitashiMarleen BoelaertPascal Lutumba}
743394,Overlap of food addiction and substance use disorders definitions: analysis of animal and human studies.,Some college,Neuropharmacology,Neuropharmacology,nan,85,-1,1/14/10,81-ÿ90,?
592201,nan,eng,nan,nan,nan,28,2,1/1/99,4-131,{E. M. QuigleyJ. K. DiBaise}
914007,Primary vaginal cancer and chemoradiotherapy: a patterns-of-care analysis,nan,Physical therapy,Pyhw Thev,0885-3185,89,?,nan,1126-1141,{H. H. HuangJ. HaleL. FettersA. McBride}
20010101,Sga'kxq haammcghoiflpzey voe hre creaenend of hasiuxrgoiss: s rvxjekatic refpfw.,nan,nan,nan,nan,57,0,6/15/92,96-160,?
759501,[Progress in joint international research of demogr㩵aphic and geographic distribution of insignificant middle and high-grade tuberculin skin sensitivity].,Some college,Zeitschrift fr Erkrankungen der Atmungsorgane mit Folia bronchologica,Eur J Clin Nutr,0044-2631,133,1,Alabama,99-106,{N A Clxinsr}
506162,Efficacy of Class 1 elastic compression stockings in the early stages of chronic venous disease. A comparative study.,Some college,-1,nan,?,nan,4,1/14/06,nan,{H VhnF X AunaedtJ L GenughlS Sdsogm}
372697,nan,nan,Blood Reviews,Some college,0717-5491,28,5,90/41/1,Some college,?
