id,article_title,article_language,journal_title,jounral_abbreviation,journal_issn,article_jvolumn,article_jissue,article_jcreated_at,article_pagination,author_list
546048,A systematic review and meta-analysis of trials of treatment of depression from India,nan,ProQuest LLC,nan,978-1-2673-2110-7,0,0,1/2/05,nan,{Talal IbrahimMohamad Al TannirImad M TleyjehAbed AllehibiMusa A GarbatiAbdur Rahman KhanMuhammad RiazAlex J SuttonLarry M BaddourFaisal A AlasmariMushabab AlGhamdiAref A Bin AbdulhakPatricia J Erwin}
979292,Alveolar soft part sarcoma of the uterine corpus. Report of two cases and review of the literature,nan,Journal of sports sciences,J Sports Sci,nan,25,9,1/7/07,1035-46,{Savvas StafilidisAdamantios Arampatzis}
971456,An insulin-like growth factor-I gene polymorphism modifies the risk of microalbuminuria in subjects with an abnormal glucose tolerance,eng,European Journal of Endocrinology,nan,nan,154,5,1/6/01,715-721,{H. A. P. PolsC. M. van DuijinS. W. J. LambertsI. RietveldA. HofmanJ. A. M. J. L. Janssen}
533193,Biofeedback dialysis for hypotension and hypervolemia: a systematic review and meta-analysis.,eng,Nephrology dialysis transplantation : official publication of the European Dialysis and Transplant Association - European Renal Association,Nephrol. Dial. Transplant.,1460-2385,28,1,1/2/09,182-91,{Elie A AklGordon GuyattStephen D WalterRita S SuriReem A MustafaGihad E NesrallahRobert M Lindsay}
970436,Cytokine profiling of young overweight and obese female African American adults with prediabetes,nan,Birth,Cytokine,1678-4464,64,1,1/13/01,310-5,{J. BhagatwalaW. CaldwellD. H. GuoA. MellorH. ZhuR. CaldwellR. LucasS. J. ParikhY. DongS. SridharY. Dong}
437969,Efficacy of Class 1 elastic compression stockings in the early stages of chronic venous disease. A comparative study.,nan,nan,nan,nan,0,0,nan,nan,{NULL}
464335,Stereotactic radiosurgery for spinal metastases: a literature review. [Review],nan,nan,nan,nan,0,7,nan,nan,{NULL}
417782,Pancreatic surgery. A paradigm for progress in the age of the bottom line,ita,Arch Surg,Eur J Anaesthesiol,2314-6141,196,3,1/1/95,240-6,{A. L. Warshaw}
979059,Difference in fascicle behaviors between superficial and deep quadriceps muscles during isometric contractions.,nan,Muscle & nerve,Muscle Nerve,1097-4598,-1,1,10/15/09,nan,{Hiroshi AkimaKazunori NosakaAya TomitaAnthony J BlazevichTakayuki InamiRyosuke AndoKohei Watanabe}
661572,Losing life and livelihood: a systematic review and meta-analysis of unemployment and all-cause mortality.,eng,Social science & medicine (1982),Soc Sci Med,1873-5347,72,6,1/11/03,840-54,{David J RoelfsJoseph E SchwartzEran ShorKarina W Davidson}
72089,Evaluation of a rapidly rotating shift system for tolerance of nurses to nightwork.,eng,International archives of occupational and environmental health,nan,nan,65,5,1/1/94,305-11,{D MinorsJ WaterhouseG GhirlandaG CostaG Tarondi}
245822,[Osteoporosis prevention in patients with low energy hip fractures hospitalized in the orthopedic department],eng,Ugeskr Laeger,Ugeskrift for laeger,0041-5782 (Print) 0041-5782,19,27,1/2/01,Apr-41,{Sandra M WalshShiue Chen}
440401,The vascular depression hypothesis: The influence of age on the relationship between cerebrovascular risk factors and depressive symptoms in community dwelling elders,nan,nan,nan,nan,-1,0,nan,nan,{NULL}
77389,Symptoms tell it all: a systematic review of the value of symptom assessment to predict survival in advanced cancer patients.,French,nan,Crit. Rev. Oncol. Hematol.,1879-0461,84,-1,1/12/10,130-48,{Emile E VoestSaskia C C M TeunissenAlexander de GraeffMarija Trajkovic-Vidakovic}
592817,Isolates and antibiotic resistance of culture-proven endophthalmitis cases presented to a referral center in Tehran,eng,nan,nan,nan,19,3,1/12/01,361-3,{M. M. ParvareshM. HashemiR. SoodiS. NekoozadehS. A. AlemzadehK. G. FalavarjaniM. Modarres}
169270,Public health impact of the 1992 Los Angeles civil unrest,nan,Cardiology in the young,Public Health Rep,0033-3549,108,3,1/1/93,265-72,{NULL}
288711,Laparoscopic reversal of Hartmann's rectosigmoidectomy,nan,Colorectal disease : the official journal of the Association of Coloproctology of Great Britain and Ireland,Colorectal Dis,1462-8910,10,1,1/8/01,81-83,{O. ThuemerS. G. SakkaE. Huttemann}
184949,The situation of Romanian HIV-positive adolescents: Results from the first national representative survey,nan,nan,nan,nan,22,0,1/10/01,562-569,{D. BuzduceaBuzducea Cohen Johnson Lazar Lazar Lejars Lyon Marin McDowell Mardarescu O'Leary Paxton Wood BergerF. LazarE. I. Mardare}
833251,Life stress and the long-term treatment course of recurrent depression: III. Nonsevere life events predict recurrence for medicated patients over 3 years,nan,Journal of Consulting and Clinical Psychology,nan,nan,74,1,1/6/01,112-120,{E. FrankL.D. TorresD. KupferK.L. HarknessJ. GuillaumotJ.E. RobertsS.M. Monroe}
658981,Value of spiral CT in hemodynamically stable patients following blunt chest trauma.,eng,Computerized Medical Imaging and Graphics: The Official Journal of the Computerized Medical Imaging Society,Comput Med Imaging Graph,0895-6111,22,6,11/1/98,447-52,{R TelloK KandarpaR F MundenS HootonR Pugatch}
315926,Preventing injuries through interventions for problem drinking: a systematic review of randomized controlled trials,nan,nan,nan,nan,34,4,1/1/99,609-21,{I. RobertsE. HeitmanC. DiguiseppiT. Dinh-Zarr}
901385,WhatsApp Messenger is useful and reproducible in the assessment of tibial plateau fractures: inter- and intra-observer agreement study.,nan,American Journal of Clinical Nutrition,nan,nan,72,1,nan,277-286,{O. A. LadipoJ. C. Konje}
787529,Rationale design and methods of the HEALTHY study nutrition intervention component,eng,Scandinavian journal of infectious diseases. Supplementum,International journal of obesity (2005),0307-0565,33,0,1/9/01,S29-36,{S. McCormickB. GillisA. VirusM. A. StatenC. MobleyS. L. VolpeJ. BridgmanL. El ghormliD. D. StadlerJ. Hartstein}
431348,Atomoxetine treatment of children and adolescents with ADHD: Clinical questions and answers. (German),nan,nan,nan,nan,0,0,nan,nan,{NULL}
83012,The novel applications of the quantitative analysis of neutrophil cell surface FcgammaRI (CD64) to the diagnosis of infectious and inflammatory diseases.,nan,nan,nan,nan,71,0,nan,nan,{NULL}
385772,Inhibition of cisplatin-induced lipid catabolism and weight loss by ghrelin in male mice.,eng,Endocrinology,Endocrinology,nan,154,9,1/13/09,3118-29,{Thomas SchererJose M GarciaVictor PapushaJi-an ChenMark AsnicarJoanna SmiechowskaBobby GuilloryChristoph BuettnerRoy G SmithAnriada Nassif}
572425,Primary cutaneous large B-cell lymphoma of the legs: a distinct clinical pathologic entity treated with CD20 monoclonal antibody (rituximab).,eng,American Journal of Clinical Oncology-Cancer Clinical Trials,nan,0277-3732,24,3,7/14/07,237-40,{D M Aboulafia}
581864,The Hierarchical Organization of Intellectual Structures,nan,International Journal of Behavioral Consultation and Therapy,nan,1555-7855,16,3,1/6/01,432-438,{Marcie W. HandlerJames K. LuiselliJennifer A. Mautone}
455406,Multiresistance of clinically relevant gram-positive cocci,nan,nan,nan,nan,0,0,nan,nan,{NULL}
696362,Teaching Calculus and Other Challenging Courses to Nontraditional and At-Risk Students at a Research University.,nan,McNeill Mathematics Program,College Teaching,1940-6215,54,6,1/6/01,291-297,{C. G. Mendez}
504206,Tropical infection after a case of total hip arthroplasty.,eng,The Journal of hospital infection,J. Hosp. Infect.,1098-2752,87,2,1/14/07,179-81,{E SennevilleH MelliezV LoviC JosephM DouaudM PradierT BoyerA MeybeckL Fortin-Lebraud}
800900,Chronic pelvic pain.,eng,Best practice & research. Clinical gastroenterology,Best Pract Res Clin Gastroenterol,1433-7347,173,4,1/9/01,593-610,{Andrew Paul Baranowski}
894794,High resolution EPR spectroscopy of C(60)F and C(70)F in solid argon: reassignment of C(70)F regioisomers,English     Italian,Am J Obstet Gynecol,American journal of obstetrics and gynecology,0002-9378 (Print) 0002-9378,25,0,1/12/01,425.e1-6,{K. C. McDermottJ. L. BlomquistV. L. HandaE. C. Evers}
677752,Comparative effectiveness of instructional design features in simulation-based education: systematic review and meta-analysis.,eng,Medical teacher,nan,nan,35,1,1/13/01,e867-98,{Benjamin ZendejasStanley J HamstraRose HatalaDavid A CookAmy T WangJason H SzostekPatricia J ErwinRyan Brydges}
84944,Body mass index and outcome of ASC-H-interpreted cervical smears in postmenopausal women.,eng,GeneReviews(R),Acta Cytol.,Jan-47,12,3,1/3/06,259-65,{Jae Jun LeeSang Yong SongSoomin AhnYoung Lyun OhJi-Youn SungChang Ohk SungYoo-Young Lee}
326944,Infectious diseases. As Ebola wanes trials jockey for patients.,eng,Atherosclerosis. Supplements,Atheroscler Suppl,1567-5688,4,0,1/3/12,29-32,{Andreas M_ggeChristoph HanefeldRainer H B_ger[Collective Name] CARDIAC study investigators}
922795,[Toxicology and clinical significance of base-catalized degradation of sevoflurane to Compound A].,ger,Schlafst_rungen bei kritisch kranken patienten,nan,17-Mar,116,0,1/11/01,S10-3,{R M JonesP Conzen}
768486,Compartmentalization of Fas and Fas ligand may prevent auto- or paracrine apoptosis in epithelial cells,eng,BMJ Open,nan,2044-6055,4,2,1/5/01,151-158,{C. MillsS. DalkinJ. GreenhalghC. WoodL. WoodJ. WrightE. GibbonsN. BlackJ. M. ValderasR. PawsonD. Meads}
428363,nan,eng,Mycoses,nan,0933-7407,44,9,1/1/11,419-21,{Kaija Leena KolhoHanne RintamakiTaina TervahartialaTimo SorsaLaura Makitalo}
519287,A method for determining skeletal lengths from DXA images.,eng,BMC Musculoskelet Disord,BMC musculoskeletal disorders,1471-2474,8,-1,1/7/01,113,{Glen M BlakeTim D SpectorIgnac FogelmanUsha Chinappen-Horsley}
638918,Imaging for target volume delineation in rectal cancer radiotherapy--a systematic review.,eng,Clinical Oncology (Royal College of Radiologists),nan,1433-2981,24,1,1/12/02,52-63,{R WebsterE SpeziS MukherjeeR AdamsS GwynneJ StaffurthB Coles}
111336,The influence of smoking and impaired glucose homoeostasis on the outcome in patients presenting with an acute coronary syndrome: a cross-sectional study.,eng,Psycho-Oncology,nan,2044-6055,4,7,1/14/01,e005077,{Anders HallingHkan OdebergHenrik ForssellJacob OdebergMarie-Louise PerssonLennart RstamIvar VaaraUlf LindbladMichael Freitag}
747279,Systematic review exploring the effect of exercise in pulmonary rehabilitation on depression levels in patients with chronic obstructive pulmonary disease,nan,Physiotherapy,Physiotherapy,nan,97,7,nan,eS502-eS503,{Patil S.Horobin H.}
640230,Consumption of fried foods and risk of metabolic syndrome: the SUN cohort study,nan,Public health genomics,Public Health Genomics,1662-8063,16,4,1/13/01,nan,{A BrandJ Van der HeydenS de VironH Van OyenN Malats}
258108,Impact of seasonality on recruitment retention adherence and outcomes in a web-based smoking cessation intervention: randomized controlled trial,nan,nan,nan,nan,15,0,5/1/99,11-Sep,{Mushro ANiaura R SGraham A LCobb N KFang YCha S}
59308,White matter diffusivity predicts memory in patients with subjective and mild cognitive impairment and normal CSF total tau levels.,eng,Journal of the International Neuropsychological Society : JINS,J Int Neuropsychol Soc,1469-7661,16,1,1/10/01,58-69,{Ramune GrambaiteAnders M FjellTormod FladbyKristine B WalhovdVidar StensetIvar Reinvang}
610641,Comparison between open and closed suction systems: a systematic review.,ENGPOR,Revista Brasileira de terapia intensiva,Thorax,nan,20,-1,1/8/12,380-4,{Luiz Rogrio de Carvalho OliveiraNilza Aparecida Almeida de CarvalhoFlvio C L Cavalcanti Ara_joIzabela Menezes PagottoPaulo Chiavone}
631704,Association between interleukin-10 promoter polymorphisms and endometriosis: a meta-analysis.,eng,Gene,Gene,1879-0038,515,1,2/15/13,493-503,{Qiong ChenWei FanQianhong MaZhongying HuangZhun XiaoShangwei Li}
737786,Overactive bladder: Optimizing quality of care,nan,Am. J. Managed Care,nan,1088-0224,7,2,nan,S46-S61,{Lemack G.E.}
973076,Thyroid-related autoantibodies and celiac disease: a role for a gluten-free diet?,nan,Journal of Clinical Gastroenterology,nan,nan,35,8,1/2/09,245-8,{E. MainardiG. MoscatoA. MontanelliM. DottiR. Nano}
931402,Providing access to specialty care for severely disabled institutional residents: an academic health center telemedicine model,nan,Journal of Health Care for the Poor & Underserved,nan,1049-2089,20,2,1/9/01,415-422 8p,{A. K. MarceeS. P. RoatenJ. B. MorrowK. J. KowalskeL. E. SnellL. L. Goetz}
908690,A robust method for diagnosis of morphological arrhythmias based on Hermitian model of higher-order statistics,English,Biomedical engineering online,Biomed Eng Online,1475-925X,10,-1,1/11/01,22,{T. YamamotoT. TakanoM. TakanoW. HiguchiY. NitaharaK. SaitoD. ShiK. Ozaki}
417373,Mild endoplasmic reticulum stress augments the proinflammatory effect of IL-1_ in pancreatic rat _-cells via the IRE1/XBP1s pathway.,nan,Disease Management and Clinical Outcomes,nan,nan,33,1,1/1/97,15-16,{J. E. Wennberg}
407245,In this issue,eng,Nature: New biology,The Journal of hospital infection,0090-0028,242,-1,3/28/73,110-1,{V YoutananukornP Mantangkasombut}
386327,MicroRNAs: a new piece in the paediatric cardiovascular disease puzzle.,eng,Cardiology in the young,Alcoholism clinical and experimental research,1467-1107,23,5,1/13/10,642-55,{Dalia ElimamKeith A WebsterAhmed OmranFei YinLina A Shehadeh}
695010,Association of Ureaplasma urealyticum colonization with development of bronchopulmonary dysplasia: a systemic review and meta-analysis.,eng,Journal of Huazhong University of Science and Technology. Medical Sciences,J Huazhong Univ Sci Technolog Med Sci,1672-0733,34,9,1/14/04,685-90,{Jia-rui PuDan LiDe-hua YangLi-duan ZhengXiao-dan ZhengHong MeiXuan XiangQiang-song Tong}
191908,Mortality at older ages and moves in residential and sheltered housing: evidence from the UK,nan,Journal of Epidemiology and Community Health,nan,0143-005X,68,6,1/14/01,524-529,{J. FalkinghamM. EvandrouA. VlachantoniJ. Robards}
384767,A multinational study of thromboprophylaxis practice in critically ill children.,eng,Critical care medicine,nan,nan,42,5,1/14/05,1232-40,{Su-Gwan KimJi-Yeon AhnYoung-Kyun KimJong-Wan KimPil-Young Yun}
855912,Asymmetric inheritance of mitochondrial content in aging budding yeast cells,eng,nan,nan,nan,8,24,1/12/01,nan,{E. A. MartinL. F. CostaH. LiY. ZhangM. P. VianaS. M. RafelskiW. F. Marshall}
710727,Physical activity moderates time-of-day differences in older adults' working memory performance.,nan,Euthanasie en andere medische beslissingen rond het levenseinde 1990-1995,nan,0361-073X     1096-4657,32,4,1/6/10,835-40,{Kaija Leena KolhoHanne RintamakiTaina TervahartialaTimo SorsaLaura Makitalo}
816996,Uses of the electrical skin resistance method in the study of patients with neck and upper extremity pain,English,Johns Hopkins Medical Journal,JOHNS HOPKINS MED. J.,nan,19,2,1/1/75,69-74,{C.P. RichterL.H. Riley Jr.}
332032,[New aspects in hernia surgery].,eng,Int J Obes (Lond),nan,0340-2592,44,7,1/5/07,774-9,{S. K. ChaturvediD. CN  - PubMed_140821 DA  - Jan DO  - 10.1097/YCO.0b013e328010ca65 DP  - NLM ET  - 2006/12/05 Bhugra}
275675,An exploration of self-reported negative affect by adolescents as a reason for smoking: implications for tobacco prevention and intervention programs,nan,nan,Preventive medicine,0091-7435,45,2,1/5/01,589-96,{L. PretlowA. RanneB. KrajE. K. LeibachB. Russell}
697880,Diagnosis of peripheral lung cancer with three echoic features via endobronchial ultrasound,English,Birth,nan,nan,132,3,1/7/01,Jun-93,{H. C. ChenS. M. LinC. L. ChouC. T. YuH. P. KuoC. H. Kuo}
640230,A meta-analysis of labor supply effects of interventions for major depressive disorder.,eng,Psychiatric Services.,nan,1075-2730,6,2,1/6/02,212-8,{Justin W TimbieMarcela Horvitz-LennonSharon-Lise T NormandRichard G Frank}
627882,Combined pharmacotherapy and psychological treatment for depression: a systematic review.,eng,nan,Arch.Gen.Psychiatry,0003-990X,61,7,1/4/07,714-9,{Paola BolliniGiuseppe TibaldiBruce KupelnickCarmine MunizzaSandro Pampallona}
480649,Dyspareunia and sexual dysfunction following vaginal delivery in thai primiparous women with second degree perineal tear: A prospective cohort study,nan,Journal of Sexual Medicine,nan,nan,12,0,1/15/01,58,{A. UngkanungdechaC. ChayachindaJ. VeeragulJ. Jisabai}
782541,eComment. EuroSCORE II - corrected in-hospital mortality rate in a modern cohort of patients undergoing cardiac surgery,English,Interactive Cardiovascular & Thoracic Surgery,Interact Cardiovasc Thorac Surg,1569-9285,19,5,1/14/01,6-Jan,{D. G. Nezic}
692358,Quantitative Analysis of Robustness of Dynamic Response and Signal Transfer in Insulin mediated PI3K/AKT Pathway.,nan,The Chartered Society of Physiotherapy Annual Congress and Exhibition: Defining Practice Friday October 17 to Sunday October 19 2003 International Convention Centre Birmingham.,nan,nan,0,0,1/3/01,10-Oct,{A GreenJ LewisC WorsfoldJ Saranga}
836847,Mediterranean diet and metabolic syndrome: an updated systematic review.,nan,Curr. Probl. Cardiol.,nan,-10475,33,5,nan,493-503,{Elefteriades J.A.}
867207,Early predicting of blood component quality by Statistical Process Control,nan,Vox Sanguinis,nan,0042-9007,99,-1,1/10/01,227,{H. JungkW. MadlaV. SchottstedtT. Alt}
253149,Lifetime risk of suicide in affective disorders,nan,The British Journal of Psychiatry,nan,0007-1250 1472-1465,173,6,1/1/98,185-185,{A. S. LeeS. DaviesP. C. Naik}
929971,A geographic analysis of chronically homeless adults before and after enrollment in a multi-site supported housing initiative: community characteristics and migration,nan,American Journal of Community Psychology,nan,0091-0562,48,3,1/11/01,341-51,{R. A. RosenheckJ. TsaiA. S. Mares}
470385,Fetal cleft lip and palate detection by three-dimensional ultrasonography,nan,Ultrasound Obstet. Gynecol.,nan,-8906,16,4,nan,314-320,{Lee W.Kirk J.S.Shaheen K.W.Romero R.Hodges A.N.Comstock C.H.}
734077,A cadaver model to evaluate the accuracy and reproducibility of plain radiograph step and gap measurements for intra-articular fracture of the distal radius.,nan,nan,nan,nan,0,0,1/11/01,nan,{NCT01413984 }
113399,Use of Job Design to Reduce Mechanical Stress on the Back,nan,nan,nan,nan,0,0,nan,507-18,{D. W. Badger}
685178,Rehabilitation of swallowing by exercise in tube-fed patients with pharyngeal dysphagia secondary to abnormal UES opening.,eng,Annual Abstract Supplement,nan,2044-6055,122,5,1/2/05,6-May,{Mark KernKaren DikemanBarbara GrandeMarta KazandjianTerilynn NitschkeStephanie DanielsBenson MasseyReza ShakerCaryn Easterling}
653325,A meta-analysis of two genome-wide association studies identifies 3 new loci for alcohol dependence.,eng,Journal of psychiatric research,J Psychiatr Res,1090-2430,45,9,1/11/11,1419-25,{NULL}
893573,Crowdsourced Multimedia Enhanced Spatio-temporal Constraint Based on-Demand Social Network for Group Mobility,nan,Proceedings of the 23rd ACM international conference on Multimedia,nan,978-1-4503-3459-4,0,0,1/3/06,761-762,{Ahmad QamarMuhammad ShahidMd. Abdur RahmanAhmed LbathAkhlaq AhmadFaizan Ur RehmanAbdullah MuradBilal Sadiq}
56272,Impaired default network functional connectivity in autosomal dominant Alzheimer disease.,nan,Neurology,Neurology,1526-632X,81,8,8/20/13,736-44,{Virginia D BucklesAndrew J SaykinEric McDadeStephen P SallowayAaron P SchultzPeter R SchofieldRandall BatemanAdam M BrickmanNick C FoxJohn C MorrisJohn M RingmanChristopher C RowePaul ThompsonClifford JackBeau M AncesAllison M GoateRobert A KoeppeStephen CorreiaJasmeer P ChhatwalCaroline A SullivanAnne M FaganRichard MayeuxDaniel S MarcusTammie L S BenzingerKeith JohnsonReisa A SperlingChengjie Xiong}
737786,Incidence of multi-resistance in gram-negative aerobes from intensive care units of 10 German hospitals.,nan,International Journal of Oral and Maxillofacial Surgery,nan,0901-5027,40,0,1/11/01,1024-1025,{S. ChristenQ. JiangB. N. AmesM. K. Shigenaga}
680306,Meta-analysis of the effects of sometribove zinc suspension on the production and health of lactating dairy cows.,eng,Muscle & nerve,Horumon To Rinsho,1943-569X,245,5,1/14/09,550-64,{William W ThatcherNormand R St-PierreDale E BaumanJoseph S HoganK Larry SmithRobert J CollierGeorge A MillikenJan K Shearer}
53877,Journal of Health Communication : International Perspectives The Effect of an Internet-Based  Stage- Matched Message Intervention on Young Taiwanese Women ' s Physical Activity,nan,nan,nan,nan,242,0,1/14/01,248-58,{Sheu-jen HuangMaiga ChangWen-chi HungJanie Chang}
504928,Azathioprine for multiple sclerosis,nan,nan,nan,nan,0,4,1/7/01,nan,{S IkawaM SudohM SuzukiS MatsubaraM ShiotaK Kawakami}
198650,Wound care,nan,nan,nan,nan,7,0,1/1/92,27-32 ST  - Wound care-,{NULL}
671386,Comparison between incidental malignant and benign breast lesions detected by computed tomography: a systematic review.,eng,Cancer Research,J Med Imaging Radiat Oncol,1558-2035,57,5,1/1/93,529-33,{Carol E BarnewoltHiroto HatabuMizuki NishinoDeborah LevineHenry A FeldmanJudy A EstroffValerie L Ward}
981412,Plant Kunitz proteinase inhibitor attenuates inflammation oxidative stress and remodeling induced by elastase in mice,nan,European Respiratory Journal,nan,nan,44,0,1/14/01,nan,{N. M. PinheiroR. Almeida-ReisL. OlivaM. A. MartinsM. L. V. OlivaO. A. Theodoro-JuniorE. A. LeickI. F. L. C. TibrioC. M. PradoR. F. RighettiB. T. M. Oliveira}
785472,Streptococcus pneumoniae carriage in the Gaza strip,eng,PLoS One,PloS one,1932-6203,7,1,1/12/01,e35061,{Yh HsuMs YaoCs WongCh BaiMy WuYf LinCy HsiangKw TamYw LiHf Hsiang}
734077,Direct healthcare costs and cost-effectiveness of acute coronary syndrome secondary prevention with ticagrelor compared to clopidogrel: Economic evaluation from the public payer's perspective in Poland based on the PLATO trial results,English,Kardiologia Polska,nan,0392-9590,72,9,1/12/01,823-830,{M. NiewadaJ. PaweskaA. BudajT. MaciochP. Perkowski}
817046,The combined role of serotonin and interleukin-6 as biomarker for autism,eng,AIDS Care,Case Rep.Med.,0301-5548,17,1,1/1/96,nan,{S IkawaM SudohM SuzukiS MatsubaraM ShiotaK Kawakami}
743129,Hormonal and dietary characteristics in obese human subjects with and without food addiction.,nan,Nutrients,Nutrients,2072-6643,7,1,1/15/01,223-38,{Pardis PedramGuang Sun}
392246,Importance of membrane materials for blood purification devices in critical care.,eng,Transfusion and apheresis science : official journal of the World Apheresis Association : official journal of the European Society for Haemapheresis,nan,1473-0502,40,1,1/9/02,23-31,{A. StumpoG. PalmieriM. F. PantusaM. MarascoV. Fuoco}
904889,Myofascial trigger points: Spontaneous electrical activity and its consequences for pain induction and propagation,nan,Chin. Med,nan,nan,15,0,nan,nan,{Ge H.-Y.Fernndez-de-las-Peas C.Yue S.-W.}
360147,Use of alendronate in peri-implant defect regeneration,nan,Current Immunology Reviews,nan,Jan-68,7,4,1/11/01,435-442,{M. A. AlbaS. Prieto-GonzalezA. Garcia-MartinezM. C. CidM. ButjosaG. Espigol-FrigoleJ. Hernandez-Rodriguez}
670289,Quantitative assessment of the influence of common variations (rs8034191 and rs1051730) at 15q25 and lung cancer risk.,eng,Tumour biology : the journal of the International Society for Oncodevelopmental Biology and Medicine,Tumour Biol.,1423-0380,35,0,1/14/03,2777-85,{Bin HuHong-ju MaoJing ZhaoYing HuangRong-huan YuChao Guan}
821702,Cognitive deficits and psychosis in Parkinson's disease: A review of pathophysiology and therapeutic options,nan,CNS Drugs,nan,nan,20,6,1/6/01,477-505,{T. FoltynieR.A. BarkerS.J.G. LewisC.H. Williams-Gray}
188890,Incidence of multi-resistance in gram-negative aerobes from intensive care units of 10 German hospitals.,eng,Scandinavian journal of infectious diseases. Supplementum,nan,0300-8878,78,-1,1/1/91,22-34,{M GimpelS GadolaP CooperK JamesonG DeakinM GodtschailkM StokesC Cooper}
321660,Tuberculosis and high altitude. Worth a try in extensively drug-resistant tuberculosis?,English,nan,nan,nan,189,4,1/14/01,nan,{J. F. Murray}
427455,Cultural humility: essential foundation for clinical researchers.,eng,Health Education & Behavior,Appl Nurs Res,1672-1977,26,6,1/13/01,251-6,{Jutta BeierPeter D'AndreaMichelle HenleyStephanie KornKai-Michael BeehDonald BanerjiDalal Jadayel}
2842,Isolated cerebellar involvement in a case of posterior reversible leukoencephalopathy.,nan,Aktuelle Traumatologie,nan,nan,34,2,1/4/01,64-70,{A. M. NavarN. A. HalseyC. R. Sudfeld}
857402,High resolution EPR spectroscopy of C(60)F and C(70)F in solid argon: reassignment of C(70)F regioisomers,English,Journal of the American Geriatrics Society,J Chem Phys,nan,127,8,1/7/01,84301,{D. A. TyurinV. A. BelovD. N. LaikovA. V. AkimovE. Y. Misochko}
704357,Clinical and radiological results of calcium phosphate cement-assisted balloon osteoplasty for Colles' fractures in osteoporotic senile female patients,nan,J. Thromb. Haemost.,nan,nan,15,14,1/10/01,204-9,{A. SudoS. IshiguroK. Iida}
716785,[Case management for moderate-need patients and recovery: what can we learn from experimental and quasi-experimental studies?]. [Review] [French],nan,nan,nan,nan,31,0,1/2/01,119-125 7p,{Rutherford OMKennedy JSkelton DA}
746065,Anxiety and depression in patients with chronic obstructive pulmonary disease: an open agenda for research.,nan,Rev Med Chir Soc Med Nat Iasi,nan,1047-9511,118,1,nan,39-44,{Ofelia GarciaJo Anne Kleifgen}
738322,Classification of autogenous skull grafts in cranial reconstruction,eng,J Okla State Med Assoc,The Journal of the Oklahoma State Medical Association,0030-1876 (Print) 0030-1876,86,7,1/8/01,327-32,{S. PelofskyP. D. Hunter}
934177,Physical activity moderates time-of-day differences in older adults' working memory performance.,nan,nan,nan,nan,18,0,nan,nan,{NCT00750412 }
