id,article_title,article_language,journal_title,jounral_abbreviation,journal_issn,article_jvolumn,article_jissue,article_jcreated_at,article_pagination,author_list
847287,Why What We Teach Depends on When: Grade and Reading Intervention Modality Moderate Effect Size.,nan,Developmental Psychology,nan,0012-1649,46,6,1/10/11,840-54,{J. FalkinghamM. EvandrouA. VlachantoniJ. Robards}
54613,Diffusion tensor imaging of deep gray matter in children treated for brain malignancies.,nan,nan,nan,nan,0,0,1/1/00,1164-1173 DO  - 10.1002/cncr.11174,{Andrew J WinzelbergHeidi RobertsC Barr TaylorCatherine ClassenHeidemarie ErnstCheryl KoopmanRobert E AdamsGeorg W AlpersParvati DevD Ph}
204215,Say yes? Say no?,nan,nan,nan,nan,0,0,nan,nan,{NULL}
19086,Tobacco-related scenes in television dramas for young Japanese audiences,English,Cancer,Cancer,0-8077-4913-3,120,14,7/15/14,2207-14,{Gary ChisholmEduardo BrueraSwati BansalDavid HuiRony DevMargarita Morgado}
852213,Considerations for the diagnosis and treatment of testosterone deficiency in elderly men.,eng,Revista Brasileira de terapia intensiva,Ann Oncol,1569-8041,24,4,1/13/02,314-21,{C J LangerJ OrsiniJ K HonS R DakhilM F RenschlerR D PageV HirshH ZhangI OkamotoM A Socinski}
475847,Lessons learned and not learned from the SUPPORT project.,eng,PALLIATIVE MED.,nan,0269-2163,13,2,3/1/99,3118-29,{J M Teno}
368651,Role of N-acetylcysteine in prevention of contrast-induced nephropathy after cardiovascular procedures: a meta-analysis,eng,Clinical cardiology,nan,2054-2704,27,11,1/4/01,607-10,{Deepika and Leibowitz Keith and Gowda Ramesh M. and Shapiro Michael and Khan Ijaz A. Misra}
450528,Impact of hepatitis C on survival in dialysis patients: A link with cardiovascular mortality?.,nan,nan,nan,nan,0,0,nan,nan,{NULL}
838034,Clinical course of neuropathologically confirmed frontal-variant Alzheimer's disease,nan,Nature Clinical Practice Neurology,nan,1745-834X     1745-8358,4,4,1/8/01,226-232,{A.U. MonschM. TolnayK.I. TaylorA. ProbstA.R. Miserez}
119186,Smoking and oral cancer.,eng,Journal of dental research,J. Dent. Res.,1699-7980,42,-1,1/1/63,328-39,{A. StumpoG. PalmieriM. F. PantusaM. MarascoV. Fuoco}
274083,Risk profiles among adolescent nonmedical opioid users in the United States,nan,Addictive Behaviors,Addict.Behav.,0306-4603,37,8,1/12/01,974-7,{B. E. PerronQ. FuL. T. WuM. G. Vaughn}
784224,A controlled trial of anterior spinal fusion and dbridement in the surgical management of tuberculosis of the spine in patients on standard chemotherapy: a study in two centres in South Africa. Seventh Report of the Medical Research Council Working Party on tuberculosis of the spine,eng,Am J Perinatol,nan,1473-0502,32,1,1/15/01,1796-7,{D. A. PaulR. G. LockeL. SaimanD. TuttleA. NovitskyA. Mackley}
260769,A controlled trial of anterior spinal fusion and dbridement in the surgical management of tuberculosis of the spine in patients on standard chemotherapy: a study in two centres in South Africa. Seventh Report of the Medical Research Council Working Party on tuberculosis of the spine,nan,nan,nan,nan,24,5,1/9/01,827-836,{M. D. SchmittnerA. JankeD. G. BussenG. C. BeckC. Weiss}
592831,Discontinuing penicillin prophylaxis in children with sickle cell anemia. Prophylactic Penicillin Study II,nan,nan,nan,nan,127,12,1/1/95,685-90,{R. V. IyerG. M. WoodsE. VichinskyT. R. KinneyJ. I. VerterS. T. MillerC. T. HolbrookC. H. PegelowJ. M. FallettaG. R. Buchanan}
464911,Community nursing issues in Maori mental health.,nan,nan,nan,nan,0,2,nan,nan,{NULL}
369162,[Autologous stem cell therapy with surgical myocardial revascularization].,nan,AJR. American Journal Of Roentgenology,Anadolu Kardiyol Derg,nan,9,1,1/9/12,465-6,{Serkan DurduAhmet R__han AkarG_nseli Cubuk_uolu Deniz}
414396,School neighborhood and family factors are associated with children's bullying involvement: a nationally representative longitudinal study.,nan,The Lancet,nan,nan,0,4537,8/13/10,468-493,{NULL}
217524,Reproduction of excursive tooth contact in an articulator with computerized axiography data,English,nan,nan,nan,78,4,1/1/97,1035-46,{Yang MLi JLi YZhou MYang HShi XLi XYuan H}
694007,A conservative treatment protocol of acute lumbosacral radiculopathy syndrome for general practitioner and physical therapist [Dutch],nan,nan,nan,0268-0033 DO  - http://dx.doi.org/10.1016/j.clinbiomech.2015.03.009,0,1,1/1/00,5-Feb,{R F CastienJ van Wagenberg}
704812,Intraoperative stability testing of lateral-entry pin fixation of pediatric supracondylar humeral fractures,eng,nan,nan,nan,27,6,1/7/01,453-60,{N. SmithB. MilneM. ZeniosM. RamachandranD. Little}
962338,Myocardial scar differences between polymorphic and monomorphic ventricular events in ischemic cardiomyopathy: A contrast-enhanced magnetic resonance imaging,nan,European Heart Journal,nan,nan,32,0,1/11/01,94-95,{W. RottbauerV. HombachS. StillerP. BernhardtD. Walcher}
972821,Genetic and phenotypic determinants of blood pressure and other cardiovascular risk factors (GAPP),English,Swiss Medical Weekly,nan,nan,143,0,1/13/01,911-24,{W. FrehnerS. AeschbacherL. RischT. SchonM. RischG. PareD. Conen}
587024,gamma-tocopherol the major form of vitamin E in the US diet deserves more attention,eng,Hepatology (Baltimore Md.),The American journal of clinical nutrition,Feb-65,74,1,1/1/01,6-May,{S. ChristenQ. JiangB. N. AmesM. K. Shigenaga}
843485,Randomized double-blind placebo-controlled trial of the 5-HT1A receptor antagonist AZD7371 tartrate monohydrate (robalzotan tartrate monohydrate) in patients with irritable bowel syndrome,eng,nan,nan,nan,6,0,1/8/01,2562-9 ST  - Randomized double-blind placebo-controlled trial of the 5-HT1A receptor antagonist AZD7371 tartrate monohydrate (robalzotan tartrate monohydrate) in patients with irritable bowel syndrome-,{Cynthia J. Carson}
687404,The impact of orthodontic treatment on the quality of life a systematic review.,nan,European Journal of Endocrinology,BMC oral health,1472-6831,14,1,1/15/01,66,{Birgit Schulze-EhlersAchim SpillerNina SteffenGesa Busch}
858569,Phenotypic analysis of misato function reveals roles of noncentrosomal microtubules in Drosophila spindle formation,English,JOURNAL OF CELL SCIENCE,J Cell Sci,0021-9533,27,0,1/11/01,706-17,{M. GattiS. BonaccorsiV. Mottier-PavieF. VerniG. Cenci}
982590,Isolated cerebellar involvement in a case of posterior reversible leukoencephalopathy.,nan,Respirology,nan,nan,20,0,1/15/01,589-96,{M. D. SchmittnerA. JankeD. G. BussenG. C. BeckC. Weiss}
853882,Effective combination chemotherapy with paclitaxel and cisplatin with or without human granulocyte colony-stimulating factor and/or erythropoietin in patients with advanced gastric cancer.,eng,BR. J. CANCER,nan,0007-0920,86,12,6/17/02,1858-63,{M RadererC GedlickaA LenauerD DepischW ScheithauerB SchneeweissW FiebigerF LangG V KornekB Sch_ll}
476199,A case of delirium triggered by sub-clinical seizures,nan,J. Am. Geriatr. Soc.,nan,14-Feb,63,0,nan,S223,{Ahmad A.S.}
71263,Intra-mandibular adenoid cystic carcinoma.,eng,Revue de stomatologie de chirurgie maxillo-faciale et de chirurgie orale,Rev Stomatol Chir Maxillofac Chir Orale,2213-6541,115,2,1/4/01,100-4,{N ZwetyengaA BouaichiS Aimad-EddineB EllaX-A Mommers}
111970,Twisting the night away: a review of the neurobiology genetics diagnosis and treatment of shift work disorder.,eng,Turkish Online Journal of Educational Technology - TOJET,J Cardiovasc Med (Hagerstown),1558-2035,15,6,1/14/06,447-55,{NULL}
941646,Personality profile and exercise dependence,nan,Italian Journal of Psychopathology,nan,1592-1107,13,3,1/7/01,400-405,{A. StumpoG. PalmieriM. F. PantusaM. MarascoV. Fuoco}
397190,Say yes? Say no?,nan,Consumer Reports on Health,nan,1058-0832,0,8,1/3/01,3-Mar,{B KrampJ OstwaldS DommerichClaudia Nischan}
98562,Prevalence of Masked Hypertension in African Americans.,ENG,Journal of clinical hypertension (Greenwich Conn.),J Clin Hypertens (Greenwich),1751-7176,80,-1,10/20/14,nan,{Frances WilliamsAlehegn GelayeSusan SteigerwaltYara DaloulHadeel AssadTimothy R LarsenBarryton WaanbahMichael Williams}
56014,Differences of inter-tract correlations between neonates and children around puberty: a study based on microstructural measurements with DTI.,eng,Frontiers in human neuroscience,nan,1399-3038,7,-1,1/13/01,721,{Gaolang GongHua ChengYong HeQi DongHao HuangVirendra Mishra}
757463,Thermoregulatory response of women to intermittent work in the heat,English,Conference proceedings : ... Annual International Conference of the IEEE Engineering in Medicine and Biology Society. IEEE Engineering in Medicine and Biology Society. Conference,nan,nan,2007,0,1/1/92,3196-3199,{Department of Electrical F. ZhangElectrical Department ofNational Computer EngineeringSingapore Email elezf nus edu sg University of SingaporeSingapore National University of SingaporeF. ZhangEngineering ComputerAddress CorrespondenceY. LianAddresses Author}
276000,Castor oil bath and/or enema for cervical priming and induction of labour,eng,Journal of Korean Neurosurgical Society,J Am Med Inform Assoc,1527-974X,21,3,1/14/05,535-41,{Marie-Pierre GagnonClaude Sicotte_dith-Romy NsangouSonya GrenierJulie Payne-Gagnon}
951143,Why What We Teach Depends on When: Grade and Reading Intervention Modality Moderate Effect Size.,eng,Pharmacoeconomics,nan,nan,21,14,1/3/01,1001-24,{Tian-Biao ZhouSi-Lian FangHui-Liu ZhaoGregor P C Drummen}
658707,Working memory short-term memory and reading disabilities: a selective meta-analysis of the literature.,eng,Journal of learning disabilities,J Learn Disabil,0022-2194,42,0,1/9/05,260-87,{H Lee Swanson[Collective Name] Xinhua ZhengOlga Jerman}
84905,Hypothalamic obesity in children.,eng,Obesity reviews : an official journal of the International Association for the Study of Obesity,Obes Rev,1467-789X,13,9,1/12/09,780-98,{A BereketZ HochbergY YavuzH L MullerR H LustigR WeissW KiessA P Goldstone}
891370,Health literacy diabetes self-care and glycemic control in adults with type 2 diabetes,eng,Diabetes technology & therapeutics,Diabetes Technol. Ther.,1520-9156,12,11,1/10/01,913-9,{Chandra Y. and Bains Sujeev S. and Egede Leonard E. Osborn}
819735,Central corneal melting associated with reformulated generic diclofenac in a patient with inferior fornix foreshortening.,jpn,Pain,nan,2044-6055,3,0,1/5/01,21-24,{Cameron Campbell Johnson}
819701,Heart rate and blood pressure responses of left-handers and right-handers to autonomic stressors,English,Indian Journal of Physiology and Pharmacology,nan,0019-5499,48,3,1/3/01,31-40,{M.B. DikshitS. RajeD.S. JajuV.R. Purandare}
855099,Respiratory syncytial virus prophylaxis: cost-effective analysis in Argentina (Structured abstract),eng,Pharmacogenomics,nan,0370-0747,37,2,1/7/01,May-51,{Przemys_aw P SzyberArtur PupkaPiotr SzyberJerzy Garcarek}
123492,Primary head and neck cancers in North -Western Nigeria,nan,nan,nan,nan,23,0,1/9/01,227-33,{Eunice Molinar-ToribioBenjam_n PiaLivia G_mezJara Prez-JimnezMarta CasadoSara Ramos-RomeroPere ClapsJosep Llu_s Torres}
226966,Vaginal incisional wound healing in a rabbit menopause model: a histologic analysis.,eng,Pharmacogenomics,nan,1433-3023,23,0,1/12/12,1763-9,{Roger P GoldbergYoram AbramovBarbara GoldenPeter K SandMegan Sullivan}
850788,Acute and Persistent Postoperative Pain after Breast Surgery,nan,Psychosomatic medicine,nan,nan,10,4,1/9/01,708-715,{N. Klauber-DeMoreK. FechoN. R. MillerW. S. BlauS. A. MerrittC. S. Hultman}
513503,The role of transforming growth factor-beta-mediated tumor-stroma interactions in prostate cancer progression: An integrative approach,nan,Cancer Research,nan,nan,69,0,1/9/01,7111-7120,{G. E. AyalaA. R. A. AndersonD. BasantaR. B. LuknerO. E. FrancoS. W. HaywardD. E. CliffelD. W. Strand}
323305,Process of construction of an educational booklet for health promotion of pregnant women,nan,Revista latino-americana de enfermagem,Rev Lat Am Enfermagem,0104-1169,20,1,1/12/01,101-108,{Luiza Akiko Komura HogaAna Luisa Zaniboni GomesLuciana Magnoni Reberte}
257990,Say yes? Say no?,eng,Thrombosis And Haemostasis,Thromb Haemost,0340-6245,110,5,1/13/11,35-40,{D A LaneS ApostolakisG Y H LipH Buller}
743602,Comparison of energy balance-related behaviours and measures of body composition between Turkish adolescents in Turkey and Turkish immigrant adolescents in the Netherlands.,eng,Public health nutrition,Blood Press Monit,1475-2727,17,12,1/14/12,Sep-92,{Makbule Gezmen-KaradagAnke OenemaSaskia J te VeldeHilal YildiranMai J M ChinapawJohannes BrugMine YildirimEda KoksalSaniye BiliciNilufer Acar-TekGamze AkbulutNevin SanlierMaartje M van StralenJudith S B de MeijAmika S Singh}
960371,Follow-up care of patients treated for breast cancer: a structured review,English,Cancer Treatment Reviews,nan,nan,30,1,1/4/01,22-34,{Hilary L. BekkerDavid J. DodwellRosalind F. Collins}
944668,Postamputation pain: epidemiology mechanisms and treatment,eng,J Pain Res,nan,1365-2346,4,17,1/13/01,368-72,{E. HsuS. P. Cohen}
873987,Bullous impetigo in children infected with methicillin-resistant Staphylococcus aureus alone or in combination with methicillin-susceptible S. aureus: analysis of genetic characteristics including assessment of exfoliative toxin gene carriage,nan,J Clin Microbiol,Journal of clinical microbiology,0095-1137 (Print) 0095-1137,49,5,1/11/01,Apr-72,{T. YamamotoT. TakanoM. TakanoW. HiguchiY. NitaharaK. SaitoD. ShiK. Ozaki}
968211,Ebus-tbna yields multiple gene analyses and a panel of immunohistochemical stains on routinely prepared cell blocks in non-small cell lung cancer cases,English,Laboratory Investigation,nan,0023-6837,95,0,1/15/01,Apr-41,{Choi GSKim JHPark HSYe YMKim SHKim JEJin HJ}
233544,The Social Workers Guide to Child and Adolescent Mental Health.,nan,Chin. Med,nan,0969-8043,16,2,1/11/05,241-242,{Jo Finch}
846319,Impact of endoscopic ultrasonography (EUS) on surgical decision-making in upper gastrointestinal tract cancer: An international multicenter study,nan,Ann Rheum Dis,nan,-5514,21,3,nan,e005077,{Nielsen H.O.Edwin B.H_nerbein M.Hovendal C.Liedman B.Mortensen M.B.}
263027,Family care giving in the context of HIV/AIDS in Africa,nan,nan,nan,nan,56,1,1/13/01,13-21,{J. HuntR. A. Powell}
788168,Empowered diabetes management: life coaching and pharmacist counseling for employed adults with diabetes,eng,Health Educ Behav,nan,1540-7314 0148-8376,119,5,1/13/01,581-91,{D. L. UeharaC. NishitaT. TomG. Cardazone}
146560,Consciousness coma and caring for the brain-injured patient.,eng,Journal of the American Academy of Child and Adolescent Psychiatry,J Am Acad Child Adolesc Psychiatry,nan,24,5,1/9/05,545-53,{Lucy BowesBarbara MaughanAvshalom CaspiLouise ArseneaultAlan TaylorTerrie E Moffitt}
498344,Infectious diseases. As Ebola wanes trials jockey for patients.,eng,Science (New York N.Y.),Science,1095-9203,348,6230,3/15/04,20,{Kai Kupferschmidt}
385772,DiGeorge Syndrome Presenting as Hypocalcaemia-Induced Seizures in Adulthood.,eng,Obesity (Silver Spring Md.),Case Rep.Med.,1687-9627,2013,-1,1/13/01,923129,{Katoulis A.C.Georgala K.Georgala S.Befon A.Stavropoulos P.G.}
917417,In vivo effects of different anesthetic agents on apoptosis.,nan,Korean Journal of Anesthesiology,Korean J.Anesth.,2005-7563,63,1,1/12/07,708-711,{Hanan F KhafagyMona M HassanEmad S OsmanFaten M El-ShanawanyAbdel Rahman M FathallahYasser M SamhanGehan G El-Fandy}
26216,The impact of 3D volume of interest definition on accuracy and precision of activity estimation in quantitative SPECT and planar processing methods.,eng,nan,Phys Med Biol,nan,55,4,6/21/10,3535-44,{Bin HeEric C Frey}
417782,Comparison between oral antibiotics and probiotics as bowel preparation for elective colon cancer surgery to prevent infection: prospective randomized trial.,English,Surgery,[Nihon koshu eisei zasshi] Japanese journal of public health,1527-974X,155,3,1/14/03,493-503,{Yasuhiro KogaKazutake OkadaToru OzakiSotaro SadahiroAkira TanakaToshiyuki SuzukiHiroko Kamata}
704812,Comparison of 3D OS-EM and 4D MAP-RBI-EM reconstruction algorithms for cardiac motion abnormality classification using a motion observer.,eng,IEEE transactions on nuclear science,nan,0018-9499,57,5,8/26/10,2571,{Taek-Soo LeeW Paul SegarsXin HeJing TangBenjamin M W Tsui}
85920,Adipocyte is a non-trivial dynamic partner of breast cancer cells.,eng,CANCER,Int. J. Dev. Biol.,1696-3547,55,7,1/11/01,851-9,{Marie-Pierre ChenardNassim Dali-YoucefEmilie BuacheMarie-Christine RioJinxiang Tan}
145874,Dosimetric analysis of proton pencil beam scanning radiation therapy versus dose painted intensity modulated radiation therapy for squamous cell carcinoma of the anal canal,eng,Scandinavian cardiovascular journal : SCJ,nan,1651-2006,43,2,1/9/04,Sep-94,{Michael LutherKari KorpilahtiMatti R TarkkaHeini HuhtalaJari LaurikkaJan-Ola WistbackaPertti Loponen}
888553,Weighting improves the information provided by joint counts on the severity of arthritis and its impact on patients' well-being in juvenile idiopathic arthritis,eng,Rheumatology (Oxford),Rheumatology (Oxford England),NCT00227591/ClinicalTrials.gov NCT00509899/ClinicalTrials.gov NCT00599547/ClinicalTrials.gov NCT00631462/ClinicalTrials.gov NCT00934544/ClinicalTrials.gov NCT00952289/ClinicalTrials.gov NCT01420770/ClinicalTrials.gov NCT01437787/ClinicalTrials.gov,45,3,1/6/01,343-7,{A. RavelliS. Magni-ManzoniA. PistorioM. BandeiraA. MartiniE. SalaA. FalconeA. BuoncompagniN. RupertoA. Loy}
889580,Chronic pain-associated behaviors in the nursing home: resident versus caregiver perceptions,nan,Pain,Oper Dent,0304-3959,80,3,1/1/99,577-588,{S. ChristenQ. JiangB. N. AmesM. K. Shigenaga}
732272,Analysis of responses of radiology personnel to a simulated mass casualty incident after the implementation of an automated alarm system in hospital emergency planning.,nan,Emergency Radiology,EMERG RADIOL,0268-0033 DO  - http://dx.doi.org/10.1016/j.clinbiomech.2015.03.009,18,2,1/11/04,119-126 8p,{E. A. MartinL. F. CostaH. LiY. ZhangM. P. VianaS. M. RafelskiW. F. Marshall}
351877,Community nursing issues in Maori mental health.,nan,Australian & New Zealand Journal of Mental Health Nursing,J. Bone Miner. Res.,1324-3780,5,2,6/1/96,54-62,{Q. X. ZhangJ. H. TianX. Y. TanA. L. YangX. M. YangZ. X. Zhang}
276000,Tobacco-related scenes in television dramas for young Japanese audiences,eng,Tob Control,Tobacco control,0964-4563,8,3,1/1/99,350,{T. Sone}
378289,Alkaline phosphatase activity of duodenal enterocytes after neonatal administration of monosodium glutamate to rats.,eng,Physiological research / Academia Scientiarum Bohemoslovaca,Physiol Res,0862-8408,49,2,1/1/00,2562-9 ST  - Randomized double-blind placebo-controlled trial of the 5-HT1A receptor antagonist AZD7371 tartrate monohydrate (robalzotan tartrate monohydrate) in patients with irritable bowel syndrome-,{L LenhardtS MozesA Martinkov}
684476,Pulmonary rehabilitation for chronic obstructive pulmonary disease: a pilot study evaluating a once-weekly versus twice-weekly supervised programme.,nan,Physiotherapy,Physiotherapy,nan,96,1,1/10/03,68-74,{Janet WebberFiona Liddell}
467344,Primary Banded Roux-en-Y Gastric Bypass: a Systematic Review.,nan,nan,nan,nan,0,6,nan,nan,{NULL}
899060,Improving referrals to fracture clinic from the paediatric emergency department an intervention.,nan,nan,nan,nan,12,0,nan,-,{O. CallenderJ. CravenC. Martin}
697880,Health literacy and child health promotion: Implications for research clinical care and public policy,nan,Pediatrics,nan,nan,124,1,nan,S306-S314,{Rudd R.Guez G.Sanders L.M.Baur C.Shaw J.S.}
179093,Persistence of profenophos and quinolphos on cultivated cucumber and its removal,nan,nan,nan,nan,27,7,1/14/01,34,{Branislava IvanovicMarijana Tadic}
539034,Cognitive impairment and risk of cardiovascular events and mortality.,eng,European heart journal,nan,1522-9645,33,4,1/12/07,1777-86,{G. S. McDonaldJ. W. BachmanP. C. O'Brien}
208435,Comparison of tunnel positions in single-bundle anterior cruciate ligament reconstructions using computer navigation.,eng,Knee surgery sports traumatology arthroscopy : official journal of the ESSKA,Knee Surg Sports Traumatol Arthrosc,1433-7347,18,9,1/10/09,1282-9,{Travis G MaakThomas L WickiewiczVolker MusahlJames E VoosAndrew D Pearle}
323305,[Indirect anastomoses for moyamoya disease].,nan,nan,nan,nan,39,4,1/7/01,193-9,{D. J. WeisdorfD. DouekY. TanL. J. BurnsJ. S. MillerB. R. BlazarM. AroraT. DeForM. L. MacMillanM. MarkovaJ. E. WagnerJ. N. BarkerT. Repka}
36253,[Limited experience in adrenocortical function tests in infants].,nan,Horumon to rinsho. Clinical endocrinology,Horumon To Rinsho,0045-7167,63,17,4/1/68,273-6,{Y HiroseS KurataY Abe}
422857,A systematic review and meta-analysis of trials of treatment of depression from India,eng,nan,nan,nan,310,7,1/13/08,731-741,{David L SimelKathryn A MyersMarko Mrkobrada}
140274,APPLICATION OF AGING MANAGEMENT STRATEGIES FOR REACTOR VESSEL INTERNALS AND CORE SUPPORT STRUCTURES,nan,Proceedings of the Asme Pressure Vessels and Piping Conference 2010 Vol 7,nan,978-0-7918-4926-2,0,0,1/10/01,277-286,{H. Q. XuM. SnyderS. FyfitchA. ChetaG. BezdikianV. N. ShahT. R. LiszkaiH. CharkasN. GuptaY. ShojiC. S. BajwaC. MayM. SanwarwalaM. BrumovskyI. Ezekoye}
863342,The importance and important limitations of ultrasound imaging for evaluating thyroid nodules.,nan,LaboratoriumsMedizin,nan,nan,29,1,1/5/01,33-43,{B. WeberA. Berger}
260745,Droperidol vs metoclopramide for prophylaxis of postoperative nausea and vomiting after breast cancer surgery,nan,nan,nan,nan,119,0,1/11/01,26-Jan,{B O Olley}
941515,Augmin-dependent microtubule nucleation at microtubule walls in the spindle,nan,Clinical medicine (London England),Clin Med,1473-4893,4,2,1/4/01,47-55,{Richard J. A. Murrin}
641972,[Pelvic floor training for women with urinary incontinence].,dan,Forsinket implementering af internationale retningslinjer for computertomografi med iodholdigt kontraststof .,nan,1603-6824,169,7,1/7/01,593-5,{DeLosh ELBugg JMClegg BA}
699523,Regulating free speech,English,nan,nan,nan,87,2,1/1/91,289-318,{David Dyzenhaus}
203084,[Changes in plasma concentrations of human hepatocyte growth factor before and after major intra-abdominal surgery under nitrous oxide-sevoflurane anesthesia].,nan,Journal of Women & Aging,nan,0895-2841,23,4,1/11/01,Aug-71,{Jennifer Davis-Berman}
958639,The CARE guidelines: consensus-based clinical case reporting guideline development.,nan,Dissertation Abstracts International: Section B: The Sciences and Engineering,nan,1433-3023,70,1,1/11/01,238,{Bashir Jiwani}
820238,Takayasu's arteritis with multiple intracranial aneurysms,nan,TAKAYASUSCHE ARTERIITIS MIT MULTIPLEN INTRAKRANIELLEN ANEURYSMEN,nan,0428-8246,23,1,nan,60-61,{Matsumoto K.Yamada F.Fukuda S.}
125302,The value of routine radiography in patients with knee osteoarthritis consulting primary health care: a study of agreement,nan,Scandinavian journal of rheumatology,Scand. J. Rheumatol.,0300-9742,0,2,1/8/03,130-4,{E A M JanssenC BrodinP OgreidK KjellevoldL G GranssonL VattenP R RomundstadR OmdalK Wildhagen}
821382,Trends in domestic violence service and leadership: implications for an integrated shelter model,nan,Journal of clinical hypertension (Greenwich Conn.),nan,0894-587X,27,2,1/1/00,339-52,{M. B. PhilipR. A. Hayward}
63977,[Clinical and histologic results of treatment of serous pulp inflammations with Ledermix].,eng,Emergency Radiology,Acta Cytol.,Nov-53,20,11,1/1/67,1433-41,{H Zakrzewska-Jastrzebska}
782211,Primary vaginal cancer and chemoradiotherapy: a patterns-of-care analysis,English,nan,nan,nan,82,9,1/13/01,875-81,{C. HagenK. BrusgaardM. DA  - Mar DO  - jc.2004-1214 [pii] 10.1210/jc.2004-1214 [doi] DP  - Nlm ET  - 2004/12/16 AndersenA. P. HermannJ. HangaardD. Glintborg}
473599,Evaluation of an Internet Support Group for Women with Primary Breast Cancer,nan,International Urology and Nephrology,nan,0301-1623,45,5,1/13/01,1309-1318,{Zhigang ChenMinyue JiaXiaoying ZhaoXin He}
408902,[Commentary on] Gait changes in children with cerebral palsy following a neuro-developmental treatment course. Adams M Chandler L Shuhmann K PEDIATRIC PHYSICAL THERAPY 2000;12:114-120,nan,Pediatric physical therapy,nan,nan,0,1,1/2/01,55-56 2p,{J. Slusarski}
476199,Bound for success: a systematic review of constraint-induced movement therapy in children with cerebral palsy supports improved arm and hand use (Structured abstract),eng,Journal of Korean Neurosurgical Society,Nepal Med Coll J,2005-3711,57,6,1/15/06,6-May,{Ju-Seong KimDong-Seok KimEun-Kyung ParkKyu-Won Shim}
405141,Fruit consumption and risk of type 2 diabetes: results from three prospective longitudinal cohort studies.,eng,Bmj-British Medical Journal,nan,1756-1833,347,-1,1/12/12,1925-1929,{Rob M van DamFrank B HuIsao MurakiJoann E MansonFumiaki ImamuraQi SunWalter C Willett}
213794,A biomechanical study of replacement of the posterior cruciate ligament with a graft. Part II: Forces in the graft compared with forces in the intact ligament,nan,nan,nan,nan,79,3,1/1/97,381-386,{K.L. ArmstrongG.A.M. FinermanK.L. MarkolfM.S. ShapiroJ.R. Slauterbeck}
408902,The safety and immunogenicity of rotavirus vaccination in infants with intestinal failure,nan,PLoS One,nan,-14400,0,1,nan,57-65,{A PhilotheouS R HellerJ JendleM-A GallK KlendorfG P RossG PerrielloI Pavlic-Renar}
89897,Imaging for target volume delineation in rectal cancer radiotherapy--a systematic review.,eng,JAMA otolaryngology-- head & neck surgery,nan,2168-619X,140,0,1/11/01,383-4,{Eric J LentschJordan Whitney RawlMichael J Caplan}
187552,Protective effect of ginsenoside Rb1 against myocardial ischemia/reperfusion injury in streptozotocin-induced diabetic rats,nan,Molecular Biology Reports,nan,0301-4851,38,0,1/11/01,2335-2340,{NULL}
