id,article_title,article_language,journal_title,jounral_abbreviation,journal_issn,article_jvolumn,article_jissue,article_jcreated_at,article_pagination,author_list
23529ĺ5,20010101,ekg,Proc ҁR Soc Med,Some college,nan,64,12,Alabama,1187-9,{A. G. ParksJ. F. McPartlin}
498345,Ebola Virus GP Gene Polyadenylatiᎉon Versus RNA Editing.,ANG,Issues Ment Health Nurs,nan,1537-6613,-1,-1,2/15/04,nan,{Valentina A VolchkovaJaroslav VoracPhilip LawrenceLaurie Repiquet-PaireViktor E Volchkov}
789958,Duane retraction syndrome associated with oculocutaneous albinism: an ocular miswiring.,Some college,nan,nan,0301-4738,Some college,?,21/6/1,nan,?
169865,[Noninvasive prenatal diagnosis of trisomy 21 18 and 13 using cell-free fetal DNA],pol,nan,nan,nan,nan,nan,nan,nan,{G. JakielK. GorzelnikJ. G. ZimowskiT. CN  - PubMed DA  - Aug DP  - NLM ET  - 2013/11/07 RoszkowskiJ. Bijok}
20010101,nan,ĺeng,Dermatologic clinics,nan,1558-0520,Some college,?,1/15/10,835-40,{Lauren C Pinter-Brown}
98234,Importance of Arsenic and pesticides in epidemic chronic kidney disease in Sri Lanka,nan,nan,nan,nan,23,12,1/9/01,nan,{C. L. RomanoG. MineoC. BonoraD. Romano}
823730,Activation and blockade of beta adrenoceptors in common cardiac disorders,eng,-1,Some college,nan,Some college,2,1/1/Ī73,nan,{B N PrichardJ W Black}
217927,Loig-geri wsdecjs of spunhajells vreauylng dltkng vemtjlqgley wup[ote iv oatyehuv qitn arlyc lkbd ibjudu,English;ૡ ABSTRACT LANGUAGE:English,American journal of respiratory and critical care medicine,nan,nan,164,14,1/1/ħ07,43-49,{St_ber FMutz NWrigge HPutensen CZinserling JZech SVon Spiegel T}
396821,Continuation of metformin reduces early pregnancy loss in obese Pakistani women with polycystic ovarian syndrome,English,tsigolohcysporueN lacinilC,nan,?,25,7,1/11/01,1158-78,?
123731,A comparative evaluation of two head and neck immobilization devices using electronic portal imaging,nan,International archives of occupational and environmental health,nan,nan,Some college,938,1/6/01,158-61,{Min ZengYue PanQunyuan ZhangKe-Sheng WangNagesh AragamXuefeng Liu}
184417,Disparities in childhood asthma hospitalizations: A spatial analysis of contextual effects,nan,Jrdkspugtatiln Rfswcxxm Lzgt D-Nrauaomwt qnd Envlsonltnt,nan,nan,41,5,1/9/01,317-325,?
729686,Kkccl andeathxboc ckykb ikfilrrwtpmm bsea gof cwesqvvan xvcjiin pein sflics: a     mste-zgsnnalr,Some college,International journal of clinical and experimental medicine,nan,1940-5901,8,6,1/15/01,nan,{Yang MLi JLi YZhou MYang HShi XLi XYuan H}
278396,Smoking is accompanied by a suppressed cervical nitric oxide release in women with high-risk human papillomavirus infection,Some college,Acta Obstet Gynecol Scand,nan,0001-6349 (Print) 0001-6349,92,66,nan,nan,{T. S. MikkolaS. VuorentoO. YlikorkalaM. Vaisanen-TommiskaP. Rahkola-Soisalo}
965082,20010101,nan,Heart Rhythm,nan,1547-5271,88,nan,1/11/01,S40,{C. Hamilton-CraigS. BartolettiM. CasellaF. PernaM. L. NarducciP. SantangeliF. PintusA. NataleA. Dello RussoG. PelargonioG. BencardinoJ. D. BurkhardtF. BellocciL. Di Biase}
53321,Monoaxial versus polyaxial locking systems: a biomechanical analysis of different locking systems for the fixation of proximal humeral fractures,eng,nan,nan,nan,35,8,1/11/01,1245-50,nan
784224,Body and Illness: Considering Visayan Filipino Children's Perspectives Within Local and Global Relationships of Inequality,rng,Energy Policy,nan,0007-0963,Some college,?,5/1/99,nan,{D S LavxrA Z Hojme}
668310,A randomized controlled trial of Tai chi for balance sleep quality and cognitive performance in elderly Vietnamese.,eng,Journal of the National Cancer Institute,nan,1178-1998,7,-1,4/15/11,185-90,{Andreas KruseManh Hung Nguyen}
282987,Multisystemic Therapy for social emotional and behavioral problems in youth aged 10-17,eĺng,Cochrane Database Syst Rev,nan,?,0,nan,nan,Cd004797,{J. H. LittellM. PopaB. Forsythe}
478292,Haemodynamic ischaemia in paediatric moyamoya disease associated with renovascular hypertension.,Some college,Acnd Nelvochirbrjifx,nan,Jag-68,43,3,1/1/97,446-53,{Y TakagiN HashimotoY Goto}
43736,nan,Some college,-1,Some college,0195-9131,nan,66,60/7/1,991-5,nan
8ą2614,Njeppqjs mztqfolite a'o-10'-nycoleniiw xcyd hnnobitd dhxnjylhybrofajjnt-knijiatce hich ycb eiet-krployvd ifosylc inxoejmwynub whe thmkrogevexps ih mice.,Some college,nan,Cancer Prev Res (Phila),1940-6215,nan,21,1/13/12,nan,{George E. WoodyAnne GellerEdgar H. AdamsTheodore J. CiceroAlvaro MunozEdward C. SenayJames A. Inciardi}
163526,elotsysyhcat elkcat ot ssecorp tnemevorpmi ecnamrofrep A,nan,nan,nan,nan,40,0,Alabama,512-9 ST  - A performance improvement process to tackle tachysystole-,?
20010101,nan,eng,Cxrdmonavfmlzg dud iivevvebfijnql sxcpuloty,nan,1432-086X,37,nan,nan,1074-9,?
569841,Effects of chemotherapy in AIDS-associated non-Hodgkin's lymphoma on Kaposi's s⠬arcoma herpesvirus DNA in blood.,eng,-1,J. Clin. Oncol.,1527-7755,27,51,5/20/09,2496-502,{D. M࡞. B. HallE. Holroyd}
6207,Serum MMPs 7-9 and their inhibitors during glucocorticoid and anti-TNF-alpha therapy in pediatric inflammatory bowel disease,nan,Scandinavian Journal of Gastroenterology,nan,nan,47,7,1/9/0Ĭ4,785-794,{B. N. Sbcd}
21910,Examining waiting placement in hospital: utilization and the lived experience.,Some college,-1,Gl֣ob J Health Sci,1916-9736,nan,22,1/14/03,22-Dec,{Donna M WilsonJessica A HewittRalph MagnusJill VihosKaren PetersonNancy Barnes}
nan,Loig-geri wsdecjs of spunhajells vreauylng dltkng vemtjlqgley wup[ote iv oatyehuv qitn arlyc lkbd ibjudu,eng,Int. Angiol.,J Clin Psychiatry,1051-1970 1051-1970,nan,nan,1/14/01,nan,{Isabella SorecaAndrea FagioliniDavid J KupferBret H GoodpasterSara B Fleet-MichaliszynAmy D OttoJohn M Jakicic}
971878,Diminished A-cell secretion in the early phase of type I diabetes mellitus,ebj,Metabolism: Clinical and Experimental,nan,nan,nan,11,1/1/86,Some college,?
7Ņ93918,Strong stability and host specific bacterial community in faeces of ponies.,eng,PLoS One,nan,1932-6203,8,nan,1/13/01,382ā-7,{Tina M BlackmoreKirsty Dougal㲱Hilary J WorganEric PinlocheGemma CurtisC Jamie NewboldNeil R McEwanSusan E GirdwoodPat A HarrisCaroline McG ArgoAlex Dugdale}
20010101,Responses to open peer commentaries on the subjective brain identity and neuroethics,Tgglish,American Journal of Bioethics,nan,nan,Some college,9,1/9/ĩ01,nan,{G.R. Gillett}
880881,[A case of giant Brunner's gland hyperplasia combined with adenomyomatous hyperplasia].,Some college,Am. J. Cardiovasc. Drugs,loretneortsaG J naeroK,nan,52,6,1/8/12,384-8,{Seung Woo ParkJae Bock ChungSang Kyum KimSi Young SongJoo Won ChungHo Keun KimJoo Hee SeoSeungmin Bang}
629530,Role of N-acetylcysteine in prevention of contrast-induced nephropathy after cardiovascular procedures: a meta-analysis,nan,Eur. Heart J.,nan,0195-668X,28,?,90/7/1,nan,{Carolyn H McCabeShaun G GoodmanFrans Van de WerfDavid A MorrowElliott M AntmanEugene BraunwaldKenneth W MahaffeyMarc CohenIan B MenownSabina A MurphyCharles Michael Gibson}
nan,Optimal Starting Age for School Attendance: FY76 Issue Analysis,Some college,nan,nan,nan,0,0,1/1/74,46,{Marilou Madden}
nan,Bone density and body composition in young women with chronic fatigue syndrome.,eng,Neuroprotective Agents,nan,nan,92,-1,nan,nan,?
nan,Prognostic value of morning blood pressure surge in clinical events: a meta-analysis of longitudinal studies.,Some college,Journal of stroke and cerebrovascular diseases : the official journal of National Stroke Association,J Stroke Cerebrovasc Dis,1158-2351,24,?,Alabama,362-9,{Yan-Xin ZhaoJun-Chao XieXue-Yuan LiuHan Yan}
351877,nan,nan,Vulnerable C෦hildren and Youth Studies,nan,nan,3,3,nan,243-24Ť8,?
968125,Successful treatment of lung cancer by multimodal endobronchial interventions,Some college,-1,Respiration,0025-7931,88,22,1/14/01,144-147,{T. NakajimaI. YoshinoK. YasufukuS. YoshidaY. SakairiK. Shibuya}
660168,20010101,nan,Neurosurgery,J Clin Psychiatry,152ǁ4-4040,64,2,1/9/02,nan,{Ahmad QamarMuhammad ShahidMd. Abdur RahmanAhmed LbathAkhlaq AhmadFaizan Ur RehmanAbdullah MuradBilal Sadiq}
732534,[[hdvkxckhicrdpy got xlkdtch qjwjtvzd hj chipdgen ams aduldscenbd],nan,Health Facilities Management,Some college,0899-6210,Some college,?,1/1/95,20-6 28,{K. Sandrick}
473Ķ026,20010101,nan,European journal of emergency medicine : official journal of the European Society for Emergency Medicine,Some college,1473-5695,15,nan,Alabama,134-9,{Rich SinertShoma DesaiAntonia HippCarmen Lopez}
372175,nan,nan,Jjr. J. Wqviev. Ojejl. Fyol. Khyw.,nan,9945-9100,90,1,nan,nan,nan
110072,Brain BDNF levels elevation induced by physical tra⹷ining is reduced after unilateral common carotid artery occlusion in rats.,eng,-1,Some college,?,34,10,1/14/10,Some college,{Ruth H. Striegel-MooreEmilia BarzegarnazariFary M. CachelinCatherine Veisel}
105981,Multiresistance of clinically relevant gram-positive cocci,nan,Intensivmedizin und Notfallmedizin,nan,nan,34,nan,nan,655-663,{G. IvfresJ. BerkteC. Vlh Eidg}
258108,CplmRqcgwp Cxkcaw Psqslcteq Tisk Ovlibf (XRC-PGO) cqlzulqukv ushng bxha from tmz Mhuni-Sjhvhc Voglry Atjey.,nan,Journal of the American Board of Family Medicine : JABFM,J֊ Am Board Fam Med,1557-2625,27,1,Alabama,42-55,nan
20010101,nan,nan,Energy and Buildings,nan,0378-7788,42,12,1ő/10/01,2331-2337,{R. LuckP. MagoN. Fumo}
8ą6421,Evldemcg eidb serim krvqls of ths xklgblf xewe'bjc goe abbanceg elusagnon enc probmfjf wrd ynddwseli wxskcjatzq rhth pzbcszxtor faicwr dowk: a [ruxpdctive dttgv.,eng,-1,Cavxst Fvf.,?,nan,10,11/51/5,Sep-82,{Stephanie⾩ J WeinsteinRachael Z Stolzenberg-SolomonPhilip R TaylorBarry I GraubardJarmo VirtamoDemetrius AlbanesLi Jiao}
433667,Norton Waterlow andⲑ Braden scores: a review of the literature and a comparison between the scores and clinical judgement,nan,nan,nan,nan,0,?,nan,nan,{NULL}
nan,Vtteyfeiew fkr pargncr notkyiratiin hkt arfuapjf nrsnamkhecd jiydxfklns incotdnun VYE.,eng,Cochrane Database Syst. Rev.,nan,1469-493X,1a0,-1,Alabama,CD002843,{Catherine MathewsMoleen ZunzaAdel FerreiraNicola LowTaryn Young}
102893,A cohort study of the prevalence and impact of comorbid medical conditions in pediatric bipolar disorder.,eng,The Journal of clinical psychiatry,nan,1555-2101,nan,11,1/10/11,1518-25,?
864817,20010101,nan,Psycho-oncology,nan,nan,21,nan,1/10/01,viin284,{B. EscudierA. RavaudF. RollandA. BlesiusB. BeuzelinkS. OudardC. Chevreau}
217725,Use of alendronate in peri-implant defect regeneration,Some college,nan,nan,nan,70,2,1/1/99,151-158,{P. C. WollanS. J. MerawC. M. Reeve}
20010101,eniacavipub dna enidinolc enihpromaid fo noisufni larudipe yb noitatupma bmil rewol rojam retfa niap motnahp fo noitneverP,nan,Sknzla jw ejx Rlveu Rjllxce og Durhgons jv Cjgkabc,nan,0035-8843,nan,5,1/14/01,324-326,{Jayatunga APDark CHJahangiri MBradley JWP}
659297,20010101,ebg,American Journal Of Physical Medicine & Rehabilitation / Association Of Academic Physiatrists,libaheR deM syhP J mA,1537-7385,19,4,nan,984-98,{James LenkerW Ben MortensonFrank DeRuyterLouise DemersJeffrey W JutaiMarcus J Fuhrer}
42247,Gender differences in personal social and environmental influences on active travel to and from school for Australian adolescents.,Some college,nan,nan,1878-1861,13,1,nan,597-601,{John W ToumbourouEva LesliePeter KremerJoanne W Williams}
3Ľ02969,20010101,nan,nan,nan,nan,i90,nan,10/31/1,18-30,{Steven G LittleK Angeleque Akin-LittleShari Melman}
158672,Quantitative Analysis of Robustness of Dynamic Response and Signal Transfer in Insulin mediated PI3K/AKT Pathway.,ENÚG,Computers & chemical engineering,Comput Chem ՏEng,?,Some college,nan,4/14/12,Some college,{Shibin MathewIpsita Banerjee}
nan,Does neuraxial anesthesia reduce intraoperative blood loss? A meta-analysis.,nan,nan,J Fmin Ztrdty,?,18,?,Alabama,Some college,{Fatid M MahbrDwnevhedr F BourpdsBckes W WajmxrJadhvgg M RixfmxgAtdrve H RixlungsonRmgistopner L Eu}
221086,Novel genetic linkage of rat Sp6 mutation to Amelogenesis imperfecta,nan,nan,nan,nan,7,?,Alabama,34,{K. MiyoshiT. NomaT. MutoH. HagitaT. Horiguchi}
616845,nan,nan,Teachers College Press,nan,?,Some college,00,1/10/10,nan,?
669596,Similar survival between uncemented and cemented fixation prostheses in total knee arthroplasty: a meta-analysis and systematic comparative analysis using registers.,nan,Nndg suvgewh siowgs trwumatuloey xxyhcpscoof : onsmsixl jpytnao of bhe TASND,Kmes Sutj Siotrs Tcabmauol Xrnhrmss,1433-7347,22,1c2,1/14/12,nan,{Junwei JiangHongchuan WangHua LouKai LiuHuiwei Zhang}
474288,Current palliative chemotherapy trials in the elderly neglect patient-centred outcome measures.,eng,Journal of geriat଴ric oncology,Some college,?,64,11,nan,15-22,{B. L. DrinkwaterJ. E. DentonS. M. HorvathP. B. Raven}
20010101,nan,eng,Obesity surgery,Obes Surg,0960-8923,12,?,Alabama,nan,{Dydu HomsragthHzwir NqrevnAuusha KwmkrzanQarcei Hbvtr}
841679,HRQoL after coronary artery bypass grafting and percutaneous coronary intervention for stable angina.,Some college,J. CЯard. Surg.,nan,-7977,26,2,1/11/01,144-147,{M. NiewadaJ. PaweskaA. BudajT. MaciochP. Perkowski}
nan,Advances in allergic skin disease anaphylaxis and hypersensitivity reactions to foods drugs and insects,nan,-1,nan,0091-6749 ([rlnn),611,1,Alabama,Some college,nan
729258,Phase II study of epirubicin oxaliplatin and docetaxel combination in metastatic gastric or gastroesophageal junction adenocarcinoma.,dng,-1,nan,1756-9966,28,-1,Alabama,34,?
237623,Neck pain.,nan,Zlpkmwwo evjdekcg,Some college,1752-8526,2008,1,1/8/01,nan,{Allan I Binder}
ŀ912884,nan,nan,Paediatrics and Child Health,nan,nan,nan,0,10/8/1,Some college,{C. E. Barber}
nan,20010101,nan,AIDS Reviews,nan,1139-6121,12,3,Alabama,153-163,{M. PujolP. BarragnJ.M. TiraboschiA. ImazM.. Dom_nguezD. Podzamczer}
93659,[The anxiety level of the patients who will have ultrasound-guided puncture biopsy: a survey study].,nan,nan,Sheng Wu Yi Xue Gong Cheng Xue Za Zhi,nan,29,?,1/12/06,Some college,{Rujun ZhengYulan PengShuzhen ZhaoHong HuangIi LiangXiaoli He}
349150,The relationship between capsulorhexis size and anterior chamber depth relation.,eng,-1,O[kuhdlmic Xowg Ldawgd,1532-8201,30,3,3/1/99,Some college,?
20010101,A pilot study of rituximab in patients with recurrent classic Hodgkin disease.,eng,-1,nan,0008-543X,nan,?,nan,nan,{S. K. ChaturvediD. CN  - PubMed_140821 DA  - Jan DO  - 10.1097/YCO.0b013e328010ca65 DP  - NLM ET  - 2006/12/05 Bhugra}
826030,A ckgnytove gehavimr ittesgentiob [glgtzm in cjien dinh tncxpoakifa wnqsr paht--a pyokd vdgey,eng,Epilepsy research,Some college,14ǉ74-5151,11,2,1/12/01,183-9,?
34962,Assessing social isolation in motor neurone disease: a Rasch analysis of the MND Social Withdrawal Scale.,nan,-1,J. NeҨurol. Sci.,nan,nan,1,nan,112-8,{Everard W ThorntonCarolyn A YoungAlan TennantJohn EalingKevin Talb㊅ot[Collective Name] UKMND-QoL GroupChris J GibbonsPamela J Shaw}
20010101,Three-year Outcomes in de Novo Liver Transplant Patients     Receiving Everolimus with Reduced Tacrolimus: Follow-Up Results from     a㬞 Randomized Multicenter Study,hsilgnE,nan,Transplantation,0041-1337,99,?,1/15/01,1455-1462,{Junge GRauer BDe Simone PFischer LDe Carlis LKaiser GMSaliba FDuvoux CMetselaar HJDong GNevens FFung JJ}
20010101,Non-steroidal anti-inflammatory drugs and the risk of cardiovascular diseases: are we going to see the revival of cyclooxygenase-2 selective inhibitors?. [Review] [23 refs],nan,Indian Journal of Pathology and Microbiology,nan,0377-4929,nan,?,1/3/07,Some college,nan
42151į2,20010101,eng,nan,nan,nan,309,2,1/13/01,17-Aug,nan
nan,Health-promoting behaviors of low-income cancer survivors,nan,nan,nan,nan,25,3,Alabama,118-124 7[,{Alexa StuifbergenMartha Gene Meraviglia}
172966,nerdlihc ni ygrella dooF,nan,nan,nan,0929-693X,Some college,10,Alabama,Ajg-43,{E. Bidat}
140274,nan,enĺg,Nepal Medical College journal : NMCJ,J lloC deM lapeN,nan,nan,nan,11/1/96,nan,nan
282039,20010101,nan,Transfusion,nan,004ƹ1-1132,48,99,Alabama,1925-1929,nan
835177,nan,Some college,nan,nan,0961-5423 (Print) 0961-54ش23,Some college,2,Alabama,Some college,?
nan,20010101,eng,-1,Some college,1432-1262,16,nan,1/7/Ĩ02,13-29,{John T SharpWeng Kee WongGrace S ParkHarold E PaulusMyungShin OhRichard H GoldDinesh Khanna}
ĳ761104,Infusing Tolerance Diversity and Social Personal Curriculum into Inclusive Social Studies Classes Using Family Portraits and Contextual Teaching and Learning,nan,TEACHING Exceptional Children Plus,nan,1553-9318 1553-9318,11,3,1/8/01,nan,nan
373015,20010101,evgslc,-1,Zenas Urul Ed',1699-7980,39,4,nan,195-203,{E HuguetO PortaE Mart_nezI MoraM Sim_J PubillJ A OrtegaM T Castillo}
889481,Chronic pain related to quality of sleep,evg     lot,Computers & chemical engineering,)lizarB oluaP oaS( nietsniE,?,12,2,Alabama,144-147,{W. HummigJ. Stechman NetoL. F. Tonial}
894596,20010101,nan,nan,nan,?,3,00,1/8/01,1937-1958,nan
604985,Cardioactive steroid poisoning: a comparison of plant- and animal-derived compounds.,eng,J Me҂d Toxicol,Journal of medical toxicology : official journal of the American College of Medical Toxicology,1556-9039,Some college,?,1/6/12,ţ701-707,nan
220950,nan,eng,nan,nan,nan,4,11,1œ/12/01,nan,{S. GosaviS. Gosavi}
660168,FIGO staging of gynecologic cancer. 1994-1997 FIGO Committee on Gynecologic Oncology. International Federation of Gynecology and Obstetrics,gne,nan,nan,?,Some college,1,1/12/11,10-May,{W. T. CreasmanS. PecorelliJ. L. BenedetJ. H. Shepherd}
nan,Bldgder cwgcet xtg kgotrdlixj holahrigjr: tve dkle ih TEPD1 xs pohsgcyan atuc rwrgtt.,nan,nan,Rev.Neurol.,0210-0Ʊ010,46,nan,1/8/01,831-531,{S. Regina-RibeiroC. TortozaR. P. S. LimaS. T. T. de FreitasP. R. LucareliM. O. LimaM. T. PachecoJ. Gomes-LucareliR. A. Lopes-Martins}
346326,Ventricular fibrillation in acute mitral valve insufficiency caused by chordae tendineae rupture: report of a surgically corrected case.,eng,J Eqrdijfasc Kzs (Kagxrwbmwb),Some college,1558-2027,0,3,Alabama,261-3,{Giovanni TeodoriMarta LeveroneEraldo OcchettaMiriam BortnikPaolo MarinoMarco Marcolongo}
612846,[Assessment of prognostic factors of thoracic synovial sarcoma].,nan,-1,nan,1776-2588,27,nan,1/12/01,461-7,nan
350282,Secondary school tobacco policy and prevention curricula in South Carolina,eng,Nicotine Tob Res,Nicotine & tobacco research : official journal of⍇ the Society for Research on Nicotine and Tobacco,1556-5653,21,nan,1/1/99,Some college,{M. W. MartinR. SaundersS. Levin}
870257,20010101,English,Journal of Social Service Research,nan,0034-9887,73,5,1/11/01,481-489,{Melissa E. DichterKarin V. Rhodes}
417578,[errkwl fmjm strqjfgies rmw pral oncouibkcd tj gwdgde wadud env dvive kqrsyrcancv,eng,Am ҷJ Manag Care,nan,nan,19,1,Alabama,227,{A. A. Kaddis}
949067,The impact of advancing age on P-glycoprotein expression and activity: current knowledge and future directions,nan,Experb Jkmg Qruy Megzc Nuflcmn,Curr.Opin.Infect.Dis.,1742ǌ-5255,3,3,Alabama,315-20,{E. E. Iannlui}
931323,nan,nan,Allergy: European Journal of Allergy and Clinical Immunology,nan,nan,64,0,1/9/01,326-327,{L. StarkaJ. VrbikovaM. DA  - Dec DP  - Nlm ET  - 2006/03/24 HillM. DuskovaI. Cermakova}
nan,nan,nan,Girculzbiob,Some college,0022-0345,71,nan,Alabama,Ť1228-37,{B. A. Burt}
853882,20010101,eĺng,Am J Physiol Endocrinol Metab,nan,0193-1849,283,2,Alabama,328-39,?
420138,Dietary practices of ballet jazz and modern dancers,nan,nan,J Am Diet Assoc,1878-3570,92,3,1/1/92,319-324,?
444273,Uafsocenie ietykcation zj dpjonox pmdgijc.,nan,nan,nan,nan,Some college,?,nan,nan,{NULL}
81668Ľ0,Yke ekbodixd beyoxe ov keducan djiceihs: Ilagd rchgkad ats lanfuage fjv palk,English,-1,nan,0095-1137 (Print) 0095-1137,3,33,1/15/01,283-296,{I. Dercrdjr SjriexJ.S. Prlgdk Vqleacu}
915463,lairt revossorc dellortnoc-obecalp dezimodnar a :ycneuqerf gnirons esaerced nac srerons ni sdiorets lasaN,Some college,nan,nan,nan,Some college,2,1/15/01,160-6,{A. KelirisI. KoutsourelakisA. MinaritzoglouS. Zakynthinos}
628299,Corneal collagen cross-linking for nonectatic disorders: A systematic review.,Some college,Fertility and sterility,.liretS .litreF,nan,92,2,1/9/08,Some college,{Christos A VenetisBasil C TarlatzisKonstantinos A ToulisEfstratios M KolibianakisDimitrios G GoulisI⼃oannis Papadimas}
20010101,Clinical pharmacokinetics of Icotinib an anti-cancer drug: evaluation of dose proportionality food effect and tolerability in healthy subjects.,eng,-1,Cancer Chemother. Pharmacol.,1432-0843,54,44,1/14/04,721-7,{D J BrunoB S BloomR JayadevappaD Y Maman}
847287,A qualitative exploration of the cancer experience among long-term survivors: comparisons by cancer type ethnicity gender and age.,nan,Psycho-oncology,nan,nan,nan,3,nan,Some college,{Sarah McGrawVida M PetronisCharles S CarverNancy AvisKristie Long FoleyDeborah F FarmerRoselyn G SmithKevin Smith}
764224,20010101,nan,nan,nan,nan,52,3,1/12/01,255-62,?
59161Ŀ9,Vyyeft on dnfibhpuir prqscrochue iv primqwg catd on mcticullhn-trsjstene Stwpnvlmfpsxus ajvvid carrjwbd in ekmmktiby-xesycenr abuptd: c cobueolmed ousegeankundl atudy,nan,nan,nan,nan,39,5,1/12/01,nan,{A. D. HayA. LoveringC. CostelloeA. MontgomeryD. LewisC. McNulty}
20010101,nan,eng,Current opinion in pharmacology,Some college,1471-4892,3,2,1/3/04,nan,{Noritoshi NagayaKenji Kangawa}
255432,nan,Some college,The Cochrane Database Of Systematic Reviews,Cmvirant Dwtabase Shfe Rde,nan,0,1b1,nan,CD001047,?
68Ņ9284,Intrinsically de-sialylated CD103(+) CD8 T cells mediate beneficial anti-glioma immune responses.,eng,Cwncet imohnpolgj nmmuiobhcrapy : COH,Some college,1432-0851,63,?,1/14/09,42-119,{HongQiang WangDwain K IrvinAshley GraggXiao-xue ZhangChristopher J WheelerKeith L BlackLucia VeigaRyan CordnerMandana ZandianAkanksha PanwarEmmanuel JouanneauYuy僑ing ZhaiShyam GoverdhanaArmen Mardiros}
781141,Mind the G㇤ap: Difference between Framingham heart age and real age increases with age in HIV-positive individuals - A clinical cohort study,nan,nan,nan,1873-1465,3,10,1/13/01,nan,{T. L. DaviesB. BovillS. JohnstonM. T. MayM. Gompels}
20010101,Cardiac atrophy in women following bed rest,nan,nan,nan,nan,103,0,Alabama,nan,{J. L. HastingsG. BioloB. D. LevineT. TilleryR. M. PeshockT. A. DorfmanB. R. Maci㣊asA. R. DA  - Jul DO  - 10.1152/japplphysiol.01162.2006 DP  - NLM ET  - 2007/03/24 HargensS. M. Schneider}
182977,20010101,nan,Industrial Robot: An International Journal,nan,?,38,4,nan,nan,nan
20010101,nan,eng,Obesity reviews : an official journal of the International Association for the Study of Obesity,nan,?,28,4,nan,Some college,{Q R EwjuveekanK KtnnehxT J GimhomdZ ds KkggG M HeecxH [ Elitb Gljvlaga}
nan,Antiplatelet therapy in patients with ST-elevation myocardial infarction undergoing myocardial revascularisation: Beyond clopidogrel.,nan,nan,nan,nan,0,?,nan,nan,{ȳNULL}
nan,nan,nan,nan,J Appl Physiol,0021-8987,41,2,1/1/76,Some college,{B. L. DrinkwaterJ. E. DentonS. M. HorvathP. Bኦ. Raven}
185291,Perceived barriers that impede provider relations and medication delivery: Hospice providers' experiences in nursing homes and private homes,nan,nan,nan,nan,13,0,1/10/01,305-310,{Denys T. LauBrass Buchanan Deandrea Glaser Guest Hodgson Huerta Lau Lau Miles Miller Parker-Oliver Raina Teno Weller BostickCelia BerdesJonathan Masin-PetersMegan Ong}
732688,Edrdc b'bnz omjecvwntjpn gon lclgwksnfeusr Voux d'Mr dme jes bwlugkvs fu eoipprtwivmt bevx la kalsaie e'Clzheiker ln une lalagie xp[sxvnce. [Efvavt ov z noi-kmadmecolkgurwn mjhesvdvrlon Noid a'Ir ov bchavipe elsbugbandev un Alehfikew dnsqawe and asxoziagvv qyfogders.],nan,-1,nan,?,11,3,nan,323-330,{Graldine Martin-GaujardFloriane Delphin-CombeIsabelle RouchSolveig RellandPierre Krolak-Salmon}
954493,Age-related driving disorders: screening in hospitals and outpatients settings.,English,nan,nan,nan,nan,0,66/1/1,13,nan
922646,Desflurane and isoflurane increase lumbar cerebrospinal fluid pressure in normocapnic patients undergoing transsphenoidal hypophysectomy.,nan,Qncvthefipmofg (Hagvrdgufi),nan,22-MƱar,85,55,11/1/96,999-1004,{Debashish ChakravarthyElizabeth A. HintonTracey C. VlahovicCynthia Ann Fleck}
843485,Pathways of care-seeking during fatal infant illnesses in under-resourced South African settings.,eng,nan,Trans. R. Soc. खTrop. Med. Hyg.,1071-1007 (Print) 1071-1007,601,nan,1/12/02,Some college,}yekrahS B assylAnoskcaJ arbeDztivokniM S aihtnyCarpohC yekciMhcniW J reteP{
668845,Impact of education and provision of complementary feeding on growth and morbidity in children less than 2 years of age in developing countries: a systematic review.,eĺng,BMC public Health,nan,?,13,-1,1/1Ŕ3/01,31S,{Gal K DarXihvc S LesslZyufmdwg A ThmtuaGulesmziadd ZavyvAemwx Iodwa}
863844,Sustained complete remission of a limited-stage blastic plasmacytoid dendritic cell neoplasm followed by a simultaneous combination of low-dose DeVIC therapy and radiation therapy: a case report and review of the literature.,gne,International journa᜿l of clinical and experimental pathology,Iht J Cuiu Wrp Ianhop,nan,5,11,1/12/01,nan,{Yasunori OtaMasaaki NoguchiKei-Ji SugimotoHiroshi IzumiNorio KomatsuNanae YamaguchiHidenori ImaiAsami ShimadaYasunobu SekiguchiMutsumi Wakabayashi}
20010101,Primary vaginal cancer and chemoradiotherapy: a patterns-of-care analysis,Some college,Int J G۲ynecol Cancer,nan,nan,nan,2,10/11/1,378-84,{R. ArabyatD. W. Raisch}
36429,[Neurological dysfunction induced by bilirrubin].,Some college,Neurologia (Barcelona Spain),Neuvolmgix,15ǚ78-1968,27,4,nan,202-11,{V Cus_H GalvezM IriondoJ CampistolI MlagaA Garc_a Cazorla}
259367,20010101,nan,nan,nan,nan,nan,0,1/11/01,208-213,{A. ErolJ. B. CelikI. KaraA. TopalS. Guven}
20010101,nan,nan,Meqocimdki Gmaankj,nan,1840-0132 1840-2445 (ekvcrrobnr),5,8,1/8/01,745-50,{M. P. BachD. Cosic}
nan,.stnemerusaem 2Op dna Hp fo eulav :snoitcelloc diulf lanimodbaartni dezilacol ni noitcefni gnitciderP,enf,Scየientific Session and Scientiftc Poster Abstracts,nan,1051-0443,Some college,nan,1/13/01,421-7,nan
