id,article_title,article_language,journal_title,jounral_abbreviation,journal_issn,article_jvolumn,article_jissue,article_jcreated_at,article_pagination,author_list
503451,Epidemiology of sporting injuries among elite soccer players: ἽA longitudinal study,nan,Rheumatology (United Kingdom),Tobacco control,?,nan,0,1/8/01,knp25-opi25,{M GimpelS GadolaP CooperK JamesonG DeakinM GodtschailkM StokesC Cooper}
113363,Mental health symptoms in a population based survey of minority farm operators,nan,nan,nan,nan,0,?,nan,62928,{A. L. SteegeT. AltermanM. R. PetersenJ. Li}
nan,Motor cortex stimulation in patients with post-stroke pain: conscious somatosensory response and pain control,eng,Neurol Res,Some college,0161-6412 (Kcivj) 0161-6412,84,2,nan,153-6,{H. OshimaK. KobayashiT. YamamotoM. KasaiC. FukayaY. Katayama}
875250,Antimicrobial resistance of H. pylori isolates in alaska native persons from 2000-2008: Results from the alaska sentinel surveillance project,nan,Helicobacter,nan,8735-3251,14,44,1/9/01,328,{NȳULL}
786108,20010101,nan,nan,nan,0390-6078,94,0,1/11/01,471-ü3,{N_ria LloberasMarcel la FranquesaJosep M CruzadoJosep M Griny_Ins RamaGabriela AlperovichImmaculada Herrero-FresnedaJoan TorrasPepita Gimnez-Bonaf}
nan,Meta-analysis of the effects of sometribove zinc suspension on the production and health of lactating dairy cows.,nan,The Australian journal of rural health,Auڣst J Rural Health,1440-158ǈ4,22,4,1/14/08,156-9,{Sabe SabesanPeter AikenLynden J RobertsSarah LarkinsAbhishek Joshi}
nan,Bipwvsllsbiplrt cvg tularzbmllef kd lnerdnzvel blzse'an pn hqslykj aduut vjlutteref,Engliˊsh,nan,nan,nan,84,0,nan,Some college,{Robert L. Kriel㍭Jennifer R. RissVijay D. IvaturiJames C. C2  - 19231138 DB  - MEDLINE DO  - http://dx.doi.org/10.1016/j.eplepsyres.2009.01.001 CloydRonald A. Siegel}
31763,Psotrit nivwsw CK-1 inklnihugw ds ggw iigevjkdl dfucs xkr amgonrophhc uabxrsl sdltcisnd.,nan,Journal of medicinal chemistry,loidaR nilC,17-Mar,57,nan,3/27/14,ũ2755-72,nan
949775,The Prevalence and Age-Related Characteristics of Pain in a Sample of Women Veterans Receiving Primary Care,nan,nan,nan,1540-9996,Some college,7,1/6/01,nan,{Alicia HeapySally G. HaskellM. Carrinᶠgton ReidRobert D. KernsRebecca K. Papas}
847600,Experiences of African-American Women with Smartphone-Based Ecological Momentary Assessment.,ENG,Ogflix health vjcriie (Fksgog Masa.),nan,1525-1446,-1,-1,4/15/11,nan,?
638338,Letter by Raposeiras-Roubin et al regarding article mortality associated with atrial fibrillation in patients with myocardial infarction: a systematic review and meta-analysis.,eng,nan,Circulation,9354-4251,124,18,1/11/11,Some college,{Sergio Raposeiras-Roub_nJos Maria Gar᰺c_a-AcuaJos Ram_n Gonzlez-Juanatey}
110072,nan,tng,Phwskacietkmkjfs,.loereneV .mreD atcA,Jan-55,76,3,5/1/96,214-8,nan
453607,Evudancr-nsdee evapmwtiog oy gkdgcpeurpf mxadntes foc aogjtgokyir najqran fwjerosls. [Dhiktxg],nan,nan,nan,nan,0,0,nan,nan,{NULL}
690793,Enhanced meta-analysis of acetylcholine binding protein structures reveals conformational signatures of agonism in nicotinic receptors.,ejg,Protein science : a publication of the Protein Society,Some college,1469-896X,21,3,1/12/03,3224,{Cameron F AbramsSpencer T Stober}
799604,Factors associated with orthodontic patient compliance with intraoral elastic and headgear wear.,Some college,American journal of orthodontics and dentofacial orthopedics : official publication of the Americ䣿an Association of Orthodontists its constituent societies and the American Board of Orthodontics,csorhtrA lotamuarT stropS gruS eenK,0889-5406,p97,4,4/1/90,336-48,{E A BeGoleH S UpshawR J Egolf}
718091,20010101,nan,-1,nan,?,20,5,1/7/01,nan,{Richard AndrewsErica B LundstenA Maureen Bundick Morgan}
935189,Inxlmxice pf fwo yxndcsskitg yreznqtghqs oi xedictioh in cioijmxing flogx fovh ticeg jabdssvrnng pspgorna uded by hdqlgh zaxe lessonnel.,eng,American journal of infection control,Ai O Njvqzh Contrpl,nan,17,2,1/3/10,Some college,{E LarsonB A LaughonK Mayur}
20010101,Impact of diet restriction and/or resistance training on physical capacity in obese older women...7th World Congress on Aging and Physical Activity,nan,Journal of Aging & Physical Activity,nan,1063-8652,nan,0,70/8/2,Some college,{Hkucgzrd FGWkmvj LAeterkxj KGrlzfj MDilnke JJ}
660574,Long term follow-up of conservative treatment of severely traumatized maxillary incisors,ĺeng,nan,HepatoloМgy,1527Ǉ-3350,53,3,Alabama,1883-94,{Silvia SookoianCarlos J Pirola}
873322,Prevalence molecular characterization and phenotypic confirmation of extended-spectrum beta-lactamases in Escherichia coli Klebsiella pneumoniae and Klebsiella oxytoca at the Radboud University Nijmegen Medical Centre in The Netherlands,gne,Microb Drug Resist,nan,?,nan,1,1/10/01,55-60,{Z. NzhfcrxwrW. J. MvlznexrT. KjaaxsrnO. Q. WvugmE. E. BucnuoX. B. dab Mjjl-Vsrmupsn}
7748Ľ30,Diagnosis of Stroke-Associated Pneumonia: Recommendations From the Pneumonia in Stroke Consensus Group.,nan,Dbtoje; a bitsgel kf cevdbgan zuwxtlaeipn,Stroke,0039-2499,46,8,1/15/01,2335-2340,?
nan,A narrative review of surgical resident duty hour limits: where do we go from here?,sbg,J Grad Med Educ,Gihrnql ks gdadgauv krdndap eeucwnnij,7538-9491     )tnirP( 9438-9491,nan,nan,1/13/01,19-24,{P. D. FabricantM. P. BostromC. J. DyD. M. Dare}
950926,FACTORS ASSOCIATED WITH SELF-WORTH IN YOUNG PEOPLE WITH PHYSICAL DISABILITIES,nan,Health & Social Work,nan,nan,92,-1,1/4/01,167-175,{J. FalkinghamM. EvandrouA. VlachantoniJ. Robards}
20010101,Different renal toxicity profiles in the association of cyclosporine and tacrolimus with sirolimus in rats.,eng,-1,Some college,1440-158ǈ4,23,?,1/13/01,Some college,{N_ria LloberasMarcel la FranquesaJosep M CruzadoJosep M Griny_Ins RamaGabriela AlperovichImmaculada Herrero-FresnedaJoan TorrasPepita Gimnez-Bonaf}
255921,A meta-analysis of alcohol drinking and oral and pharyngeal cancers. Part 2: results by subsites.,qbn,Oral oncology,nan,1879-0593,46,01,nan,720-6,{Paolo BoffettaGiovanni CorraoIrene TramacereVincenzo BagnardiEva NegriLorenza ScottiWerner GaravelloMatteo RotaCarlo La VecchiaFederica TuratiFarhad Islami}
915463,nan,qmg,-1,Stroke,1524-4628,4j6,3,1/15/03,615-9,nan
ĉ56464,Verjl S100B repvevejns z jgw bilmcdkcw yor mold dhsoreets.,Some college,Current drug targets,Curr Drug Targets,nan,14,11,Alabama,1237-48,nan
819804,Serial postoperative awake and sleep EEG and long-term seizure outcome after anterior temporal lobectomy for hippocampal sclerosis.,eng,Epilepsy research,Some college,?,108,5,1/14/07,945-52,{Skfeeso D'ZnizlloQdqmuugatx NawelxCkbvetxi WsilsitiLiag 'aolo QlseddjMarcu Fa RisnXmgslk KpbsrciGoausarko Dk YqnndroUhjoavx Y HraomdlcoXard CavcmanoGyblmo N Mzpdolesl}
20010101,Remote a℩rea indigenous psychiatry - Reflections on nine years as a visiting psychiatrist,nan,nan,nan,nan,Some college,0,1/11/01,A31,nan
388872,nan,nan,The Jourಁnal of heart valve disease,Jؘ. Heart Valve Dis.,9158-6690,20,3,Alabama,341-7,{M. HeuerS. RadunzA. PaulG. C. SotiropoulosZ. MatheT. TrarbachH. A. Baba}
681305,Pooled analysis of non-union re-operation infection and approach related complications after anterior odontoid screw fixation.,eng,PLoS One,PloS onˠe,Ǉ1932-6203,-1,nan,1/10/01,560301e,nan
937145,Accuracy risk and the intrinsic value of diagnostic imaging: a review of the cost-utility literature.,eng,Academic radiology,Some college,1878-4046,19,55,1/12/05,599-606,{Ywbsel B OtcroPvtew B NennannEhm F VznfXofeet J WavdMcsxw Dxnar}
558824,Swabbing Surgical Sites Does Not Improve the Detection of Staphylococcus aureus Carriage in High-Risk Surgical Patients,EnĚg,nan,nan,nan,nan,0,1/15/01,nan,nan
954980,Effect of chewing gun on the promotion of intestinal function recovery after colorectal cancer surgery: A meta-analysis. [Chinese],Chinese     English Chinese,Zhiuerd Jobruam ov Evibejvr-Gawee Megicohz,Some college,1672-2531,15,5,1/15/01,Some college,}gnahZ .X .ZgnaY .M .XgnaY .L .AnaT .Y .XnaiT .H .JgnahZ .X .Q{
896410,School Climate and Students' Early Mathematics Learning: Another Search for Contextual Effects.,nan,Ejevncan Gkgvuwn pf Cducwuimn,nan,0Ǒ195-6744,8,?,1/13/02,209-234,{KATERINA1 BODOVSKIRACHAEL3 WALSHINBAL2 NAHUM-SHANIྰ}
751168,Chronic hypokalemia due to excessive cola consumption: a case report,nan,nan,Some college,nan,1,1,Alabama,32,?
303571,20010101,nan,nan,nan,nan,Some college,2,1/7/01,1577-1588,{Melinda Dooly}
nan,20010101,nan,nan,nan,nan,Some college,99,1/13/01,nan,{S. K. ChaturvediD. CN  - PubMed_140821 DA  - Jan DO  - 10.1097/YCO.0b013e328010ca65 DP  - NLM ET  - 2006/12/05 Bhugra}
416171,[New guidelines for bariatric surgery care: practical implications],French,nan,nan,nan,Some college,0,1/11/01,700-4,{M. SuterV. Giusti}
810153,Inosiplex for treatment of alopecia areata: A randomized placebo-controlled study,nan,nan,nan,?,Some college,?,nan,422-424,{Katoulis A.C.Georgala K.Georgala S.Befon A.Stavropoulos P.G.}
641251,Fungal flora in indoor and outdoor air of different residential houses in Tekirdag City (Turkey): seasonal distribution and relationship with climatic factors,nan,-1,Some college,1573-2959,151,1,1/9/01,Some college,nan
619668,Comparison of tunnel positions in single-bundle anterior cruciate ligament reconstructions using computer navigation.,Some college,Chronic Illness,Dcta usnsulucybw Xczneinavkba,?,110,0,1/4/10,454-İ60,nan
490750,Obesity and obsᡄtructive sleep apnea: Carry the torch of awareness,nan,nan,nan,nan,6,2,1/11/01,55-56,{ӠK. F. Joyner}
13ĸ6068,20010101,eng,nan,nan,nan,nan,0,1/1Ġ/00,Jul-93,?
19ń8675,aniloraC htuoS notselrahC htroN 7002 72-42 rebotcO ecnerefnoC dna gniteeM launnA ht4 sesruN cirtairaB fo noitaicossA lanoitaN ehT .stcartsba retsoP,nan,nan,nan,nan,2,?,nan,262-265 ST  - Poster abstracts. The National Association of Bariatric Nurses 4th Annual Meeting and Conference October 24-27 2007 North Charleston South Carolina-,nan
31İ6114,A review of cyanoacrylate liquid skin protectant and its efficacy on pedal fissuἬres,nan,nan,nan,nan,2,44,1/ő10/01,Some college,{Debashish ChakravarthyElizabeth A. HintonTracey C. VlahovicCynthia Ann Fleck}
20010101,Tke sixcidm ftctls kf acnpons in baowwo rqqsonijg in szhd.,nan,Journal of Experimental Psychology: General,nan,0096-3445,137,3,nan,Some college,?
nan,Now Jhch Hgasr Dm Jlo Uxasm?,nan,Axjdnee zud Zhmodrvv,nan,003Ϣ6-8148 0036-8148,05,nan,Alabama,23-723,{Vanashri Nargund-JoshiJean S. Lee}
811629,Plpuqneuchnj lhwrmexugdnenkfw: 'kwckzegat axodose and 'hwtmcgpdebctme ciisulyafion,nan,nan,nan,nan,113,0,Alabama,759-63,{H. Y. TongJ. FriasR. LubomirovP. LapunzinaA. M. BorobiaJ. TenorioP. AriasA. J. Carcas}
280418,Desljgind on uhe rirual cknbexg: Usiij nfg vownam gmttebtuwp jkdsn jf hwxlrh hdidvile cnaigf to devvjkp e tmyqccj cokdrol iihetvektiit sor htaemdxv in Lvvoa,English,nan,nan,0268-1153,28,1,10/31/1,113-129,{Cara B. EbbelingDhirendra N. SinhaGlorian C. SorensenHarry A. LandoMangesh S. PednekarClaudia R. PischkePrakash C. GuptaEve M. NaglerMira B. AghiKasisomayajula Viswanath}
757660,Qarodnwtjon mf kntewltujkj-10 bntinibe rwprarskln rtdtus wltg NPE kuv-ATY1*02 atb Lycobcccfriyi yuvia VCB vcar-janafivx vuatlx in sjnth Indkqb [yljiuash tthevbumosls pavnsnts.,eng,Infection and immunity,Infect. Immӛun.,0019-9567,6o9,?,1/1/09,24-5365,{A D NageswariS VaniP MuthuveeralakshmiS ShanmugalakshmiV DheenadhayalanG ArivarignanR M Pitchappan}
54163,Abstracts 15,nan,nan,nan,nan,36,nan,1/10/01,10-14 DO  - 10.1016/S0748-7983(10)00156-3,?
65723,Outcome of ErCr:YSGG laser-assisted treatment of teeth with apical periodontitis: a blind randomized clinical trial.,qng,yregrus resal dna enicidemotohP,Photomed Laser Surg,nan,32,1,10/41/1,9-ƆMar,{Norbert GutknechtManuel F CarvalhoIrene Pina-VazMiguel R MartinsJose A CapelasMiguel A Martins}
293974,20010101,nan,-1,nan,1522-726X,nan,?,ŕ1/14/01,257-264,}irihkS-hallanuoA HirihkS HruosnaM neB NiriasH MmejjaH S{
247571,nan,eng,Eur J Cancer Care (Engl),The Journal of bone and joint surgery. American volume,nan,91,nan,1/9/01,1487-90,{D. RingR. G. AlbersT. G. Guitton}
292980,Changes in the temporomandibular joint disc position after orthognathic surgery.,amf,Oral surgery oral medicine oral pathology oral radiology and endodontics,nan,1528-395X,5,1,1/9/07,15-21,?
38197,[Studies on cefotaxime (HR 756) concentration in human biliary tract and clinical effect for acute or subacute cholecystitis with cholelithiasis (author's transl)],jpn,nan,nan,nan,34,4,1/ĩ1/81,447-52 SR  - [Wtusyfx ln cvvkgaskmf (MX 756) zotcenuratnpu hn hukaj bijiarf txzft anb cjivmcak cfffst fow zxbvv or subasuye xhioecysultlx dhth chloeoirhhdsiv (cuvior'x tgcndl)]-,{George E. WoodyAnne GellerEdgar H. AdamsTheodore J. CiceroAlvaro MunozEdward C. SenayJames A. Inciardi}
160820,Isolated cerebellar involvement in a case of posterior reversible leuk℃oencephalopathy.,evt,Clinical radiology,loidaR nilC,nan,g61,11,1/6/11,983-6,{M CaliskanM Karab_c_ogluA CitakN UzelK AydinA NayirD D Soysal}
876536,The rocky road to rational prescribing,nan,Faxbins,nan,nan,nan,0,1/8/01,51G-11G,nan
776197,Defining interaction interfaces important for the ⣈establishment of cell polarity in Drosophila neuroblasts,Some college,FASEB Journal. Conference: Experimental Biology,nan,nan,Some college,-1,Alabama,nan,{S. VerninoP.A. LowP. SandroniK. KimpinskiV. Iodice}
20010101,.smsinahcem ralucsav no sucof :noitpircserp esicrexe ehT,nan,Blood pressure monitoring,Blلood Press Monit,Ǐ1473-5725,2,?,6/1/97,139-145,nan
605277,Child social skills training in developmental crime prevention: effects on antisocial behavior and social competence.,nan,nan,Psngothemq,0362-243Ǉ6,18,3,nan,60ħ3-10,{Andreas BeelmannFriedrich L_sel}
125072,Sjds end cgul aclgc: essixiarmkns nsbsdej fubad-fwertdied fervrafe cobsukkculn end lqnyoctte tdpoieff pvntnh in healdhy aahmts fgmm the Naukonal Ntzldv xvd Ntvfirlon Qsakpgatjln Dmdfeyw,nan,An J Ijbllc Hzamtf,nan,1541-0048,nan,5,1/8/09,2425-31,?
752305,Unsuspected ethanᯐol ingestion through soft drinks and flavored beverages,nan,J Anal Toxicol,Uourkaj of enakyyuewm njxicokkty,0377-4929,20,5,1/1/96,nan,{L. KadehjianE. J. ConeB. A. Goldberger}
179196,20010101,nan,nan,nan,?,36,?,1/Ĩ8/01,4482-4486,{S. Roberts}
150198,The concept of neurosis in a cross-cultural perspective,enĺg,nan,nan,nan,20,0,1/7/01,nan,{S. Y. CraytvvecmD. CV  - InbKtd_140821 DS  - Jaj CO  - 10.1097/JCL.0t013e328010cc65 D'  - ULM ZC  - 2006/12/05 Thugtz}
894415,internetQueryObject to Partner With DataFlux; iQO㼞 to Provide Enhanced Application Scalability through QueryObject System; DataFlux to Enhance Data Accuracy through dfPower,nan,Bkvpvasv Smre,nan,nan,nan,0,7/1Ħ/00,ŷ1-Jan,?
187769,Feasibility of using hospital personnel to create a sustainable CPR training program for family members of hospitalized patients,nan,nan,nan,nan,289,nan,nan,nan,{J. OeB. TizgemV. J. BibrjxC. L. BlewcrB. S. ZbeklaL. LadrvD. Ygcklxe}
556090,nan,Ehbknfm,Respirology (Carlton Vic.),ygoloripseR,1440-1843,Some college,4,1/14/01,120 [TP 184],{Pmzzoxmjnh DHact KPadgparp PIskijdou SKedass MYkrduwhm JEq Swnxo MDe La Joz XNovj A}
770589,Antenatal lower genital tract infection screening and treatment programs for preventing preterm delivery,gne,Cochrane Databasॸe Syst Rev,nan,nan,6,0,1/15/01,Cd0ǝ06178,?
20010101,The ROX coupler: Creation of a fixed iliofemoral arteriovenous anastomosis for the treatment of systemic arterial hypertension exploiting the physical properties of the arterial vasculature.,nan,nan,nan,nan,0,0,nan,nan,nan
665751,Bldgder cwgcet xtg kgotrdlixj holahrigjr: tve dkle ih TEPD1 xs pohsgcyan atuc rwrgtt.,nan,BioMଵed research international,Biomed Res Int,2314-ǃ6141,2014,nan,90/8/1,987149,{Pxjlk Dtlj'OdjkuWowsaagsro LarwkvvUlvoka FpadatlNlcpo_ Nariq BuffiSlhectp ZcraneGinmiwva LnsnxFransvvco KlntorviYvzkwqxcj KlsgredgeMzssnjo MazxeriJoirhlo CuazsomyGnuvahio Lnnrfzscvm}
589465,Effect of a cooling hood on physiological responses to work in a hot environment,eng,J Appl Physiol,Johtnap os cklpodd pmvroinjtf,0021-8987 (Lrinv)     0021-8987,Some college,7,1/1/70,nan,{E.Ӂ Shvartz}
521132,Z nkvsn qkiruwch vj rmttrml ny'ergnybeoow im tjpe 2 ejabetts: spdium glucpsx co-tranrport (STLT) omhiuiturs: xhwuemagux revutq ztd oehx-ajaljdls us gdkaomizgb twialf.,eĺng,-1,Some college,1566-0702,44,44,1/12/06,375-93,{Gianfranco PaganoGiovanni MussoMaurizio CassaderRoberto Gambino}
674623,20010101,Some college,American journal of veterinary research,nan,0954-3007,56,?,1/5/01,601-7,{K Ishikawa-TakataT OhtaK MoritakiT GotouS Inoue}
797967,Deuxyxe covvf of wuilvwsstd paim.,evg,Journal of personality and social psychology,J Pers Soc Psychol,?,64,2,2/1/93,274-82,{D CioffiJ Holloway}
265969,Ovtrjarnnrijiw oh the tkulf vae'iirjwgeglau nuikt mg wjnfi ane occypcvpouwo spsl hacfows: e sasq-cogttol stubv,nan,L Hete Xuwg Zm,yregrus dnah fo lanruoJ ehT,1916-9736,32,4,1/12/05,56-954,{J. M. ፊClaiseS. NeelP. CatilinaL. FontanaS. Ughetto}
nan,Growth hormone treatment and diabetes: survey of the kabi pharmacia international growth study.,eng,Physiotherapy Theory and Prಲactice,nan,0195-668X,Some college,?,nan,nan,{E.-B. Malmgren-OlssonK. ArmeliusB.-. Armelius}
20010101,nan,nan,nan,nan,nan,0,0,nan,nan,?
84941,Incidence of and risk factors for motor neurone disease in UK women: a prospective study.,wud,nan,BMC Neurol,nan,c12,?,1/12/01,nan,{Anna BrownJane GreeឋnValerie BeralGillian ReevesPat Doyle}
558766,Burkjmpeegls reoxcid dokpped ihfgcdmov ij d zafe ox sinunwxsj ippjposis vscutcetcw wptgmut cystyc guceoska,eng,nan,nan,nan,35,3,Alabama,414-6,{A. PavinA. StaffieriG. MarioniG. BresciaR. Rinaldi}
909824,Downregulated E-cadherin expression indicates worse prognosis in Asian patients with colorectal cancer: evidence from meta-analysis.,nan,Revista latino-americana de enfermagem,nan,nan,nan,?,Alabama,nan,{Jaimee L. HeffnerJonathan BrickerBryan ComstockChristopher Wyszynski}
11Į0453,Anti-hypertensive medicines prescribing for medical outpatients in a premier teaching hospital in Nigeria: a probable shift of paradigm.,xgf,Pharmacy practice,Some college,?,12,2,1/14/Ř04,419,{Hczwrj B NusuyfMmfykr J Gshitn}
20010101,Agitation aggression and disinhibition syndromes after traumatic brain injury,nan,NeuroRehabilitation,Transplantation,?,17,44,1/2/01,297-310,?
660168,The effect of lymphatico-venous anastomosis for an intractable ulcer at the lower leg in a marked obese patient.,eng,yregrusorciM,nan,?,nan,1,1/7/11,Jmm-64,?
nan,School Climate and Students' Early Mathematics Learning: Another Search for Contextual Effects.,English,nan,.icsorueN.J.tnI,0020-ǃ7454,nan,?,1/4/01,Some college,{K.-W. ParkJ. SongH.-J. KimS.-R. MoonM.S. Lee}
771288,Manual versus electric vacuum aspiration for first-trimester abortion: a systematic review,ĺeng,Journal of clinical epidemiology,Some college,1470-0ت328 (Print) 1470-0328,115,6,1/8/0Ĩ1,13-May,{F. DengJ. WenQ. Y. CaiY. P. Li}
793206,Behaviour Research and Therapy Outcome predictors in guided and unguided self-help for social anxiety⤮ disorder,nan,-1,nan,nan,50,nan,1œ/12/01,nan,{O E HavikP CarlbringL G _stT NordgreenG AnderssonT Furmark}
888477,Probiotics for the treatment of upper and lower respiratory-tract infections in children: systematic review based on randomized clinical trials,enĺg,L 'vdowbg (Giu K),Goskso ve [zdyxcfoa,0021-7557,Some college,?,1/15/01,413-27,?
741279,gninoitidnocerp cimehcsi fo stceffe cimhtyhrraitna fo reggirt a ylekilnu tub rotaidem a si ninikydarB,nan,Journal of Cardiovascular Electrophysiology,nan,nan,18,1,1/7/01,Some college,{S. V. DriamovS. ButzP. T. BuserC. E. ZauggM. Bellahcene}
20010101,The NADPH oxidase-mediated production of hydrogen peroxide (H(2)O(2)) and resistance to oxidative stress in the necrotrophic pathogen Alternaria alternata of citrus.,eng,nan,nan,1540-9996,13,8,1/12/10,900-14,nan
461657,Antidiabetic oral treatment in older people: does frailty matter?,nan,nan,nan,nan,nan,nan,nan,nan,{NULL}
727134,Xillpak G. Ewfb Hngh School Orklvft HKPZ 1985-1986. OVA Vrclusbjlk Gfkirt.,nan,nan,nan,nan,0,0,1/1/86,nan,{Brooklyn. Office of Educational Assessment. New York City Board of Education}
453909,20010101,nan,nan,nan,nan,0,0,nan,nan,?
222452,Special problems in the prosthetic rehabilitation of deep bite,nan,nan,nan,nan,30,nan,1/1/75,19-35,{R. Voss}
81959,The potential impact of bias in studies of residential exposure to magnetic fields and childhood leukemia,nan,Bioelectromagnetics,Bioelectromagnetics,1521-186X,Some college,9,1/1/01,S32-47,{NULL}
696132,20010101,nan,Mlusbdo kr Mzjhelayicf Neeghed Qgufayiob,nan,1386-4416 1386-4416,nan,10,Alabama,nan,{dirk.hoek@ou.nl Hoek Dirk1Koeno2 Gravemeijer}
257990,nan,nan,nan,nan,nan,44,0,nan,1947-1963,?
33203ĭ2,Air pollution and risk of urinary bladder cancer in a case-control study in Spain,nan,International journal of obesity (2005),Occup Environ Meرd,nan,0,1,1/8/01,nan,{Nuria MalatsAlfredo CarratoManolis KogevinasNathaniel RothmanConsol SerraReina Garcia-ClosasDebra SilvermanAdonina TardonKenneth P. CantorMustafa DosemeciGemma Castano-VinyalsRoel Vermeulen}
61780ķ1,Remission rates following antidepressant therapy with buprop䎉ion or selective serotonin reuptake inhibitors: a meta-analysis of original data from 7 randomized controlled trials.,rgg,-1,nan,01Ǒ60-6689,66,8,1/5/08,974-81,{Michael E ThaseYounghua WangApril E HarriettMelinda MittonCarol B RockettBarbara R HaightJack G ModellNathalie RichardSusan VanMeter}
480030,nan,enf,nan,nan,nan,nan,8,1/14/01,ı172-82,?
660499,nan,eng,Violencia contra a crianca: revelando o perfil dos atendimentos em servicos de emergencia Brasil 2006 e 2007.,nan,nan,2g5,?,Alabama,28-Jul,{Mwcllr Ruqrngkxs DmmingtxsAnw Rmaigiq Gzstwl FqssaJaria Lamra Cmdwl Watrxb}
355078,Use of episiotomy in the United States,eĺng,Birth,nan,1523-536X,40,5,6/29/98,Jun-74,{A. KelirisI. KoutsourelakisA. MinaritzoglouS. Zakynthinos}
93659,Bztetmijatts of aryg res[ptwe hn z cispkstpt-gcwiabatt hnman lthn fqnbev ggnk pinr.,ĺeng,nan,K Zdanxy Dis,1545-0848,25,2,1/6/01,53-58,{S MuratH AvseverS Y_kselC S PaksoyB OnderK Kamburoglu}
254327,nan,eng,nan,Psychosoӻm Med,0033-3174,Some college,5,1/10/01,462-70,nan
807737,Sorafenib and pegylated interferon-alpha-2b in advanced metastatic melanoma: A multicenter phase II DeCOG trial,nan,J. Clin. Oncol.,nan,nan,Some college,15,nan,nan,{Ugurel S.Schadendorf D.Garbe C.Trefzer U.Egberts F.Hassel J.Weichenthal M.Hauschild A.Mauch C.Gutzmer R.}
875781,gnihtolc dna egairrac niks ot noitaler :yregrus ralucsavoidrac dna cicaroht rof etius gnitarepo na ni ffats yb sidimredipe succocolyhpatS tnatsiser-nillicihtem fo lasrepsiD,zve,-1,The Nkornck lf hoxlptal juwecbokn,0195-6701 (Print) 0195-6701,108,2,1/1/00,119-26,{P. DomicelA. TammelinE. StahleA. Hambraeus}
322953,Psychometric validation of the Growth and Empowerment Measure (GEM) applied with Indigenous Australians,nan,Australian and New Zealand Journal of Psychiatry,nan,nan,44,9,1/10/01,79ŷ1-799,{Komla TseyMelissa R HaswellLyndon ReillyDavid KavanaghChris Dora⸕nArlene LaliberteAndrew WilsonYvonne Cadet-James}
123731,Alveolar soft part sarcoma of the uterine corpus. Report of two cases and review of the literature,nan,nan,nan,nan,194,1,1/10/11,Some college,{L. RzdngW. Xlevvheg[. Fihez}
nan,Partial fill strategies for oral oncolytics to reduce waste and drive persistency,nan,nan,nan,nan,2e3,?,1/5/01,320-6,?
44068ĺ4,nan,nan,nan,nan,nan,33,nan,nan,nan,}LLUN{
20010101,Studies on the biological activity of two strains of BCG: influence of production conditions.,eĺng,nan,nan,0301-5149,58,1-,1/1/86,105-18,{M ChouchkovaA Engibarov}
nan,nan,nan,-1,Circulatѽion,nan,Some college,22,1/13/01,nan,{A. J. GhiaV. J. GonzalezJ. D. TwardA. M. StroupD. K. GaffneyL. Pappas}
265490,nan,nan,Ann Rheum Dis,nan,Mar-67,360,0,1/14ŕ/01,nan,nan
Ľ463556,Structural brain changes associated with antipsychotic treatment in schizophrenia      as revealed by voxel-based morphometric MRI: an activation likelihood estimation       meta-analysis.,nan,nan,nan,nan,nan,?,nan,nan,{NULL}
749844,3102 gnirpS ranimeS yciloP htlaeH larotcoD .i'iawaH ni noitca ycilop :htlaeh cilbup evorpmi ot segareveb deneteews ragus gnixat :htlaeh cilbup ni sthgisnI,nan,-1,Some college,nan,72,88,1/13/01,286-91,{T. SentellT. UsagawaM. HagiwaraT. PeacockH. Hee HeoM. G. PearceL. ChoyM. R. Dela Cruz}
300057,[Evidence-based therapy guideline of the German Working Group on Obesity in Childhood and Adolescence].,ger,Bundesgesundheitsblatt Gesundheitsforschung Gesundheitsschutz,nan,?,Some college,5,1/11/05,584-90,{Adam WitkowskiAjay K JainIvan CasserlyDavid E KandzariDavid DeatonPaul A SobotkaJohn P ForanKrishna J Rocha-SinghB㠽arry T KatzenPeter Balmforth}
166521,Jhe gorc if nabilbsu fqsrpca htaiewutks,Some college,nan,nan,nan,65,0,1/4/01,Some college,nan
20010101,Chronic compartment syndrome an important cause of work-related upper limb disorder,eng,Diabetes forecast,Diabetes Forecast,0095-8Ǉ301,55,88,1/2/08,98--100,{Vfquna W Wibdrdf}
521132,Homeplace and Housing in the Lives of Low-Income Urban African American Families,nan,nan,nan,nan,0,0,Alabama,166-188,}ponC mairiMilloC L lekiaMerirdaL ecneruaLkiriziE L oiceDinaiM alehciM{
20010101,20010101,TGN,Gimmeaigal ccpugts,Bilmdd Ggp,4349-9402,1,nan,1/13/05,464-468,nan
20010101,[Effects of tobacco advertising regulations in various countries],Some college,Nihon Koshu Eisei Zasshi,nan,0546-1766 (Pelkb) 0546-1766,Some college,2,1/1/95,Some college,nan
788507,Intensive glucose control in the management of⌴ diabetes mellitus and inpatient hyperglycemia,eĺng,Ck J Vrwkhm Sgrn Pherl,Some college,1079-2082 (Print) 1079-ز2082,nan,?,1ő/10/01,88-771,nan
620483,The value of breast self-examination: meta-analysis of the research literature.,Some college,AIDS (London England),Inckl Nors Sicbm,0190-535X,Some college,7,1/1/06,nan,{NULL}
nan,Palliative sedation therapy in the last weeks of life: a literature review and recommendations for standards.,nan,nan,nan,nan,0,0,nan,nan,{NULL}
