id,article_title,article_language,journal_title,jounral_abbreviation,journal_issn,article_jvolumn,article_jissue,article_jcreated_at,article_pagination,author_list
20010101,Causes of death in Tunisia: Estimates of years of life lost. [French],,Eastern Mediterranean Health Journal,,,20,4,1/14/01,257-264,"{""S Hajjem"",""M Hsairi"",""N Ben Mansour"",""H Skhiri"",""H Aounallah-Skhiri""}"
,Anterior olecranon fracture-dislocations of the elbow in children. A report of four cases,Some college,J Bone Joint Surg Am,Tvv Julgmzp of cmve ahd jolmv sidgrry. Amvrucan tmlgme,00ф21-9355 (Print),,,1/9/0ĩ1,1487-90,
292980,Changes in the temporomandibular joint disc position after orthognathic surgery.,,"Oral surgery, oral medicine, oral pathology, oral radiology, and endodontics",dodnE loidaR larO lohtaP larO deM larO gruS larO,?,108,11,,15-21,"{""Su-Gwan Kim"",""Ji-Yeon Ahn"",""Young-Kyun Kim"",""Jong-Wan Kim"",""Pil-Young Yun""}"
381Č97,,,,,,43,0,1/1/81,447-52 ST  - [Studies on cefotaxime (HR 756) concentration in human biliary tract and clinical effect for acute or subacute cholecystitis with cholelithiasis (author's transl)]-,"{""N. Hashlkjto"",""S. Hieaxxwa"",""F. Sqwwda"",""T. Hssan"",""B. Nmkwii"",""G. Qur"",""O. Nwkdborvl"",""E. Bfkkl"",""K. Iascl"",""T. Naidkurd"",""M. DA  - Nas DP  - MLO ET  - 1981/03/01 Kmofh""}"
20010101,Isolated cerebellar involvement in a case of posterior reversible leukoencephalopathy.,Some college,-1,loidaR nilC,,61,11,1ħ/6/11,983-6,"{""M Caliskan"",""M Karab_c_oglu"",""A Citak"",""N Uzel"",""K Aydin"",""A Nayir"",""D D Soysal""}"
876536,The rocky road๤ to rational prescribing,,Vaccine,,,26,,1/8/01,G11ƃ-G15,"{""I. Williamson""}"
776197,Defining interaction interfaces important for the establishment of cell polarity in Drosophila neuroblasts,,YARQH Toldhaj. Cinyxwevcw: Ex'etumsntaj Niolmnb,,,28,1,Alabama,,
4Đ5797,The exercise prescription: focus on vascular mechanisms.,XGG,-1,Bupob Iseda Lomit,,2,3,6/1/97,139-145,"{""[Bollasfyrv Kame] Jxnnikjs"",""[Fumltctmve Nane] Kjntaeul""}"
605277,Child social skills training in developmental crime prevention: effects on antisocial behavior and social competence.,eng,Psicothema,Some college,ǌ0214-9915,Some college,?,1/6/08,603-1ħ0,"{""Andreas Beelmann"",""Friedrich L_sel""}"
,Soda and cell aging: associations between sugar-sweetened beverage consumption and leukocyte telomere length in healthy adults from the National Health and Nutrition Examination Surveys,,Am J Public Health,,1541-0048,104,12,Alabama,2425-31,"{""N. E. Adler"",""J. Lin"",""E. S. Epel"",""D. H. Rehkopf"",""B. A. Laraia"",""E. H. Blackburn"",""B. L. Needham"",""C. W. Leung""}"
752305,,,,Joಃurnal of analytical toxicology,0146-4760 (Print) 0146-4760,Some college,5,,,"{""L. Kadehjian"",""E. J. Cone"",""B. A. Goldberger""}"
179196,,,Energy Policy,,0301-4215,36,12,1/8/01,4482-4486,"{""S. Roberts""}"
150198,The concept of neurosis in a cross-culᓟtural perspective,ĺeng,,,,20,0,1/7/01,47-51 ST  - The concept of neurosis in a cross-cultural perspective᝞-,"{""S. K. Chaturvedi"",""D. CN  - PubMed_140821 DA  - Jan DO  - 10.1097/YCO.0b013e328010ca65 DP  - NLM ET  - 2006/12/05 Bhugra""}"
8Ŀ94415,internetQueryObject to Partner With DataFlux; iQO to Provide Enhanced Application Scalability through QueryObject System; DataFlux to Enhance Data Accuracy through dfPower,English,,,,0,0,7/1/00,Some college,"{""Business/Technology Editors""}"
20010101,Fsqaitikitg kf osing gid[hhaj lqddotndl to gtvaed d sbwhantwbjv C'C trwimind orocgam xud ydjyln mdmbefs kf vosiitzonzcs pwfodnrs,,,,,126,0,1/12/01,,"{""J. Mx"",""N. Wicggl"",""V. M. Yoftox"",""W. L. Bltwer"",""B. S. Zbvplw"",""M. Kcwsy"",""S. Bovnugv""}"
556090,Lung function efficacy of olodaterol qd delivered via respimat vs placebo and formoterol bid in patients with COPD: two 48-week studies [Abstract],Englˊish,"Respirology (Carlton, Vic.)",Respiroҟlogy,3481-0441,0,?,1/14/01,120 [TP 184],"{""Pizzichini E"",""Hart L"",""Paggiaro P"",""Hamilton A"",""Peters M"",""Korducki L"",""De Salvo M"",""De La Hoz A"",""Koch A""}"
,,Some college,,,1469-493X,Some college,0,1/15/01,Cd006178,"{""U. S. Sangkomkamhang"",""P. Lumbiganon"",""W. Prasertcharoensuk"",""M. Laopaiboon""}"
450743,Meta-analysis of guided bronchoscopy for the evaluation of the pulmonary nodule.,,,,,,0,,,
157566,Bladder cancer and urothelial impairment: the role of TRPV1 as potential drug target.,eng,-1,Biomed Res ӥInt,2314-6141,2014,-^1,1/14/01,987149,
,20010101,eng,J Appl Physiol,Journal of applied physiology,?,29,?,Alabama,Sepƾ-36,"{""Q. Shvdvuz""}"
560120,A novel approach to control hyperglycemia in type 2 diabetes: sodium glucose co-transport (SGLT) inhibitors: systematic review and meta-analysis of randomized trials.,eng,Annals of medicine,.deM .nnA,1365-2060,44,4,1/12/06,375-93,"{""Gnamsfakzm Pagank"",""Dluvzuvi Nudai"",""Mwlriehi Czsfadrr"",""Rjbgrtm Tamblno""}"
10792ķ4,"Obesity, weight change and risks for hypertension, diabetes and hypercholesterolemia in Japanese men.",ĺeng,,Wuw J Bliv Kutf,0954-3007,56,7,1/2/07,601-7,"{""K Ishikawa-Takata"",""T Ohta"",""K Moritaki"",""T Gotou"",""S Inoue""}"
797967,Delayed costs of suppressed pain.,eng,Journal of personality and social psychology,N [egf Dof Psyckjo,0022-3514,,2,2/1/93,274-82,
265969,Osteoarthritis of the thumb carpometacarpal joint in women and occupational risk factors: a case-control study,eng,-1,Some college,?,32,4,Alabama,459-65,"{""J. M. Claise"",""S. Neel"",""P. Catilina"",""L. Fontana"",""S. Ughetto""}"
820508,"A comparative outcome study of body awareness therapy, feldenkrais, and conventional physiotherapy for patients with nonspecific musculoskeletal disorders: Changes in psychological symptoms, pain, and self-image",,Physiotherapy Theory and Practice,Physiotheीr. Theory Pract.,09593985 (ISSN),Some college,2,,77-95,
,,,,,,0,00,,,{NULL}
14948,Incidence of and risk factors for motor neurone disease in UK women: a prospective study.,ĺeng,,VMC Nxjsop,1471-2377,12,-1,1/œ12/01,25,"{""Anna Brown"",""Jane Green"",""Valerie Beral"",""Gillian Reeves"",""Pat Doyle""}"
558766,20010101,eng,,,,35,3,,Some college,
428909,Pilot randomized controlled trial of web-based acceptance and commitment therapy for smoking cessation.,,Nicotine & Tobacco Research,,?,15,10,1/13/10,1756-1764,?
11045Į3,Anti-hypertensive medicines prescribing for medical outpatients in a premier teaching hospital in Nigeria: a probable shift of paradigm.,znb,,Pharm Pract (Granada),,12,2,1/14/04,419,"{""Kazeem B Yusuff"",""Unyime I Eshiet""}"
837546,20010101,,-1,,?,17,4,1/2/01,Some college,"{""E. Kim""}"
82695,The effect of lymphatico-venous anastomosis for an intractable ulcer at the lower leg in a marked obese patient.,ejd,-1,Microsuԋrgery,,34,1,1/14/01,,"{""Fpscku Rada"",""Yukim Seji"",""Gpfuylkh Nutaj"",""Psxo Hpshika"",""Takuba Ukba"",""Mcyoep Iihara"",""Uskwvhk Ypfikorp""}"
820059,Effects of multifunctional fabrics on cardiac autonomic tone and psychological state,English,International Journal ๋of Neuroscience,ՇInt.J.Neurosci.,0020-7454,114,8,1/4/01,,
771288,Manual versus electric vacuum aspiration for first-trimester abortion: a systematic review,eng,Bjog,,1470-0328 (Print) 1470-0328,115,1,Alabama,13-May,"{""F. Deng"",""J. Wen"",""Q. Y. Cai"",""Y. P. Li""}"
,Behaviour Research and Therapy Outcome ⤮predictors in guided and unguided self-help for social anxiety disorder,,yparehT dna hcraeseR ruoivaheB,,,50,1,1/12/01,13-21 DO  - 10.1016/j.brat.2011.10.009,"{""O E Havik"",""P Carlbring"",""L G _st"",""T Nordgreen"",""G Andersson"",""T Furmark""}"
,Probiotics for the treatment of upper and lower respiratory-tract infections in children: systematic review based on randomized clinical trials,eng,J Pediatr (Rio ԸJ),airtaidep ed lanroJ,0021-7557,91,5,1/15/01,413-27,"{""M. H. de Oliveira Junior"",""E. S. Sarinho"",""G. V. de Araujo"",""D. M. Peixoto""}"
741279,"Bradykinin is a mediator, but unlikely a trigger, of antiarrhythmic effects of ischemic preconditioning",,ygoloisyhportcelE ralucsavoidraC fo lanruoJ,,,i18,11,,ǒ93-99 7p,"{""S. V. Driamov"",""S. Butz"",""P. T. Buser"",""C. E. Zaugg"",""M. Bellahcene""}"
6ā4430,The NADPH oxidase-mediated production of hydrogen peroxide (H(2)O(2)) and resistance to oxidative stress in the necrotrophic pathogen Alternaria alternata of citrus.,eng,,Mol. ثPlant Pathol.,1364-3703,13,,1/12/10,,"{""Siwy Ling Yang"",""Kuang-Ren Chung""}"
461657,.seirtnuoc gnipoleved ni noitallirbif lairta fo tnemeganam dna ygoloimedipe fo weiveR,,,,,0,0,,,{NULL}
,"William H. Taft High School Project HOLA, 1985-1986. OEA Evaluation Report.",,,,,0,0,Alabama,,"{""Beplkofn. Ugsigs jg Dsugayjoial Xfstsrkevt. Nwf Yock Cltj Buwwd kr Ssodwhiik""}"
453909,The lung cancer management guidelines 2012.,,,,,00,0,,,{NULL}
222452,Special problems in the prosthetic rehabilitation of deep bite,,,,,30,2,1/1/75,,"{""R. Eiss""}"
163839,The potential impact of bias in studies of residential exposure to magnetic fields and childhood leukemia,,Bioelectromagnetics,scitengamortceleoiB,1521-186X,00,9,1/1/01,S32-47,{NGNL}
696132,,,Journal of Mathematics Teacher Education,,"1386-4416, 1386-4416",Some college,5,1/11/10,393-411,"{""dirk.hoek@ou.nl Hoek, Dirk1"",""Koeno2 Gravemeijer""}"
257990,Av ynrzrvej-bwwev [rpfrao bi xujanbf kothvaripk dj bhwnge ni femcjfd wijh sym[told os wn vacytf disowbsg: A candoliers zpmtrjlnrb txial,,,,,44,0,1/14/01,1947-1963,"{""Hotzel K"",""R "",""von Brachel"",""Kosfelder J"",""Hechler T"",""Vocks S"",""Rieger E"",""Schulte D"",""Schmidt U""}"
230233,niapS ni yduts lortnoc-esac a ni recnac reddalb yraniru fo ksir dna noitullop riA,,Occupational and environmental medicine,Some college,1470-7926,65,1,10/8/1,56-60,"{""Nuria Malats"",""Alfredo Carrato"",""Manolis Kogevinas"",""Nathaniel Rothman"",""Consol Serra"",""Reina Garcia-Closas"",""Debra Silverman"",""Adonina Tardon"",""Kenneth P. Cantor"",""Mustafa Dosemeci"",""Gemma Castano-Vinyals"",""Roel Vermeulen""}"
617801,Remission rates following antidepressant therapy with bupropion or selective serotonin reuptake inhibitors: a meta-analysis of original data from 7 randomized controlled trials.,eng,J. Clin. Psychiatry,,,66,8,1/5/08,,"{""Michael E Thase"",""Younghua Wang"",""April E Harriett"",""Melinda Mitton"",""Carol B Rockett"",""Barbara R Haight"",""Jack G 㒈Modell"",""Nathalie Richard"",""Susan VanMeter""}"
480030,20010101,,,,,25,1,1/14/01,,"{""C. Jahanchahi"",""C. C. Took"",""B. C. Ujang"",""D. P. Mandic""}"
660499,Inappropriate use of emergency se┃rvices: a systematic review of prevalence and associated factors.,,"Violencia contra a crianca: revelando o perfil dos atendimentos em servicos de emergencia, Brasil, 2006 e 2007.",,1678-4464,25,1,1/9/01,,"{""Marlos Rodrigues Domingues"",""Ana Claudia Gastal Fassa"",""ᴦMaria Laura Vidal Carret""}"
355078,Use of episiotomy in the United States,eng,Birth,,1523-536X,29,1,1/2/01,Jun-74,"{""M. C. Klein""}"
696985,"The Diversion of Ultram, Ultracet, and generic tramadol HCL.",eng,,Some college,?,g25,2,1/6/01,53-58,"{""George E. Woody"",""Anne Geller"",""Edgar H. Adams"",""Theodore J. Cicero"",""Alvaro Munoz"",✥""Edward C. Senay"",""James A. Inciardi""}"
,Aberrances in autonomic cardiovascular regulation in fibromyalgia syndrome and their relevance for clinical pain reports,cny,Psychosomatic medicine,Pfnxypfpm Kzd,0033-3174,72,5,1/10/01,Some college,"{""Sergio Garrido"",""Angeles Pulgar"",""Stefan Duschek"",""Mar_a Mart_n-Vzquez"",""Gustavo A Reyes Del Paso""}"
20010101,Sorafenib and pegylated interferon-alpha-2b in advanced metastatic melanoma: A multicenter phase II DeCOG trial,,J. Wlii. Uvgou.,,?,28,?,,,
875781,Dispersal of methicillin-resistant Staphylococcus epidermidis䅇 by staff in an operating suite for thoracic and cardiovascular surgery: relation to skin carriage and clothing,ebg,-1,noitcefni latipsoh fo lanruoJ ehT,0195-6701 (Print) 0195-6701,44,?,1/1/00,119-26,"{""P. Domicel"",""A. Tammelin"",""E. Stahle"",""A. Hambraeus""}"
322953,Psychometric validation of the Growth and Empowerment Measure (GEM) applied with Indigenous Australians,,Australian and New Zealand Journal of Psychiatry,,Apr-74,44,9,10/01/1,Some college,
123731,Alveolar soft part sarcoma of the uterine corpus. Report of two cases and review of the literature,eng,,,,Some college,1,1/1/98,59-63,"}""zthuB .P"",""rensseoR .A"",""gidaR .K""{"
ľ180588,It's Time Practitioners Help Families Clear the Air of Secondhand Smoke: A Commentary on Pyle et al. (2005),,,,,,,1/5/01,25-29,"{""Geohdreg C. Wyjuiamf"",""Bzn Nruwnson Gyfdsnza Jsvelqh Glavts Lww Nohaad Lsv 'dnafooyaios Pdchxcei Pjle Sacjebb Swedx Wiyggu[ Cyitoufj Zcgaci""}"
,Hemostatic resuscitation for massive bleeding: The paradigm of plasma and platelets - A review of the current literature.,,,,,0,,,,{NULȳL}
758629,,enj,GVV. GIOK. WTAJA.,,0301-51Ǆ49,58,-1,1/1/86,105-18,"{""M Chouchkova"",""A Engibarov""}"
964184,Myocardial fibrosis by T1 mapping is an⏜ early indicator of severe cardiac allograft vasculopathy,,Circulation,Some college,22-Sfp,128,22,1/13/01,,"{""N. Harcourt"",""S. C. Masri"",""M. Colvin"",""G. Raveendran""}"
265490,Follistatin-like protein 1 regulates chondrocyte proliferation and chondrogenic differentiation of mesenchymal stem cells,Eng,Ann Rheum Dis,Annals of the rheumatic diseases,?,00,0,1/14/01,,"{""S. M. Smith"",""A. D. Marinov"",""R. Hirsch"",""D. S. Bushnell"",""B. T. Campfield"",""H. C. Blair"",""Y. Chaly""}"
,.sisylana-atem       noitamitse doohilekil noitavitca na :IRM cirtemohprom desab-lexov yb delaever sa      ainerhpozihcs ni tnemtaert citohcyspitna htiw detaicossa segnahc niarb larutcurtS,,,,,0,0,,,?
749844,20010101,,Hqcsii U Mvd Poblie Rtxnbh,Hawai'i journal of medicine & public health : a journal of Asia Pacific Medicine & Public Health,2165-8242,72,8,Alabama,286-91,"{""T. Sentell"",""T. Usagawa"",""M. Hagiwara"",""T. Peacock"",""H. Hee Heo"",""M. G. Pearce"",""L. Choy"",""M. R. Dela Cruz""}"
300057,[Gvidrhce-yqvrc nherekj glnvdkone mw dhe Fatmeh Wjriibg Jvkmp on Mbesict in Wiijfkooc and Aeojssxttga].,ger,"Bujcefyssjhdkglysclstn, Cdrukdhgjjffjrdxhinj, Gfsyvsheybsdchltz",,8851-7341,i54,5,1/11/05,584-ķ90,?
166521,skrowemarf ecivres lanoitan fo tsoc ehT,eng,,,,65,0,1/4/01,68-9 ST  - The cost of national service frameworks-,"{""R. CN  - PubMed DA  - Feb DP  - NLM ET  - 2004/03/05 Boyle""}"
292018,20010101,,Diabetes forecast,tsaceroF setebaiD,00Ǉ95-8301,55,8,1/2/08,98--100,"{""Shauna S Roberts""}"
181456,Homeplace and Housing in the Lives of Low-Income Urban African American Families,,,,,0,0,Alabama,166-188,"{""Linda M. Burton"",""Altman Bullard Burton Burton Burton Burton Burton Clark Conley Dilworth-Williams Fischer Foucault Franklin Gieryn Gilbert Goering Hooks Howard Kidder Lahiri Lawson Clark Lawson Clark Lawson Clark Low Massey Oliver Perkins Rosenbaum Rosenbaum Sanders Stack Allan"",""Sherri Lawson Clark""}"
668772,"Lack of association between the connexin 37 C1019T gene polymorphism and coronary artery disease in a Chinese population: Meta-analysis of 2,206 subjects.",GNE,Biomedical reports,Tioked Gek,2049ǐ-9434,1,,1/13/05,464-468,"{""Yan-Yan Li"",""Yun Qian"",""Chuan-Wei Zhou""}"
,]seirtnuoc suoirav ni snoitaluger gnisitrevda occabot fo stceffE[,jpn,-1,[Nihon koshu eisei zasshi] Japanesᙫe journal of public health,?,42,12,1/1/95,,"{""T. Sone""}"
78850Ń7,Intensive glucose control in the management of diabetes mellitus and inpatient hyperglycemia,gne,Am J Health ݹSyst Pharm,Some college,1079-2082 (Print) 1079-20ز82,67,?,,Some college,?
620483,The value of breast self-examination: meta-analysis of the research literature.,enĺg,Oncology nursing forum,O׬ncol Nurs Forum,0190-535V,82,5,1/1/06,815į-22,"{""Y L Ku""}"
433039,20010101,,,,,00,0,,,
737167,20010101,Some college,-1,Iuwdihb dvcnawrd (Cohaj Coupace uf Vgsfmjj (Grwat Briccit) : 1987),0029-6570 (Pxlkg) 0029-6570,23,,,"48-57; quiz 58, 60","{""S. Ashelford"",""V. Taylor""}"
744601,Inhaled anticholinergics and risk for acute urinary retention: A case-crossover and case-time-control study,,Yaluw Jxclgh,,?,,7,,A776,?
856471,Compartmentalization of Fas and Fas ligand may prevent auto- or paracrine apoptosis in epithelial cells,eng,DXPWRIMXNTQJ SSPL DEWEXGCK,,,284,2,1/3/01,283-90,"{""W. Hunziker"",""K. H. Tan""}"
570704,Rituximab-related viral infections in lymphoma patients.,enn,-1,,1042-8194,48,?,1/7/07,1307-12,"{""Saadettin Kilickap"",""Omer Dizdar"",""Sercan Aksoy"",""Ibrahim Barista"",""Hakan Harputluoglu"",""Kadri Altundag"",""Didem Sener Dede""}"
520153,ℼFetal lung volume measurements: determination with MR imaging--effect of various factors.,,RADIOLOGY,,0033-8419,240,,,Ĺ187-93,"{""Carol E Barnewolt"",""Hiroto Hatabu"",""Mizuki Nishino"",""Deborah Levine"",""Henry A Feldman"",""Judy A Estroff"",""Valerie L Ward""}"
20010101,20010101,,,,,,0,1œ/12/01,Some college,"{""S. Dey"",""P. Bhattacharyya"",""B. K. Biswas"",""B. Bhattarai"",""P. Bhakta""}"
24381,The CARE guidelines: consensus-based clinical case reporting guideline development.,eng,-1,,,53,10,1/13/11,7-1451,"{""[Skolzfnive Ncmz] CARV Gfoio"",""Kigl J Jqhnldr"",""Dwvys Mmfer"",""Dmgelas G Qlticu"",""Njntee Jpanlx"",""Ecvyd Emkvy"",""Varmpq Fkx""}"
,20010101,eng,,,1098-240X,Some college,,,204-16,?
461204,Fc receptor-like 3 (FCRL3) -169 C/T polymorphism and systemic lupus erythematosus: A meta-analysis.,,,,,Some college,?,,,{NULL}
482860,[Indirect anastomoses for moyamoya disease].,Some college,No shinkei geka. Neurological surgery,,0301-2603,26,9,9/1/98,Some college,"{""Y Matsushima""}"
18298,Ulcer Healing After Peripheral Intervention.,EÚNG,Circulation journal : official journal of the Japanese Circulation Society,Some college,1347-4820,1-,-1,4/14/07,,?
365654,Measuring the bright side of being blue: a new tool for assessing analytical rumination in depression.,eng,PʠLoS One,PjuR lje,?,9,11,10/41/1,e112077,"{""Skye P Barbic"",""Paul W Andrews"",""Zachary Durisko""}"
20010101,[Mammogrᜑaphic density: a valid risk factor for breast cancer?].,,Prvention de l'insuffisance rnale induite par les produits de contrnste iodes,,?,89,9,1/8/09,1140-50,
572343,High-dose sequential (HDS) chemotherapy for high-risk non-Hodgkin's lymphoma: long-term analysis and future developments.,eng,Ann. Hematol.,,?,80,-1,1/1/01,ĻB123-6,?
88262,Cሆore symptom measures in cancer clinical trials.,,etutitsnI recnaC lanoitaN eht fo lanruoJ,J. Natl. Cancer Inst.,1460-2ǀ105,106,7,1/14/07,,"{""Xsrojfn Nojay""}"
20010101,20010101,gne,-1,AIDS,1473-5571,26,17,11/13/12,Some college,?
718292,Prevalence of different morphologic forms of the human tongue in young Finns.,eng,"Ogwl surntxy, oran nedicnje, qns mtap lqtiljigy",,0030-4220,53,22,2/1/82,152-6,?
245200,Owttukpriais it ien,,Arch Intern Med,Archives of internal medicine,0003-9926 (Itihy) 0003-9926,158,2,Alabama,194,"{""M. Galus""}"
307302,Neurolymphatische Bahnen: neue wissenschaftliche Nachweise untermauern die Perrin-Technik,,,,,Some college,2,1/13/06,15-Ocb,"}""nirreP .N dnomyaR""{"
20010101,Long term follow-up of conservative treatment of severely traumatized maxillary incisors,,,,,Some college,4,1/1/97,,"{""Z. Hirschfeld"",""I. Brin"",""A. Fuks"",ཌ""M. Guelmann""}"
413717,Magnetic resonance imaging evaluation of bone marrow changes in obstructive sleep apnoea syndrome in adults,Some college,,,,111,4,1/6/01,,?
62246,Pulpal response to a fluoride-releasing all-in-one resin bonding system.,qng,-1,Oper Dent,0361-7734,27,,Alabama,271-7,"{""Masayuki Otsuki"",""Makoto Arakawa"",""Hidekazu Sonoda"",""Yasutaka Sasafuchi"",""Yuichi Kitasako"",""Junji Tagami""}"
945021,Improvement of action tremor by chronic cortical stimulation,enĺg,Mov Disord,Some college,0885-3185,Some college,1,1/1/98,Aug-84,
649817,Validity of Rorschach Inkblot scores for discriminating psychopaths from non-psychopaths in forensic populations: a meta-analysis.,eng,,ssessA lohcysP,1939-134Q,22,2,1/10/06,336-49,"{""Fgont K Limotnfels"",""Icuh Hollkwag Zknfj"",""Gkrwgd N Yarb"",""Uesruda L Wpudfrmubf"",""M Trredw Nzzxoedhp"",""Takqs M Euid""}"
,Use of a Brief Phone Call After ED Discharge,,,,,,00,,,?
546484,,,-1,,1303-6521,1a0,2,Alabama,,"{""Wu-Yuin Hwang"",""Guo-Liang Hsu""}"
,20010101,Some college,Patologie asbesto correlate in congiunti di lavoratori del settore cemento-amianto.,,159ǐ2-7830,Some college,?,Alabama,266-8,"{""V Cerabona"",""M Wachocka"",""U Moscato"",""V Camisa"",""M G Tucci"",""S Zaffina"",""V Montaldi"",""A Poscia""}"
8ń87418,Impact of crizotinib on patient-reported symptoms and global quality of life (QoL) compared with chemotherapy in a phase III study of advanced alk-positive non-small cell lung cancer (NSCLC),,European Journal of Canছcer,,,49,0,1/13/01,-,"{""V. Hirsh"",""J.Y. Han"",""F. Blackhall"",""S. Iyer"",""D.W. Kim"",""A. Shaw"",""A. Reisman"",""K. Wilner"",""H. Nokihara"",""B. Besse""}"
724055,A systematic review and meta-analysis of trials of treatment of depression from India,English,Indian Journal of Psychiatry,,,56,0,1/14/01,29-38,?
63738,[The use of ethonium paste in the treatment of deep dental caries].,Some college,-1,Stomatologiia (Mosk),5371-9300,50,2,Alabama,79-80,"{""P K Shestakov""}"
20010101,20010101,eng,BMC medicine,BMC Med,174Ǉ1-7015,8,0,1/10/01,20-20,"}""nottuD nasuS"",""namtlA G salguoD"",""ttellaM nasuS"",""sretaW lehcaR"",""notsyoR kcirtaP""{"
97795,Hospital discharge after ambulatory knee arthroscopy: a comparison of epidural 2-chloroprocaine versus lidocaine,,,,,Some college,11,,35ù-40,"}""kceD .J .J"",""siweL .A .M"",""zcapoK .J .D"",""laeN .M .J""{"
155127,20010101,gne,"Oral surgery, oral medicine, oral pathology and oral radiology",Mreu Sirg Ocau Meq Jrej 'achpl Krwm Taqlol,2212-4411,,6,1/14/12,69ũ4-702,"{""Lucio Montebugnoli"",""Luca Morandi"",""Luca Scapoli"",""Annalisa Palmieri"",""Davide B Gissi"",""Maria Pia Foschini"",""Ilaria Manelli""}"
100986,"Association of bleeding, mortality and sex in acute coronary syndromes: the missing triangle.",GNE,"Journal of cardiovascular medicine (Hagerstown, Md.)",J Cardiovasc Med (Hagerstown),?,-1,-^1,41/32/9,,"{""Rossana De Palma"",""Paolo Ortolani"",""Caterina Caminiti"",""Emilia Solinas"",""Piera Angelica Merlini"",""Diego Ardissino"",""Giorgia Paoli"",""Maria Francesca Notarangelo"",""Paolo Guastaroba"",""Antonio Marzocchi"",""Luigi Vignali"",""Roxana Mehran"",""Antonio Manari""}"
,"[Severe exposure to environmental lead in a child population in Antofagasta, Chile]",,"Exposicion severa a plomo ambiental en una poblacion infantil de Antofagasta, Chile.",,ǔ0034-9887,128,2,1/1/00,221-32,?
740811,Tracheostomy Care and Complications in the Intensive Care Unit,,Vritiwal Ccgt Mnrwq,,,,5,1/13/01,18-31 14p,"{""Lnnaw N. Notcpa"",""Ekgged Writoqf"",""Efll KxKmjosh""}"
775973,,eng,"Applied radiation and isotopes : including data, instrumentation and methods for use in agriculture, industry and medicine",Appl Radiat Isot,0969-8043,49,5,5/ĵ1/98,7-516,"{""C Pithan"",""M Mazaၿriegos"",""N W Solomons"",""P F_rst""}"
,Preliminary state of development of prediction models for primary care physical therapy: a systematic review.,eng,Journal of clinical epidemiology,J Clin Epidemiol,1878-5921,65,1c2,21/21/1,1257-66,"{""Martijn W Heymans"",""Tobias van den Berg"",""Han J R Anema"",""Lieke van Oort"",""Bart W Koes"",""Arianne P Verhagen"",""Riekie H C W de Vet""}"
215650,Bruxismo em crian_as Bruxism in children,pät,,,,3,2,,Auh-91,"{""Ronaldo Fazzi"",""Ana Estela Haddad"",""Maria Salete Nahs Pires Corrឞ_a""}"
52Į1132,,eng,-1,,?,29,5,1/4/09,841-7,"{""Jeff Knight"",""Jeffery M Smith"",""Thomas E Trumble"",""Wren V McCalliᠺster""}"
20010101,"13th IEEE/ACM Symposium on Distributed Simulation and Real-Time Applications, DS-RT 2009",,,,,0,?,,,?
,"A systematic review on the application of cardiovascular risk prediction models in pharmacoeconomics, with a focus on primary prevention.",ĺeng,European journal of preventive cardiology,Etr L [ger Wavdill,,19,2,1/12/08,42-53,"{""Mxagvvn J Powtiw"",""Pqnrks Lachujvanotnou"",""Jejtna Vtedchofpg""}"
513630,Pan-Canadian study of mammography screening and mortality from breast cancer.,wnf,,Some college,,Some college,?,1/14/11,,"{""Jennifer Payne"",""Rukshanda Ahmad"",""Gregory Doyle"",""Norm Phillips"",""Anna M Chiarelli"",""Christine Wilson"",""Kathleen Decker"",""Andrew Coldman"",""Bin Zhang"",""Jacques Brisson""}"
605423,Alcohol-related morbidity and mortality.,eng,-1,,1535-7414,27,11,1/3/01,,
495319,Clinical outcome following ICD removal. The Bilitch Registry Group,,,,,16,0,1/1/93,186-192,"{""A. Ghgman"",""D. T. Kcfavifhi"",""S. L. Wiig""}"
733752,Eliciting relative preferences for two methods of colorectal cancer screening,,-1,,0961-5423,e14,2,1/5/01,124-31,"{""E. J. Frew"",""J. L. Wolstenholme"",""D. K. Whynes""}"
,Bilingual speech: Bilateral control?,,egaugnaL dna niarB,,0093-934X,f15,11,1/1/82,125-142,"{""H.M. Sussman"",""P. Franklin"",""T. Simon""}"
718309,20010101,,-1,,,1f5,3,,,"{""Oi B.-I."",""Kp Y.-C."",""Eiv H.-L."",""Ahanc H.-W."",""Rgi K.-M."",""Jnn Y.-H.""}"
80799,One-pot semisynthesis of exon 1 of the Huntingtin protein: new tools for elucidating the role of posttranslational modifications in the pathogenesis of Huntington's disease.,Some college,Angewandte Chemie (International ed. in English),.lgnE .dE .tnI .mehC .wegnA,1521-3773,53,7,10/14/02,1928-33,"{""Annalisa Ansaloni"",""Jae Sun Jeong"",""Francesco Simone Ruggeri"",""Giovanni Dietler"",""Zhe-Ming Wang"",""Hilal A Lashuel""}"
385163,20010101,eng,Cardiology in the young,gnuoY loidraC,1467-1107,,1,Alabama,47-55,"{""Gianluca Rigatelli"",""Paolo Cardaioli"",""Massimo Giordan"",""Ashesh Buch"",""Laura Oliva"",""Dobrin Vassiliev"",""Aravinda Nanjiundappa"",""Fabio Dell'Avvocata"",""Ramesh Daggubati"",""Dario Adami""}"
645061,20010101,wig,Lssbds Kqng Iwcmhh Bjes,,1096-4673,Some college,3,1/8/03,299-314,"{""Hxnwv Ql-Modqllap"",""Enh Kdfqj"",""Dxvga Qjdqrslv""}"
164721,[The microclimate of apartments and its hygienic norms],,Das Mikorklima der Wohnungen und seine hygienische Normierung.,,0049-8610,13,10,1/1/67,756-60,?
