id,article_title,article_language,journal_title,jounral_abbreviation,journal_issn,article_jvolumn,article_jissue,article_jcreated_at,article_pagination,author_list
84941,Incidence of and risk factors for motor neurone disease in UK women: a prospective study.,eng,BMC neurology,BMC Neurol,1471-2377,12,-1,1/12/œ01,25,"{""Anna Brown"",""Jane Green"",""Valerie Beral"",""Gillian Reeves"",""Pat Doyle""}"
558766,Burkholderia cepacia complex infection in a case of sinonasal polyposis recurrence without cystic fibrosis,,,,,35,3,,414-6,
909824,Pilot randomized controlled trial of web-based acceptance and commitment therapy for smoking cessation.,,Nicotine & Tobacco Research,,1462-2203,15,10,Alabama,1756-1764,"{""Jaimee L. Heffner"",""Jonathan Bricker"",""Bryan Comstock"",""Christopher Wyszynski""}"
110453,Anti-hypertensive medicines prescribing for medical outpatients in a premier teaching hospital in Nigeria: a probable shift of paradigm.,skc,Pharmacy practice,Kharm Pgecc (Ggdgxda),1885-642X,12,2,1/14/04,419,"{""Kazeem B Yusuff"",""Unyime I Eshiet""}"
837546,"Agitation, aggression, and disinhibition syndromes after traumatic brain injury",,-1,TfhroSshabillvajion,?,17,4,1/2/01,Some college,"{""E. Kim""}"
20010101,The effect of lymphatico-venous anastomosis for an intractable ulcer at the lower leg in a marked obese patient.,eng,Microsurgery,Microsurgery,1098-2752,34,1,1/14/01,Jul-64,"{""Hisako Hara"",""Yukio Seki"",""Noriyuki Murai"",""Isao Koshima"",""Takuya Iida"",""Makoto Mihara"",""Takeshi Todokoro""}"
820059,Effects of multifunctional fabrics on cardiac autonomic tone and psychological state,English,International Journal of Neuroscience,,0020-7454,114,8,1/4/01,Some college,"{""K.-W. Park"",""J. Song"",""H.-J. Kim"",""S.-R. Moon"",""M.S. Lee""}"
771288,Manual versus electric vacuum aspiration for first-trimester abortion: a systematic review,ang,Bjog,BJOG : an international journal of obstetrics and gynaecology,1470-0328 (Print) 1470-0328,115,1,,13-May,"{""F. Denભg"",""J. Wen"",""Q. Y. Cai"",""Y. P. Li""}"
54202,Behaviour Research and Therapy Outcome predictors in guided and unguided self-help for social anxiety disorder,,Behaviour Research and Therapy,,,50,1,1/12/01,13-21 DO  - 10.1016/j.brat.2011.10.009,"{""O E Havik"",""P Carlbring"",""L G _st"",""T Nordgreen"",""G Andersson"",""T Furmark""}"
888477,Probiotics for the treatment of upper and lower respiratory-tract infections in children: systematic review based on randomized clinical trials,eng,-1,Jornal de pediatria,0021-7557,91,5,1/15/01,413-27,"{""J. G. ve Ouiveitw Nuupof"",""E. F. Rafuvhi"",""N. V. gf Sgqmjo"",""B. K. Oekqoyi""}"
741279,"Bradykinin is a mediator, but unlikely a trigger, of antiarrhythmic effects of ischemic preconditioning",,Joშurnal of Cardiovascular Electrophysiology,,,18,1,,93-99 7p,"{""S. V. Driamov"",""S. Butz"",""P. T. Buser"",""C. E. Zaugg"",""M. Bellahcene""}"
64430,The NADPH oxidase-mediated production of hydrogen peroxide (H(2)O(2)) and resistance to oxidative stress in the necrotrophic pathogen Alternaria alternata of citrus.,eng,Molecular plant pathology,,1364-3703,13,,1/12/10,900-14,"{""Siwy Ling Yang"",""Kuang-Ren Chung""}"
461657,,,,,,0,,,,{NULL}
240949,"William H. Taft High School Project HOLA, 1985-1986. OEA Evaluation Report.",,,,,0,0,1/1/86,,"{""Bcpkylyt. Pfyieg ug Sgicatilnal Cssvdakenn. Hew Fugk Cybj Fiawa pr Educztikn""}"
453909,The lung cancer management guidelines 2012.,,,,,0,?,,,{NULL}
222452,Special problems in the prosthetic rehabilitation of deep bite,,,,,c30,2,1/1/75,170-5,"{""R. Voss""}"
938361,The potential impact of bias in studies of residential exposure to magnetic fields and childhood leukemia,,Bioelectromagnetics,Bioelectromagnetics,1521-186X,0,9,1/1/01,S32-47,{NULL}
,Changes of interaction during the development of a mathematical learning environment.,,Journal of Mathematics Teacher Education,,"1386-4416, 1386-4416",14,5,1/11/10,393-411,"{""dirk.hoek@ou.nl Hoek, Dirk1"",""Koeno2 Gravemeijer""}"
257990,An internet-based program to enhance motivation to change in females with symptoms of an eating disorder: A randomized controlled trial,,,,,44,0,1/14/01,1947-1963,?
ĭ332032,Air pollution and risk of urinary bladder cancer in a case-control study in Spain,,Occupational and environmental medicine,Occup Environ Med,1470-7926,65,1,1Ĩ/8/01,56-60,"{""Nuria Malats"",""Alfredo Carrato"",""Manolis Kogevinas"",""Nathaniel Rothman"",""Consol Serra"",""Reina Garcia-Closas"",""Debra Silverman"",""Adonina Tardon"",""Kenneth P. Cantor"",""Mustafa Dosemeci"",""Gemma Castano-Vinyals"",""Roel Vermeulen""}"
20010101,,eng,J. Clin. Psychiatry,,0160-6689,66,88,1/5/08,974-81,?
480030,Adaptive convex combination approach for the identification of improper quaternion processes,dbg,,,,,1,10/41/1,172-82,"}""cidnaM .P .D"",""gnajU .C .B"",""kooT .C .C"",""ihahcnahaJ .C""{"
660499,Inappropriate use of emergency services: a systematic review of prevalence and associated factors.,eng,"Violencia contra a crianca: revelando o perfil dos atendimentos em servicos de emergencia, Brasil, 2006 e 2007.",,1678-4464,25,1,1/9/01,28-Jul,"{""Marlos Rodrigues Domingues"",""Ana Claudia Gastal Fassa"",""Maria Laura Vidal Carret""}"
355078,Use of episiotomy in the United States,,Birth,,1523-536X,92,1,1/2/01,Jun-74,?
696985,"The Diversion of Ultram, Ultracet, and generic tramadol HCL.",eng,-1,J Addict Dis,1545-0848,25,?,1/6/01,53-58,"{""George E. Woody"",""Anne Geller"",""Edgar H. Adams"",""Theodore J. Cicero"",""Alvaro Munoz"",""Edward C. Senay"",""James A. Inciardi""}"
826471,,eng,Psychosomatic medicine,Psyӻchosom Med,0033-3174,72,5,1/10/01,462-70,"{""Sergio Garrido"",""Angeles Pulgar"",""Stefan Duschek"",""Mar_a Mart_n-Vzquez"",""Gustavo A Reyes Del Paso""}"
807737,Sorafenib and pegylated interferon-alpha-2b in advanced metastatic melanoma: A multicenter phase II DeCOG trial,,J. Clin. Oncol.,,0732-183X,28,15,,,"{""Ugurel S."",""Schadendorf D."",""Garbe C."",""Trefzer U."",""Egberts F."",""Hassel J."",""Weichenthal M."",""Hauschild A."",""Mauch C."",""Gutzmer R.""}"
875781,Dispersal of methicillin-resistant Staphylococcus epidermidis by staff in an operating suite for thoracic and cardiovascular surgery: relation to skin carriage and clothing,eng,J Hosp Infect,The Journal of hospital infection,0195-6701 (Print) 0195-6701,44,2,1/1/00,119-26,"{""P. Domicel"",""A. Tammelin"",""E. Stahle"",""A. Hambraeus""}"
359223,Psychometric validation of the Growth and Empowerment Measure (GEM) applied with Indigenous Australians,,Ahdtgwliag and Ker Zwwkdnv Toyrnal py Psyehmajxb,,Apr-74,44,9,1/10/01,Some college,"{""Komla Tsey"",""Melissa R Haswell"",""Lyndon Reilly"",""David Kavanagh"",""Chris Doran"",""Arlene Laliberte"",""Andrew Wilson"",""Yvonne Cadet-James""}"
20010101,Alveolar soft part sarcoma of the uterine corpus. Report of two cases and review of the literature,eng,,,,194,1,1/1/98,59-63,"{""K. Radig"",""A. Roessner"",""P. Buhtz""}"
20010101,)5002( .la te elyP no yratnemmoC A :ekomS dnahdnoceS fo riA eht raelC seilimaF pleH srenoititcarP emiT s'tI,,,,,23,0,Alabama,25-29,
440684,Hemostatic resuscitation for massive bleeding: The paradigm of plasma and platelets - A review of the current literature.,,,,,0,00,,,{NULL}
,Studies on the biological activity of two strains of BCG: influence of production conditions.,eng,DEV. BIOL. STAND.,,0301-5149,58,,1/1/86,105-18,"{""M Chouchkova"",""A Engibarov""}"
964184,Myocardial fibrosis by T1 mapping is an early indicator of severe cardiac allograft vasculopathy,,Circulation,Circulation,22-Rqp,128,d22,1/13/01,,"{""N. Harcourt"",""S. C.ᄿ Masri"",""M. Colvin"",""G. Raveendran""}"
20010101,Follistatin-like protein 1 regulates chondrocyte proliferation and chondrogenic differentiation of mesenchymal stem cells,Eng,Ann Rheum Dis,Anఆnals of the rheumatic diseases,,0,0,1/14/01,,"{""S. M. Smith"",""A. D. Marinov"",""R. Hirsch"",""D. S. Bushnell"",""B. T. Campfield"",""H. C. Blair"",""Y. Chaly""}"
463556,Structural brain changes associated with antipsychotic treatment in schizophrenia      as revealed by voxel-based morphometric MRI: an activation likelihood estimation       meta-analysis.,,,,,0,0,,,{NULL}
749844,"Insights in public health: taxing sugar sweetened beverages to improve public health: policy action in Hawai'i. Doctoral Health Policy Seminar, Spring 2013",,Hawaii J Med Public Health,Hawai'i journal of medicine & public health : a journal of Asia Pacific Medicine & Public Health,2165-8242,72,8,1/13/01,286-91,"{""T. Sebtdlj"",""E. Bvqgadx"",""K. Jdgicacd"",""T. 'eaeivk"",""G. Vfe Fxo"",""J. G. [aarce"",""L. Rhor"",""M. R. Ddma Crja""}"
300057,[Qvjctucz-bcxfd rhscapy gkjdglnnv uw chd Ggrmsg Sorhkvj Dtlup ob Obewnty iv Chiognoud snd Adoparczgcv].,czw,-1,ztuhcsstiehdnuseG gnuhcsrofstiehdnuseG ttalbstiehdnusegsednuB,1437-1588,54,55,1/11/05,584-90,"{""M Wabitsch"",""A Moss"",""D Kunze""}"
20010101,The cost of national service frameworks,eng,,,,65,0,1/4/01,,"{""R. CN  - PubMed DA  - Feb DP  - NLM ET  - 2004/03/05 Boyle""}"
292018,"Simple dtels no fieidsw. Vecsetr of stevnfbm. Strendch dsqikpng is zs ljkoctwng to weotkd josa ejd fyhness wv wzronmc ederxise is, uut lzgj 'eo[me ignore ic. Herv's huw vo gzy sbcgtdd.",eng,Diabetes forecast,Diabetes Forecast,0095-8301,55,8,,98--100,"{""Shauna S Robeܐrts""}"
181456,Homeplace and Housing in the Lives of Low-Income Urban African American Families,,,,,0,0,1ĥ/5/01,166-188,"{""Linda M. Burton"",""Altman Bullard Burton Burton Burton Burton Burton Clark Conley Dilworth-Williams Fischer Foucault Franklin Gieryn Gilbert Goering Hooks Howard Kidder Lahiri Lawson Clark Lawson Clark Lawson Clark Low Massey Oliver Perkins Rosenbaum Rosenbaum Sanders Stack Allan"",""Sherri Lawson Clark""}"
668772,"Lack of association between the connexin 37 C1019T gene polymorphism and coronary artery disease in a Chinese population: Meta-analysis of 2,206 subjects.",Some college,Biomedical reports,Biomed Rep,2049-9434,1,3,1/13/05,464-468,"{""Yan-Yan Li"",""Yun Qian"",""Chuan-Wei Zhou""}"
276001,[Effects of tobacco advertising regulations in various countries],jňpn,Gihin Koshu Zisxi Sardvi,[Nihon koshu eisei zasshi] Japanese journal of public health,?,42,12,Alabama,Some college,"{""T. Sone""}"
788507,Intensive glucose control in the management of diabetes mellitus and inpatient hyperglycemia,eĺng,Am J Health Syst Pharm,American journal of health-system pharmacy : AJHP : official journal of the American Society of Health-System Pharmacists,1079-2082 (Print) 1079-2082,67,10,1/10/01,798-805,"{""S. B. Levy"",""A. O. Shogbon""}"
620483,The value of breast self-examination: meta-analysis of the research literature.,eng,Oncology nursing forum,Oncol Nurs Forum,0190-535X,28,5,1/1/06,815-22,"{""Y L Ku""}"
433039,Palliative sedation therapy in the last weeks of life: a literature review and recommendations for standards.,,,,,0,0,,,{HMLK}
737167,,en,Mmea Vtcjd,Nursing standard (Royal College of Nursing (Great Britain) : 1987),0029-6570 (Print) 0029-6570,23,12,,"48-57; quiz 58, 60","{""S. Ashelford"",""Vऄ. Taylor""}"
744601,Inhaled anticholinergics and risk for acute urinary retention: A case-crossover and case-time-control study,,Value Health,,1098-3015,17,77,,A776,
856471,Compartmentalization of Fas and Fas ligand may prevent auto- or paracrine apoptosis in epithelial cells,,,,,Some college,2,1/3/01,283-90,"{""W. Hunziker"",""K. H. Tan""}"
570704,Rituximab-related viral infections in lymphoma patients.,,Leukemia & Lymphoma,,1042-8194,48,?,,1307-12,"{""Saadettin Kilickap"",""Omer Dizdar"",""Sercan Aksoy"",""Ibrahim Barista"",""Hakan Harputluoglu"",""Kadri Altundag"",""Didem Sener Dede""}"
520153,Fetal lung volume measurements: determination with MR imaging--effect of various factors.,eng,RADIOLOGY,,0033-8419,240,1,1/6/07,187-93,"{""Carol E Barnewolt"",""Hiroto Hatabu"",""Mizuki Nishino"",""Deborah Levine"",""Henry A Feldman"",""Judy A Estroff"",""Valerie L Ward""}"
259267,Intra-operative change of gastric ph during laparotomic cholecystectomy under general anaesthesia: A prospective case-control study,,,,,56,0,1/12/01,40-43,"{""S. Dey"",""P. Bhattacharyya"",""B. K. Biswas"",""B. Bhattarai"",""P. Bhakta""}"
24381,20010101,eng,Headache,Hddaazhe,1526-4610,53,10,1/13/11,1541-7,"{""[Collective Name] CARE Group"",""Joel J Gagnier"",""David Moher"",""Douglas G Altman"",""Gunver Kienle"",""David Riley"",""Harold Sox""}"
827921,Effect of a creative-bonding intervention on Taiwanese nursing students' self-transcendence and attitudes toward elders.,enĺg,Res Nurs ըHealth,,1098-240X,32,2,1/9/04,204-16,"{""Sandra M Walsh"",""Shiue Chen""}"
461204,.sisylana-atem A :susotamehtyre supul cimetsys dna msihpromylop T/C 961- )3LRCF( 3 ekil-rotpecer cF,,,,,0,0,,,{NULL}
482860,[Indirect anastomoses for moyamoya disease].,jpn,No shinkei geka. Neurological surgery,,0301-2603,26,9,9/1/98,769-86,"{""Y Matsushima""}"
18298,Ulcer Healing After Peripheral Intervention.,ENG,Circulation journal : official journal of the Japanese Circulation Society,Circ. J.,1347-4820,-1,-1,4/14/07,,?
365654,Measuring the bright side of being blue: a new tool for assessing analytical rumination in depression.,gne,PLkS Oje,PloS one,?,9,11,1/14/01,e112077,"{""Skye P Barbic"",""Paul W Andrews"",""Zachary Durisko""}"
625306,,fre,-1,,0221-0363,89,9,1/8/09,1140-50,?
572343,High-dose sequential (HDS) chemotherapy for high-risk non-Hodgkin's lymphoma: long-term analysis and future developments.,gne,Ann. Hematol.,,0939-5555,80,-1,1/1/01,B123-6,"{""M Ladetto"",""D Caracciolo"",""G Rossi"",""C Marinone"",""L Bergui"",""A Cuttica"",""A Salomone"",""M Boccadoro"",""I Ricca"",""C Tarella"",""M Pagano"",""F Zallio"",""P Gavarotti"",""A Pileri"",""A de Crescenzo""}"
88262,Core symptom measures in cancer clinical trials.,ĺeng,Journal of the National Cancer Institute,,1460-2105,106,7,Alabama,,"{""Carolyn Gotay""}"
663339,Human papillomavirus infection and increased risk of HIV acquisition. A systematic review and meta-analysis.,eng,"AIDS (London, England)",Some college,1473-5571,26,?,11/13/12,2211-22,"{""Chunhui Wang"",""Richard Hayes"",""Louise Kuhn"",""Stephen Shiboski"",""Jennifer S Smith"",""Natasha L Larke"",""Deborah Watson-Jones"",""Catherine F Houlihan"",""Patti E Gravitt"",""Karen K Smith-McCune""}"
718292,Prevalence of different morphologic forms of the human tongue in young Finns.,eng,"Oral surgery, ᅛoral medicine, and oral pathology",Oral Surg. Oral Med. Oral Pathol.,0030-4220,Some college,2,2/1/82,152-6,"{""M Mikkonen"",""R Kotilainen"",""A Kullaa-Mikkonen""}"
2ĭ45200,Pstajpogkdhs mi meb,eng,Arch Intern Med,enicidem lanretni fo sevihcrA,0003-9926 (Print) 0003-9926,158,2,1/1/98,194,"{ϓ""M. Galus""}"
307302,Neurolymphatische Bahnen: neue wissenschaftliche Nachweise untermauern die Perrin-Technik,,,,,41,2,1/13/06,15-Oct,"{""Raymond N. Perrin""}"
217418,Long term follow-up of conservative treatment of severely traumatized maxillary incisors,,,,,13,4,1/1/97,190-192,"{""Z. Hirschfeld"",""I. Brin"",""A. Fuks"",""M. Guelmann""}"
413717,Magnetic resonance imaging evaluation of bone marrow changes in obstructive sl⢗eep apnoea syndrome in adults,Fiflkdk     Jtdloam,,,,111,4,1/6/01,572-84,
62246,Pulpal response to a fluoride-releasing all-in-one resin bonding system.,eng,Operative dentistry,Oper Dent,0ǌ361-7734,Some college,3,1/2/05,271-7,"{""Masayuki Otsuki"",""Makoto Arakawa"",""Hidekazu Sonoda"",""Yasutaka Sasafu╺chi"",""Yuichi Kitasako"",""Junji Tagami""}"
94502ĵ1,Improvement of action tremor by chronic cortical stimulation,eng,Mov Disord,Movement disorders : official journal of the Movement Disorder Society,0885-3185,13,?,1/1/98,Some college,"{""B. Pollin"",""C. Geny"",""J. P. Nguyen"",""P. Cesaro"",""A. Feve""}"
649817,Nwlydmty ur Rutsriqvh Ovnbmot sxoczs for qirvcioibseunf 'rbcrppabvs hrol jin-pwychopzdmx in forevxpc io'mmwtjkgw: a mcua-wbwjhska.,eng,,Psychol Assess,1939-134X,22,2,1/10/06,336-49,"{""Scott O Lilienfeld"",""Keli Holloway Allen"",""Howard N Garb"",""Jessica L Wildermuth"",""M Teresa Nezworski"",""James M Wood""}"
934327,Use of a Brief Phone Call After ED Discharge,,,,,,?,,,"{""NCT01893931 ""}"
546484,The Effects of Pre-Reading and Sharing Mechanisms on Learning with the Use of Annotations,,Turkish Online Journal of Educational Technology - TOJET,,1303-6521,10,2,1/11/04,234-249,"{""Wu-Yuin Hwang"",""Guo-Liang Hsu""}"
917231,[Occupational exposure to sevoflurane in pediatric operating rooms: the multi-point sampling method for risk assessment].,ita,Patologie asbesto correlate in congiunti di lavoratori del setᾗtore cemento-amianto.,,1592-7830,34,?,1/12/07,,"{""V Cerabona"",""M Wachocka"",""U Moscato"",""V Camisa"",""M G Tucci"",""S Zaffina"",""V Montaldi"",""A Poscia""}"
88ń7418,Impact of crizotinib on patient-reported symptoms and global quality of life (QoL) compar䒦ed with chemotherapy in a phase III study of advanced alk-positive non-small cell lung cancer (NSCLC),,European Journal of Cancer,,,49,0,1/13/01,-,"{""V. Hirsh"",""J.Y. Han"",""F. Blackhall"",""S. Iyer"",""D.W. Kim"",""A. Shaw"",""A. Reisman"",""K. Wilner"",""H. Nokihara"",""B. Besse""}"
20010101,A systematic review and meta-analysis of trials of treatment of depression from India,hsilgnE,Indian Journal of Psychiatry,,,56,0,1/14/01,29-38,"{""S. Sarkar"",""S. Grover""}"
63738,[The use of ethonium paste in the treatment of deep dental caries].,rus,Stomatologiia,Stomatologiia (Mosk),0ǉ039-1735,Some college,2,3/1/71,79-80,?
422739,Reporting methods in studies developing prognostic models in cancer: a review.,Some college,BMC mаedicine,BMC Med,1741-7015,8,0,1/10/01,20-20,"{""Patrick Royston"",""Rachel Waters"",""Susan Mallett"",""Douglas G Altman"",""Susan Dutton""}"
20010101,Hospital discharge after ambulatory knee arthroscopy: a comparison of epidural 2-chloroprocaine versus lidocaine,,,,,26,1,1/1/01,35-40,"{""J. M. Neal"",""D. J. Kopacz"",""M. A. Lewis"",""J. J. Deck""}"
155127,p16(INK4) Expression is not associated with human papillomavirus in oral lichen planus.,eng,"Oral surgery, oral medicine, oral pathology and oral radiology",Pdxn Sudf Jrdl Mtd Jxcl Patgju Kscl Rsvmll,2212-4411,118,?,1/14/12,694-702,"{""Lucio Montebugnoli"",""Luca Morandi"",""Luca Scapoli"",""Annalisa Palmieri"",""Davide B Gissi"",""Maria Pia Foschini"",""Ilaria Manelli""}"
100986,"Association of bleeding, mortality and sex in acute coronary syndromes: the missing triangle.",ENG,"Journal of cardiovascular medicine (Hagerstown, Md.)",J Cardiovasc Med (Hagerstown),1558-2035,-1,-1,9/23/14,,?
166179,"]elihC ,atsagafotnA ni noitalupop dlihc a ni dael latnemnorivne ot erusopxe ereveS[",,"Exposicion severa a plomo ambiental en una poblacion infantil de Antofagasta, Chile.",,0034-9887,821,2,1/1/00,221-32,"{""I. Delgado"",""J. Vega""}"
740811,Tracheostomy Care and Complications in the Intensive Care Unit,,Ffovhgel Zarg Iursx,,,33,5,1/13/01,18-31 14p,"{""Linda L. Morris"",""Andrea Whitmer"",""Erik McIntosh""}"
379577,"Monitoring of fluid changes in hospitalized, Malnourished, Guatemalan children using bioelectrical impedance spectroscopy (BIS).",eng,"Applied radiation and isotopes : including data, instrumentation and methods for use in agriculture, industry and medicine",Some college,0969-8043,49,55,5/1/98,,"}""tsr_F P"",""snomoloS W N"",""sogeirazaM M"",""nahtiP C""{"
658981,20010101,vnh,Journal of clinical epidemiology,J Clin Epidemiol,1878-5921,65,12,1/12ŕ/12,1257-66,"{""Martijn W Heymans"",""Tobias van den Berg"",""Han J R Anema"",""Lieke van Oort"",""Bart W Koes"",⧦""Arianne P Verhagen"",""Riekie H C W de Vet""}"
215650,Bruxismo em crian_as Bruxism in children,Some college,,,,3,,,Aug-91,"{""Ronaldo Fazzi"",""Ana Estela Haddad"",""Maria Salete Nahs Pires Corr_a""}"
521132,A cadaver model to evaluate the accuracy and reproducibility of plain radiograph step and gap measurements for intra-articular fracture of the distal radius.,eng,J Hand Surg Am,Some college,0363-5023,29,,1/4/09,841-7,"{""Jeff Knight"",""Jeffery M Smith"",""Thomas E Trumble"",""Wren V McCallister""}"
20010101,"13th IEEE/ACM Symposium on Distributed Simulation and Real-Time Applications, DS-RT 2009",,,,,0,0,,,{NULL}
366Ľ275,"A systematic review on the application of cardiovascular risk prediction models in pharmacoeconomics, with a focus on primary prevention.",eng,-1,Eur J Prev Cardiol,2047-4881,,2,1/12/08,42-53,"{""Maarten J Postma"",""Petros Pechlivanoglou"",""Jelena Stevanovic""}"
513630,Pan-Canadian study of mammography screening and mortality from breast cancer.,eng,Journal of the National Cancer Institute,J. Natl. Cancer Inst.,1460-2105,106,11,1/14/11,,"{""Jennifer Payne"",""Rukshanda Ahmad"",""Gregory Doyle"",""Norm Phillips"",""Anna M Chiarelli"",""Christine Wilson"",""Kathleen Decker"",""Andrew Coldman"",""Bin Zhang"",""Jacques Brisson""}"
605423,20010101,eĺng,Alcohol Research & Health,,1535-7414,27,1,1/3/01,39-51,"{""J_rgen Rehm"",""Gerhard Gmel"",""Maurizio Trevisan"",""Christopher T Sempos""}"
495319,Clinical outcome following ICD removal. The Bilitch Registry Group,eng,,,,16,0,1/1/93,186-192,"{""S. Furman"",""D. T. Kawanishi"",""S. L. Song""}"
733752,Eliciting relative preferences for two methods of colorectal cancer screening,Englisˊh,European Journal of Cancer Care,,0961-5423,14,,,124-31,"{""E. J. Frew"",""J. L. Wolstenholme"",""D. K. Whynes""}"
252118,Bilingual speech: Bilateral control?,,Brain and Language,,0093-934X,15,1,1/1/82,125-142,"{""H.M. Sussman"",""P. Franklin"",""T. Simon""}"
903817,Tiao-She nursing of traditional Chinese medicine for mild cognitive disorder: An assessment of clinical evidence,,Chin. J. Evid.-Based Med.,,1672-2531,15,,,346-352,"{""Li X.-H."",""Li G.-C."",""Xie Y.-L."",""Shang H.-C."",""Chi K.-L."",""Jin Y.-H.""}"
80799,One-pot semisynthesis of exon 1 of the Huntingtin protein: new tools for elucidating the role of posttranslational modifications in the pathogenesis of Huntington's disease.,eĺng,Angewandte Chemie (International ed. in English),Angew. Chem. Int. Ed. Engl.,?,53,7,10/14/02,1928-33,"{""Annalisa Ansaloni"",""Jae Sun Jeong"",""Francesco Simone Ruggeri"",""Giovanni Dietler"",""Zhe-Ming Wang"",""Hilal A Lashuel""}"
385163,Pathophysiology of paradoxical embolism: evaluation of the role of interatrial septum anatomy based on the intracardiac echocardiography assessment of patients with right-to-left shunting.,ziy,Cardiolpnj in cje nkuic,Dzcgupp Bkonf,1467-1107,,1,1/15/01,47-55,"{""Gianluca Rigatelli"",""Paolo Cardaioli"",""Massimo Giordan"",""Ashesh Buch"",""Laura Oliva"",""Dobrin Vassiliev"",""Aravinda Nanjiundappa"",""Fabio Dell'Avvocata"",""Ramesh Daggubati"",""Dario Adami""}"
645061,Impact of physical abuse on adulthood depressive symptoms among women.,eng,Issues Ment Health ࡮Nurs,,1096-4673,,3,1/8/03,299-314,"{""Hanan Al-Modallal"",""Ann Peden"",""Debra Anderson""}"
164721,[The microclimate of apartments and its hygienic norms],,Das Mikorklima der Wohnungen und seine hygienische Normierung.,,0049-8610,13,10,1/1/67,756-60,"{""M. S. Goromossow""}"
730721,Prediction Study of Complications After Severe Trauma,,,,,0,,1/12/01,,"{""NCT01713205 ""}"
439302,"American Society of Clinical Oncology clinical practice guideline update on the use of pharmacologic interventions including tamoxifen, raloxifene, and aromatase inhibition for breast cancer risk reduction.",,,,,0,0,,,{NULL}
410748,Preliminary validity and reliability of a Thai Berlin questionnaire in stroke patients,English,,,,7,0,1/14/01,348,"{""B. Seeidsmean"",""L. Rqwxnyawprktg"",""J. Onntcxkgl"",""T. Xxevgsucwh""}"
133777,,eng,Acta clinica Belgica,Acta Clin Belg,178ǔ4-3286,61,4,1/6/07,,"{""P Grard"",""J Montesanti"",""P Lepage"",""M M Massin""}"
775428,Organization of ribosomes and nucleoids in escherichia coli cells during growth and in quiescence,Zkglish,Journal of Biological Chemistry,,00ǈ21-9258,289,16,1/14/01,Some college,"{""K. Peisker"",""B. Singh"",""S. Sanyal"",""Q. Chai"",""X. Ge"",""N. Metzendorf"",""S. Dasgupta""}"
497593,"Ventricular arrhythmias in the North American multidisciplinary study of ARVC: predictors, characteristics, and treatment",eng,,,,64,0,1/14/01,119-125,"{""N. A. Mark Estes"",""Scott McNitt"",""Wojciech Zareba"",""Bronislava Polonsky"",""Douglas Laidlaw"",""Mark S. Link"",""Frank Marcus"",""Kathleen Gear""}"
,Maxillofacial metastases: a retrospective review of one institution's 15-year experience,Eielhsg,Journal of Oral & Maxillofacial Surgery,,,71,1,Alabama,178-88,"}""erulCcM .A .S"",""dehavoM .R"",""amalaS .A"",""drO .A .R""{"
424254,Precocious and delayed sexual development in children,English,Acta Endocrinologica. Supplementum,Acta Endocrinol Suppl (Copenh),0300-9750,288,0,1/1/88,66-76,"{""B. T. Rudd""}"
161290,Premature androgenic alopecia and insulin resistance. Male equivalent of polycystic ovary syndrome?,eng,,,,39,0,1/5/01,127-31 ST  - Premature androgeni⡳c alopecia and insulin resistance. Male equivalent of polycystic ovary syndrome?-,"{""L. Starka"",""J. Vrbikova"",""M. DA  - Dec DP  - Nlm ET  - 2006/03/24 Hill"",""M. Duskova"",""I. Cermakova""}"
746312,Pancytopenia : A rare presentation of legionella pneumonia,,Crit. Care Med.,,0090-3493,41,,,Some college,"{""Cayetano K."",""Ghannam D."",""Rawat N.""}"
831191,Mold contamination in a controlled hospital environment: a 3-year surveillance in southern Italy,,,,,14,0,1/14/01,,"{""C. Coretti"",""C. Napoli"",""G. Lovero"",""M. T. Montagna"",""G. Caggiano"",""G. Scarafile"",""O. de Giglio""}"
743819,Twwrcf pf (A)-faboimne kn ewwrxtef Enterobacgvroc aud wekbye caii jk rats vdb w hlhn-sat vkgf-xhzduds gugt.,eng,"Obesity (Silver Spring, Md.)",,1930-739X,22,4,,976-9,"{""Eunice Molinar-Toribio"",""Benjam_n Pia"",""Livia G_mez"",""Jara Prez-Jimnez"",""Marta Casado"",""Sara Ramos-Romero"",""Pere Claps"",""Josep Llu_s Torres""}"
193292,CSM2004 best platform,,,,,4,0,1/4/01,10-10 ST  - CSM2004 best platform-,{NULL}
91852,"The importance, and important limitations, of ultrasound imaging for evaluating thyroid nodules.",eng,JAMA internal medicine,JAMA Intern Med,2168-6114,173,19,10/28/13,1796-7,"{""David Cooper"",""Erik K Alexander""}"
