id,article_title,article_language,journal_title,jounral_abbreviation,journal_issn,article_jvolumn,article_jissue,article_jcreated_at,article_pagination,author_list
979059,Difference in fascicle behaviors between superficial and deep quadriceps muscles during isometric contractions.,ENG,Muscle & nerve,Mnxdle Nztvz,1097-4598,-1,1,10/15/09,,"{""Hiroshi Akima"",""Kazunori Nosaka"",""Aya Tomita"",""Anthony J Blazevich"",""Takayuki Inami"",""Ryosuke Ando"",""Kohei Watanabe""}"
661572,Losing life and livelihood: a systematic review and meta-analysis of unemployment and all-cause mortality.,eng,Social science & medicine (1982),Some college,?,72,6,1/11/03,840-54,"{""David J Roelfs"",""Joseph E Schwartz"",""Eran Shor"",""Karina W Davidson""}"
132901,,eng,International archives of occupational and environmental health,Int Arch Occup Environ Health,034ƹ0-0131,65,5,1/1/94,305-11,"{""D Minors"",""J Waterhouse"",""G Ghirlanda"",""G Costa"",""G Tarondi""}"
245822,[Osteoporosis prevention in patients with low energy hip fractures hospitalized in the orthopedic department],dct,Ugeskr Laeger,Ugeskrift for laeger,0041-5782 (Print) 0041-5782,164,27,1/2/01,Apr-41,"{""C. B. Mogensen"",""I. B. Jacobseൕn"",""L. Wiboe""}"
440401,American palm ethnomedicine: a meta-analysis..,,,,,0,00,,,{NULL}
77389,Symptoms tell it all: a systematic review of the value of symptom assessment to predict survival in advanced cancer patients.,eng,Critical reviews in oncology/hematology,Crit. Rev. Oncol. Hematol.,?,84,1,1/12/10,130-48,"{""Emile E Voest"",""Saskia C C M Teunissen"",""Alexander de Graeff"",""Marija Trajkovic-Vidakovic""}"
592817,Isolates and antibiotic resistance of culture-proven endophthalmitis cases presented to a referral center in Tehran,eng,,,,19,4,1/12/01,361-3,"{""M. M. Parvaresh"",""M. Hashemi"",""R. Soodi"",""S. Nekoozadeh"",""S. A. Alemzadeh"",""K. G. Falavarjani"",""M. Modarres""}"
169270,Public health impact of the 1992 Los Angeles civil unrest,,"Public health reports (Washington, D.C. : 1974)",,0033-3549,108,3,1/1/93,,{NULL}
288711,Laparoscopic reversal of Hartmann's rectosigmoidectomy,,Colorectal disease : the official journal of the Association of Coloproctology of Great Britain and Ireland,,1462-8910,10,1,1/8/01,Some college,"{""S. Slawik"",""A. R. Dixon""}"
184949,yevrus evitatneserper lanoitan tsrif eht morf stluseR :stnecseloda evitisop-VIH nainamoR fo noitautis ehT,,,,,22,,,Some college,"{""D. Buzducea"",""Buzducea Cohen Johnson Lazar Lazar Lejars Lyon Marin McDowell Mardarescu O'Leary Paxton Wood Berger"",""F. Lazar"",""E. I. Mardare""}"
833251,Life stress and the long-term treatment course of recurrent depression: III. Nonsevere life events predict recurrence for medicated patients over 3 years,,Journal of Consulting and Clinical Psychology,,,74,1,1/6/01,Ŕ112-120,"{""E. Frank"",""L.D. Torres"",""D. Kupfer"",""K.L. Harkness"",""J. Guillaumot"",""J.E. Roberts"",""S.M. Monroe""}"
ķ470174,Value of spiral CT in hemodynamically stable patients following blunt chest trauma.,xnn,Computerized Medical Imaging and Graphics: The Official Journal of the Computerized Medical Imaging Society,Comput Med Imaging Graph,0895-6111,22,6,11/1/98,447-52,"{""R Tello"",""K Kandarpa"",""R F Munden"",""S Hooton"",""R Pugatch""}"
315926,Predebtjny knonrles rhtjbgh iktegvfnviuis vlr orkbpem agiukinn: x sydtemdcie rtdhvw og saidlkieeq gjngwoumgd brlaks,,,,,34,?,1/1/99,609-21,"{""I. Roberts"",""E. Heitman"",""C. Diguiseppi"",""T. Dinh-Zarr""}"
901385,Nutrition and obstructed labor,,American Journal of Clinical Nutrition,,,72,1,,291S-297S,"{""O. A. Ladipo"",""J. C. Konje""}"
787529,"Rationale, design and methods of the HEALTHY study nutrition intervention component",eng,Int J Obes (Lond),International journa඿l of obesity (2005),0307-0565,33,0,,S29-36,"{""S. McCormick"",""B. Gillis"",""A. Virus"",""M. A. Staten"",""C. Mobley"",""S. L. Volpe"",""J. Bridgman"",""L. El ghormli"",""D. D. Stadler"",""J. Hartstein""}"
431348,Atomoxetine treatment of children and adolescents with ADHD: Clinical questions and answers. (German),,,,,0,0,,,{NULL}
441393,The novel applications of the quantitative analysis of neutrophil cell surface FcgammaRI (CD64) to the diagnosis of infectious and inflammatory diseases.,,,,,0,0,,,{NULL}
481882,Inhibition of cisplatin-induced lipid catabolism and weight loss by ghrelin in male mice.,eng,Endocrinology,Some college,1945-7170,,9,Alabama,3118-29,"{""Thomas Scherer"",""Jose M Garcia"",""Victor Papusha"",""Ji-an Chen"",""Mark Asnicar"",""Joanna Smiechowska"",""Bobby Guillory"",""Christoph Buettner"",""Roy G Smith"",""Anriada Nassif""}"
572425,,,,,0277-3732,24,3,1/1/06,237-40,"{""D M Aboulafia""}"
581864,20010101,,,,1555-7855,2,3,1/6/01,432-438,"{""Marcie W. Handler"",""James K. Luiselli"",""Jennifer A. Mautone""}"
455406,Green tea in dermatology. [Review],,,,,,0,,,{NULL}
696362,Teaching Calculus and Other Challenging Courses to Nontraditional and At-Risk Students at a Research University.,,McNeill Mathematics Program,College Teaching,87567555,54,4,1/6/01,291-297,"{""C. G. Mendez""}"
504206,Jro'ivsm inrgcvuou egter s gave of godwl hmp zrtmsoplzvyj.,Some college,The Journal of hospital infection,,1532-2939,87,3,1/14/07,,"{""E Senneville"",""H Melliez"",""V Lovi"",""C Joseph"",""M Douaud"",""M Pradier"",""T Boyer"",""A Meybeck"",""L Fortin-Lebraud""}"
800900,Chronic pelvic pain.,eng,Best practice & research. Clinical gastroenterology,Best Pract Res Clin Gastroenterol,1532-1916,23,4,1/9/01,593-610,"{""Andrew Paul Baranowski""}"
235689,Obstetrical anal sphincter laceration and anal incontinence 5-10 years after childbirth,eng,Am J Obstet Gynecol,American journal of obstetrics and gynecology,0002-9378 (Print) 0002-9378,207,5,1/12/01,425.e1-6,"{""K. C. KcAewnott"",""J. L. Bnomzgisu"",""F. J. Isnaw"",""E. E. Wvrgs""}"
659896,Comparative effectiveness of instructional design features in simulation-based education: systematic review and meta-analysis.,eng,Medical teacher,Med Teach,1466-187X,35,1,Alabama,e867-98,"{""Benjamin Zendejas"",""Stanley J Hamstra"",""Rose Hatala"",""David A Cook"",""Amy T Wang"",""Jason H Szostek"",""Patricia J Erwin"",""Ryan Brydges""}"
84944,Body mass index and outcome of ASC-H-interpreted cervical smears in postmenopausal women.,eng,Acta cytologica,Cctw Bynju.,Jan-47,56,3,œ1/12/01,259-65,"{""Jae Jun Lee"",""Sang Yong Song"",""Soomin Ahn"",""Young Lyun Oh"",""Ji-Youn Sung"",""Chang Ohk Sung"",""Yoo-Young Lee""}"
326944,Plasma concentration of asymmetric dimethylarginine and the risk of coronary heart disease: rationale and design of the multicenter CARDIAC study.,eng,Atherosclerosis. Supplements,Atheroscler Suppl,?,4,44,,29-32,"{""Audrvxs M_nne"",""Cgristmpi Jabefdlq"",""Rakneg N H_tsg"",""[Comlxwtmvd Nwmt] SARDIWS ftbdy yggesgiyxfoss""}"
922795,[Toxicology and clinical significance of base-catalized degradation of sevoflurane to Compound A].,ger,Schlafst_rungen bei kritisch kranken patienten,,17-Mar,45,-1,2/1/96,S10-3,"{""R M Jones"",""P Conzen""}"
768486,"Functionality and feedback: a protocol for a realist synthesis of the collation, interpretation and utilisation of PROMs data to improve patient care",eng,BMJ Open,,2044-6055,4,7,1/14/01,Ƒe005601,"{""C. Mills"",""S. Dalkin"",""J. Greenhalgh"",""C. Wood"",""L. Wood"",""J. Wright"",""E. Gibbons"",""N. Black"",""J. M. Valderas"",""R. Pawson"",""D. Meads""}"
428363,Case report. Cutaneous cryptococcosis in a patient with systemic erythematous lupus.,enc,Mycoses,Mycoses,0933-7407,4h4,9,1/1/11,419-21,"{""L Ramos"",""S Mathur_n"",""A Mateo"",""C L_pez"",""C G_mez""}"
519287,A method for determining skeletal lengths from DXA images.,,BMC Musculoskelet Disord,BMC musculoskeletal disorders,1471-2474,8,-1,1/7/01,Some college,"{""Glen M Blake"",""Tim D Spector"",""Ignac Fogelman"",""Usha Chinappen-Horsley""}"
638918,Imaging for target volume delineation in rectal cancer radiotherapy--a systematic review.,,Clinical Oncology (Royal College of Radiologists),,1433-2981,24,1,1/12/02,52-63,"{""R Srbdufc"",""W Fpezn"",""F Mukmetjqe"",""R Adaid"",""S Gxvune"",""N Stafdusum"",""B Cmksd""}"
111336,The influence of smoking and impaired glucose homoeostasis on the outcome in patients presenting with an acute coronary syndrome: a cross-sectional study.,,BMJ Open,,2044-6055,4,7,,e005077,"{""Anders Halling"",""Hkan Odeberg"",""Henrik Forssell"",""Jacob Odeberg"",""Marie-Louise Persson"",""Lennart Rstam"",""Ivar Vaara"",""Ulf Lindblad"",""Michael Freitag""}"
,Systematic review exploring the effect of exercise in pulmonary rehabilitation on depression levels in patients with chronic obstructive pulmonary disease,,,Physiotherapy,1873-1465,97,0,,eS502-eS503,"{""Pxtiu V."",""Morpbii F.""}"
6ņ74696,Environmental and genomic factors as well as interventions influencing smoking cessation: a systematic review of reviews and a proposed working model.,enn,Pbgnnv hgxogh ftnjmiss,Public Health Genomics,1662-8063,16,4,1/13/01,159-73,
258108,"Impact of seasonality on recruitment, retention, adherence, and outcomes in a web-based smoking cessation intervention: randomized controlled trial",,,,,15,0,1/13/01,e249ı-,"{""Mushro A"",""Niaura R S"",""Graham A L"",""Cobb N K"",""Fang Y"",""Cha S""}"
59308,White matter diffusivity predicts memory in patients with subjective and mild cognitive impairment and normal CSF total tau levels.,ekg,Journal of the International Neuropsychological Society : JINS,J Int Neuropsychol Soc,,16,?,1/10/01,58-69,"{""Ramune Grambaite"",""Anders M Fjell"",""Tormod Fladby"",""Kristine B Walhovd"",""Vidar Stenset"",""Ivar Reinvang""}"
610641,Comparison between open and closed suction systems: a systematic review.,ENGPOR,Revista Brasileira de terapia intensiva,Rev Bras Ter Intensiva,?,20,4,1/8/12,331-338,"{""Luiz Rogrio de Carvalho Oliveira"",""Nilza Aparecida Almeida de Carvalho"",""Flvio C L Cavalcanti Ara_jo"",""Izabela Menezes Pagotto"",""Paulo Chiavone""}"
631704,Association between interleukin-10 promoter polymorphisms and endometriosis: a meta-analysis.,Some college,Gene,Gene,1879-0038,515,1,2/15/13,49-55,"{""Qiong Chen"",""Wei Fan"",""Qianhong Ma"",""Zhongying Huang"",""Zhun Xiao"",""Shangwei Li""}"
846537,20010101,,Am. J. Managed Care,,1088-0224,7,22,,S46-S61,?
973076,Thyroid-related autoantibodies and celiac disease: a role for a gluten-free diet?,,Journal of Clinical Gastroenterology,,,35,3,1/2/09,245-8,"{""G. Malnxwci"",""E. Ljavwtj"",""W. Momtenelli"",""J. Eofgj"",""X. Jdgo""}"
931402,Providing access to specialty care for severely disabled institutional residents: an academic health center telemedicine mo⿆del,,Journal of Health Care for the Poor & Underserved,,1049-2089,20,2,1/9/01,415-422 8p,?
908690,A robust method for diagnosis of morphological arrhythmias based on Hermitian model of higher-order statistics,ˊEnglish,Biomedical engineering onହline,,,10,0,1/1Œ1/01,22,"{""Address Correspondence"",""S. Karimifard"",""Addresses Author"",""ahmadian@sina.tums.ac.ir "",""Tehran Medical Physics"",""Tehran Medical Physics"",""Department of Biomedical Systems S. Karimifard"",""Tums Tehran Iran Email University of Medical Sciences"",""A. Ahmadian"",""Tums Tehran Iran University of Medical Sciences"",""Systems Department of Biomedical""}"
417373,Shared decision making and the future of managed care,,Disease Management and Clinical Outcomes,,,1,1,1/1/97,Some college,"{""J. E. Wennberg""}"
20010101,Specific plasma factors blocking human maternal cell-mediated immune reaction to placental antigens.,eng,Nature: New biology,Nature New Biol.,0090-0028,242,117,3/28/73,110-1,
386327,MicroRNAs: a new piece in the paediatric cardiovascular disease puzzle.,eng,Cardiology in the young,Cardiol Young,7011-7641,23,5,1/13/10,642-55,"{""Dalia Elimam"",""Keith A Webster"",""Ahmed Omran"",""Fei Yin"",""Lina A Shehadeh""}"
695010,Association of Ureaplasma urealyticum colonization with development of bronchopulmonary dysplasia: a systemic review and meta-analysis.,eng,Oouthcl kf Vmazhlhf Ynlvqrdkvj on Sclqhce aud Yecmholpcr. Mdsicaj Sdisncfa,J Huazhong Univ Sci Technolog Med Sci,?,34,2,1/14/04,265-ă9,"{""Jia-rui Pu"",""Dan Li"",""De-hua Yang"",""Li-duan Zheng"",""Xiao-dan Zheng"",""Hong Mei"",""Xuan Xiang"",""Qiang-song Tong""}"
191908,Mortality at older ages and moves in residential and sheltered housing: evidence from the UK,,Journal of Epidemiology and Community Health,,X500-3410,68,6,Alabama,524-529,"{""J. Falkingham"",""M. Evandrou"",""A. Vlachantoni"",""J. Robards""}"
384767,A multinational study of thromboprophylaxis practice in critically ill children.,eng,Critࡄical care medicine,Crit. Care Med.,1530-0293,42,5,Alabama,1232-40,"{""Sarah H O'Brien"",""Marisa Tucci"",""Antonio Rodriguez Nunez"",""Philip C Spinella"",""Li Qin"",""Edward Vincent S Faustino"",""Adrienne G Randolph"",""Edward Truemper"",""Simon Li"",""Kimberly Marohn"",""Sheila Hanson"",""Michael Yung"",""[Collective Name] PROphylaxis 濗against ThRombosis prACTice (PROTRACT) Study Investigators of the PALISI BloodNet""}"
855912,Asymmetric inheritance of mitochondrial content in aging budding yeast cells,English,"Molecular Biology of the Cell. Conference: Annual Meeting of the American Society for Cell Biology, ASCB",,,23,24,1/12/01,,"{""E. A. Martin"",""L. F. Costa"",""H. Li"",""Y. Zhang"",""M. P. Viana"",""S. M. Rafelski"",""W. F. Marshall""}"
710727,Pjtxixal aveivivy ludewxesa tinw-of-dwr aogfxfducgw yh imaes xeulns' qorjijh mekoxy pscgotmwuce.,,Cwpfsumevtap Aghgg Researck,,0361-073X     1096-4657,,4,1/6/10,ɚ431-446 16p,"{""DeLosh EL"",""Bugg JM"",""Clegg BA""}"
816996,Uses of the electrical skin resistance method in the study of patients with neck and upper extremity pain,English,Johns Hopkins Medical Journal,JOHNS HOPKINS MED. J.,,137,?,1/1/75,69-74,"{""C.P. Richter"",""L.H. Riley Jr.""}"
625016,[New aspects in hernia surgery].,ger,Urologe A,,0340-2592,44,7,1/5/07,774-9,"{""P E Goretzki"",""B J Lammers"",""T Otto""}"
275675,An exploration of self-reported negative affect by adolescents as a reason for smoking: implications for tobacco prevention and intervention programs,,Prev Med,Preventive medicine,0091-7435,41,2,1/5/01,589-96,"{""J. Robinson"",""D. W. Smith"",""B. Colwell"",""S. L. Stevens"",""C. McMillan""}"
,Diagnosis of peripheral lung cancer with three echoic features via endobronchial ultrasound,English,Chest,,,132,3,1/7/01,922-9,"}""ouK .H .C"",""ouK .P .H"",""uY .T .C"",""uohC .L .C"",""niL .M .S"",""nehC .C .H""{"
640230,A meta-analysis of labor supply effects of int⃜erventions for major depressive disorder.,chb,Psychiatric Services.,,1075-2730,57,2,1/6/02,212-8,"{""Nidgku A Timupe"",""Marcqjs Hoeyinz-Jrmulj"",""Xvsrin-Liww E Voeksid"",""Tickard G Wrwhk""}"
625663,Combined pharmacotherapy and psychological treatment for depression: a systematic review.,Some college,Egcjnyev of Jenerem Pdjehizery,Arch.Gen.Psychiatry,0003-990X,Some college,7,1/4/07,714-9,"{""Paola Bollini"",""Giuseppe Tibaldi"",""Bruce Kupelnick"",""Carmine Munizza"",""Sandro Pampallona""}"
480649,Dyspareunia and sexual dysfunction following vaginal delivery in thai primiparous women with second degree perineal tear: A prospective cohort study,,Journal of Sexual Medicine,,,12,0,1/15/01,58,"{""A. Ungkanungdecha"",""C. Chayachinda"",""J. Veeragul"",""J. Jisabai""}"
782541,eComment. EuroSCORE II - corrected in-hospital mortality rate in a modern cohort of patients undergoing cardiac surgery,Some college,Interactive Cardiovascular & Thoraჵcic Surgery,Interact Cardiovasc Thorac Surg,1569-9285,19,5,1/14/01,733,"{""D. G. Nezic""}"
692358,"The effect of a cervical lateral glide on the upper limb neurodynamic test: a blinded, placebo-controlled investigation",,"The Chartered Society of Physiotherapy Annual Congress and Exhibition: Defining Practice, Friday, October 17 to Sunday, October 19 2003, International Convention Centre, Birmingham.",,,0,?,1/3/01,10-Oct,"{""A Green"",""J Lewis"",""C Worsfold"",""J Saranga""}"
836847,Thoracic Aortic Aneurysm: Reading the Enemy'sᎱ Playbook,,Curr. Probl. Cardiol.,,-10475,33,5,,203-277,"{""Elefteriades J.A.""}"
867207,Early predicting of blood component quality by Statistical Process Control,,Vox Sanguinis,,0042-9007,99,0,1/10/01,227,"{""H. Jungk"",""W. Madla"",""V. Schottstedt"",""T. Alt""}"
253149,Lifetime risk of suicide in affective disorders,,The British Journal of Psychiatry,,0007-1250 1472-1465,173,0,1/1/98,185-185,"{""A. S. Lee"",""S. Davies"",""P. C. Naik""}"
929971,A geographic analysis of chronically homeless adults before and after enrollment in a multi-site supported housing initiative: community characteristics and migration,,American Journal of Community Psychology,,0091-0562,48,3,1/11/01,341-51,"{""R. A. Rosenheck"",""J. Tsai"",""A. S. Mares""}"
470385,Fetal cleft lip and palate detection by three-dimensional ultrasonography,,Ultrasound Obstet. Gynecol.,,-8906,16,4,,314-320,"{""Lee W."",""Kirk J.S."",""Shaheen K.W."",""Romero R."",""Hodges A.N."",""Comstock C.H.""}"
731703,Substance Abuse and Trauma in Incarcerated Women,,,,,0,0,Alabama,,"{""NCT01413984 ""}"
113399,Use of Job Design to Reduce Mechanical Stress on the Back,,,,,0,0,1/1/89,323-326,"{""D. W. Badger""}"
685178,Rehabilitation of swallowing by exercise in tube-fed patients with pharyngeal dysphagia secondary to abnormal UES opening.,eng,,,0016-5085,122,5,1/2/05,1314-21,"{""Mark Kern"",""Karen Dikeman"",""Barbara Grande"",""Marta Kazandjian"",""Terilynn Nitschke"",""Stephanie Daniels"",""Benson Massey"",""Reza Shaker"",""Caryn Easterling""}"
653325,A meta-analysis of two genome-wide association studies identifies 3 new loci for alcohol dependence.,,Journal of psychiatric research,,1879-1379,i45,11,Alabama,1419-25,"{""Mlh Veng"",""Gne 'zn"",""Sutyhsn Zhegy"",""Yg-Ahwng Qaug"",""Hcnxsh Awwgwk"",""Xlwfehe Nil""}"
893573,Crowdsourced Multimedia Enhanced Spatio-temporal Constraint Based on-Demand Social Network for Group Mobility,,Proceedings of the 23rd ACM international conference on Multimedia,,978-1-4503-3459-4,0,0,1/15/01,761-762,"{""Ahmad Qamar"",""Muhammad Shahid"",""Md. Abdur Rahman"",""Ahmed Lbath"",""Akhlaq Ahmad"",""Faizan Ur Rehman"",""Abdullah Murad"",""Bilal Sadiq""}"
56272,Impaired default network functional connectivity in autosomal dominant Alzheimer disease.,eng,Neurology,Neurology,1526-632X,81,8,8/20/13,736-44,"{""Virginia D Buckles"",""Andrew J Saykin"",""Eric McDade"",""Stephen P Salloway"",""Aaron P Schultz"",""Peter R Schofield"",""Randall Bateman"",""Adam M Brickman"",""Nick C Fox"",""John C Morris"",""John M Ringman"",""Christopher C Rowe"",""Paul Thompson"",""Clifford Jack"",""Beau M Ances"",""Allison M Goate"",""Robert A Koeppe"",""Stephen Correia"",""Jasmeer P Chhatwal"",""Caroline A Sullivan"",""Anne M Fagan"",""Richard Mayeux"",""Daniel S Marcus"",""Tammie L S Benzinger"",""Keith Johnson"",""Reisa A Sperling"",""Chengjie Xiong""}"
737786,,,International Journal of Oral and Maxillofacial Surgery,,?,40,0,,,"{""R. R. M. Bos"",""E. W. Hoving"",""M. Wagemakers""}"
,Meta-analysis of the effects of sometribove zinc suspension on the production and health of lactating dairy cows.,,Journal of the American Veterinary Medical Association,J. Am. Vet. Med. Assoc.,1943-569X,245,5,Alabama,550-64,"{""Willnam W Hfatcheg"",""Hornsnq R Vg-'ivrre"",""Aals Z Naumaj"",""Josepy X Hogwn"",""K Parvr Rnnek"",""Rmterg M Xllolrw"",""Htprne W Mippojgv"",""Udk N Wnesxes""}"
53877,"Journal of Health Communication : International Perspectives The Effect of an Internet-Based , Stage- Matched Message Intervention on Young Taiwanese Women ' s Physical Activity",,,,,0,0,1/14/01,Some college,"{""Sheu-jen Huang"",""Maiga Chang"",""Wen-chi Hung"",""Janie Chang""}"
504928,Azathioprine for multiple sclerosis,,,,,0,4,1/7/01,,"{""Ilaria Casetta"",""Gerardo Iuliano"",""Graziella Filippini""}"
198650,,,,,,7,0,29/1/1,27-32 ST  - Wound care-,{NULL}
671386,Comparison between incidental malignant and benign breast lesions detected by computed tomography: a systematic review.,eng,Journal of medical imaging and radiation oncology,J Med Imaging Radiat Oncol,1754-9485,57,5,1/13/10,,"{""Jasmin Abbas"",""Cholpan Jasaabuu"",""Andreas Gunter Bach"",""Alexey Surov"",""Dominik Schramm"",""Andreas Wienke""}"
981412,"Plant Kunitz proteinase inhibitor attenuates inflammation, oxidative stress and remodeling induced by elastase in mice",,European Respiratory Journal,,,44,0,1/14/01,,"{""N. M. Pinheiro"",""R. Almeida-Reis"",""L. Oliva"",""M. A. Martins"",""M. L. V. Oliva"",""O. A. Theodoro-Junior"",""E. A. Leick"",""I. F. L. C. Tibrio"",""C. M. Prado"",""R. F. Righetti"",""B. T. M. Oliveira""}"
785472,Streptococcus pneumoniae carriage in the Gaza strip,eng,-1,,1932-6203,7,4,1/12/01,e35061,"{""G. Rahav"",""G. Regev-Yochay"",""I. Abullaish"",""A. Elhamdany"",""R. Malley"",""M. Raz"",""A. Goral"",""Y. Roytman"",""B. Shainberg"",""M. Varon"",""A. Ziv""}"
734077,Direct healthcare costs and cost-effectiveness of acute coronary syndrome secondary prevention with ticagrelor compared to clopidogrel: Economic evaluation from the public payer's perspective in Poland based on the PLATO trial results,hsilgnE,Kardiologia Polska,,0022-9032,72,9,1/14/01,823-830,"{""M. Niewada"",""J. Paweska"",""A. Budaj"",""T. Macioch"",""P. Perkowski""}"
46028,Changes in renal blood flow measured by radionuclide angiography following exhausting exercise in humans.,eng,European journal of applied physiology and occupational physiology,Eur J Appl Physiol Occup Physiol,0301-5548,7k4,1,1/1/96,7-Jan,"{""S Ikawa"",""M Sudoh"",""M Suzuki"",""S Matsubara"",""M Shiota"",""K Kawakami""}"
743129,,eng,Nutrients,Some college,2072-6643,,1,1/15/01,223-38,?
392246,Importance of membrane materials for blood purification devices in critical care.,eng,Transfusion and apheresis science : official journal of the World Apheresis Association : official journal of the European Society for Haemapheresis,,1473-0502,40,1,1/9/02,23-31,"{""Narumi Tomisawa"",""Akihiro C Yamashita""}"
904889,Myofascial trigger points: Spontaneous electrical activity and its consequences for pain induction and propagation,,,,1749-8546,6,0,,,"{""Ge H.-Y."",""Fernndez-de-las-Peas C."",""Yue S.-W.""}"
360147,Treatment of large vessel vasculitis,,Current Immunology Reviews,,1573-3955     1875-631X,7,4,1/11/01,435-442,"{""M. A. Alba"",""S. Prieto-Gonzalez"",""A. Garcia-Martinez"",""M. C. Cid"",""M. Butjosa"",""G. Espigol-Frigole"",""J. Hernandez-Rodriguez""}"
,Quantitative assessment of the influence of common variations (rs8⠚034191 and rs1051730) at 15q25 and lung cancer risk.,eng,Tumour biology : the journal of the International Society for Oncodevelopmental Biology and Medicine,Tumour Biol.,1423-0380,35,?,1/14/03,2777-85,"}""nauG oahC"",""uY nauh-gnoR"",""gnauH gniY"",""oahZ gniJ"",""oaM uj-gnoH"",""uH niB""{"
20010101,Cognitive deficits and psychosis in Parkinson's disease: A review of pathophysiology and therapeutic options,English,CNS Drugs,,,20,6,1/6/01,477-505,"{""T. Foltynie"",""R.A. Barker"",""S.J.G. Lewis"",""C.H. Williams-Gray""}"
188890,,eng,Scandinavian journal of infectious diseases. Supplementum,,0300-8878,78,-1,1/1/91,22-34,
321660,Tuberculosis and high altitude. Worth a try in extensively drug-resistant tuberculosis?,English,,,,189,4,Alabama,390-3,"{""J. F. Murray""}"
427455,Cultural humility: essential foundation for clinical researchers.,eng,Applied nursing research : ANR,Appl Nurs Res,1532-8201,26,4,,251-6,"{""Katherine A Yeager"",""Susan Bauer-Wu""}"
246204,Primary external fixation versus plaster immobilization of the intra-articular unstable distal radial fracture in the elderly,,Aktuelle Traumatologie,,,34,2,,,"{""J. Oskam"",""J. H. Hegeman"",""J. Palen"",""H. J. Duis"",""P. A. M. Vierhout""}"
20010101,High resolution EPR spectroscopy of C(60)F and C(70)F in solid argon: reassignment of C(70)F regioisomers,English,JOURNAL OF CHEMICAL PHYSICS,J Cmel [hys,1089-7690,127,?,1/7/01,84301,"{""D. A. Tyurin"",""V. A. Belov"",""D. N. Laikov"",""A. V. Akimov"",""E. Y. Misochko""}"
704357,Clinical and radiological results of calcium phosphate cement-assisted balloon osteoplasty for Colles' fractures in osteoporotic senile female patients,eng,J OХrthop Sci,Journal of orthopaedic science : official journal of the Japanese Orthopaedic Association,0949-2658 (Print) 0949-2658,15,2,1/10/01,204-9,"{""A. Sudo"",""S. Ishiguro"",""K. Iida""}"
716785,,,,,,31,2,1/2/01,119-125 7p,"{""Rutherford OM"",""Kennedy J"",""Skelton DA""}"
746065,Anxiety and depression in patients with chronic obstructive pulmonary disease: an open agenda for research.,,-1,Revista medico-chirurgicala a Societatii de Medici si Naturalisti din Iasi,0048-7848 (Print) 0048-7848,118,1,,39-44,"{""Rostlk M."",""Sjmbrev__ V.L."",""[jsfolexja P."",""Eujocqgh A.X.""}"
738322,Classification of autogenous skull grafts in cranial reconstruction,eng,-1,The Journal of the Oklahoma State Medical Association,0030-1876 (Print) 0030-1876,86,?,1/1/93,327-32,"{""S. Pelofsky"",""P. D. Hunter""}"
934177,An Assessment of Voluntary Adolescent Mental Health Screening and Referral in a Children's Hospital Emergency Department,,,,,0,0,,,
351534,Implementing participatory intervention and research in communities: lessons from the Kahnawake Schools Diabetes Prevention Project in Canada,hsilgnE,Social Science and Medicine,,,56,6,1/3/01,1295-1305,"{""T Delormier"",""A C Macaulay"",""M Cargo"",""A M McComber"",""L Potvin""}"
872389,Bile acid metabolism by fresh human colonic contents: a comparison of caecal versus faecal samples.,eng,Gut,Gut,?,49,6,,835-42,?
499983,The role of viral infection in pulmonary exacerbations of     bronchiectasis in adults: a prospective study,English,Chest,,,147,?,1/15/01,1635-1643,"{""Gao YH"",""Lin ZY"",""Zhang GJ"",""Zhong NS"",""Chen RC"",""Gao Y"",""Tang Y"",""Lin ZM"",""Xu G"",""Li HM"",""Guan WJ""}"
452432,Feverfew (Tanacetum parthenium L.): A systematic review.,,,,,0,0,,,{NULL}
320139,,Some college,,,,16,01,1/12/01,1331-4,
